会員ID,登録施設,性別,生まれ年,回答時の年齢,年代,都道府県,会員市町村,世帯年収,UA,回答日時,回答月,回答エリア,回答エリア2,市町村,6分類,DMO,宿泊数（全体）,宿泊数（県内）,宿泊エリア（県内）,宿泊エリア（県外）,同行者,訪問目的ALL,宿でのんびり過ごす,温泉や露天風呂,地元の美味しいものを食べる,花見や紅葉などの自然鑑賞,名所、旧跡の観光,テーマパーク（遊園地、動物園、博物館など）,買い物、アウトレット,お祭りやイベントへの参加・見物,スポーツ観戦や芸能鑑賞（コンサート等）,アウトドア（海水浴、釣り、登山など）,まちあるき、都市散策,各種体験（手作り、果物狩りなど）,スキー・スノボ、マリンスポーツ,その他スポーツ（ゴルフ、テニスなど）,ドライブ・ツーリング,友人・親戚を尋ねる,出張など仕事関係,その他,情報収集ALL,観光展・物産展,新聞・雑誌・ガイドブック,TV・ラジオ番組やCM,観光パンフレット・ポスター,観光連盟やDMOのHP,インターネット・アプリ,Twitter,Instagram,Facebook,ブログ,友人・知人,観光協会等の案内所,タクシードライバーや地元の人,宿泊施設,福井県までの交通手段ALL,自家用車,レンタカー,新幹線,在来線,飛行機,旅行会社ツアーバス,県外から訪れていない（福井県在住）,福井県内での交通手段ALL,タクシー,路線バス,徒歩,レンタサイクル,福井県内での交通手段の満足度,福井県内での交通手段の満足度の理由,宿泊費,交通費,県内消費額,エリア訪問回数,アンケート回答前に訪問した主な場所,アンケート回答前に訪問した主な場所FA,アンケート回答後に訪問する予定の主な場所,アンケート回答後に訪問する予定の主な場所FA,エリア総消費額,満足度,満足度の理由,不便さ,不便さの内容,NPS,推奨項目,施設に求めるもの,今後の来訪意向,福井県に求めるもの,登録エリア,満足度(商品・サービス),満足度(商品・サービス)の理由
120473,web,女,1958,64,60代,福井県,坂井市,100万円未満,mobile/android,2022-10-22 16:19:09,10月,一乗谷朝倉氏遺跡 エリア,01.一乗谷朝倉氏遺跡 エリア,福井市,福井市・永平寺町,,日帰り,福井県内には宿泊しない,福井県内には宿泊しない,福井県外には宿泊しない,友人,"名所、旧跡の観光
まちあるき、都市散策
",0,0,0,0,1,0,0,0,0,0,1,0,0,0,0,0,0,0,"TV・ラジオ番組やCM
",0,0,1,0,0,0,0,0,0,0,0,0,0,0,"県外から訪れていない（福井県在住）
",1,0,0,0,0,0,1,"自家用車
",0,0,0,0,,,"1,000円以上 3,000円未満","1,000円以上 3,000円未満","1,000円以上 3,000円未満",2～5回目,選択なし/該当施設なし,,選択なし/該当施設なし,,"1,000円以上 3,000円未満",満足,詳しく朝倉歴史博物館で朝倉氏の事が分かりました,感じなかった,,8,とても見所が沢山あるので良いと思う,リーズナブルな値段で食べられると思う,福井県在住,特産品をもっとピーアールした方が良いと思う,,,
120473,web,女,1958,64,60代,福井県,坂井市,100万円未満,mobile/android,2022-11-07 17:32:45,11月,JA福井県ファーマーズマーケットきららの丘 エリア,13.JA福井県ファーマーズマーケットきららの丘 エリア,あわら市,あわら市・坂井市,,日帰り,1泊,三国・あわらエリア（あわら市・坂井市）,石川県加賀市,夫婦2人,"買い物、アウトレット
まちあるき、都市散策
",0,0,0,0,0,0,1,0,0,0,1,0,0,0,0,0,0,0,"観光パンフレット・ポスター
",0,0,0,1,0,0,0,0,0,0,0,0,0,0,"県外から訪れていない（福井県在住）
",1,0,0,0,0,0,1,"自家用車
",0,0,0,0,満足,買い物した荷物を運ぶのに便利だから,"10,000円以上 20,000円未満","3,000円以上 5,000円未満","3,000円以上 5,000円未満",11回目以上,選択なし/該当施設なし,,選択なし/該当施設なし,,"1,000円以上 3,000円未満",満足,新鮮で安い物があるので,感じなかった,,6,新鮮な野菜や果物があるので,農薬を減らした有機野菜があると良い,機会があれば行きたい,旬で新鮮な食材,,,
120473,,女,1958,65,60代,福井県,坂井市,100万円未満,mobile/android,2023-06-04 18:28:29,6月,三国湊 エリア,09.三国湊 エリア,坂井市,あわら市・坂井市,(一社)DMOさかい観光局,1泊,1泊,三国・あわらエリア（あわら市・坂井市）,福井県外には宿泊しない,親,"宿でのんびり過ごす
温泉や露天風呂
地元の美味しいものを食べる
買い物、アウトレット
",1,1,1,0,0,0,1,0,0,0,0,0,0,0,0,0,0,0,"TV・ラジオ番組やCM
観光パンフレット・ポスター
",0,0,1,1,0,0,0,0,0,0,0,0,0,0,"県外から訪れていない（福井県在住）
",1,0,0,0,0,0,1,"自家用車
",0,0,0,0,,,"10,000円以上 20,000円未満","5,000円以上 10,000円未満","3,000円以上 5,000円未満",2～5回目,選択なし/該当施設なし,,選択なし/該当施設なし,,"5,000円以上 10,000円未満",満足,温泉が、気持ち良かった,感じなかった,,5,観光に向いている場所,旬の物や新鮮な食材を食べられた,また行きたい（1年以内）,地元の物を買いたい,web,満足,海産物
120473,,女,1958,65,60代,福井県,坂井市,100万円未満,mobile/android,2023-07-22 18:56:28,7月,道の駅「越前おおの荒島の郷」 エリア,22.道の駅「越前おおの荒島の郷」 エリア,大野市,勝山市・大野市,,日帰り,福井県内には宿泊しない,福井県内には宿泊しない,福井県外には宿泊しない,団体旅行,"まちあるき、都市散策
",0,0,0,0,0,0,0,0,0,0,1,0,0,0,0,0,0,地区のまちづくり協議会の行事,"その他
",0,0,0,0,0,0,0,0,0,0,0,0,0,0,"県外から訪れていない（福井県在住）
",0,0,0,0,0,1,1,"旅行会社ツアーバス
",0,0,0,0,満足,キレイな施設で、品物も豊富にあった,"5,000円以上 10,000円未満","1,000円以上 3,000円未満","1,000円以上 3,000円未満",初めて,安田かまぼこ道場,,選択なし/該当施設なし,,"1,000円以上 3,000円未満",満足,子供の遊び場もあるので,感じなかった,,8,商品が豊富で手頃な値段,食事するスペースがもっと増えると良い,また行きたい（1年以内）,新鮮で地元産の食べ物,web,満足,大野の特産品や野菜が豊富
120473,,女,1958,65,60代,福井県,坂井市,100万円未満,mobile/android,2023-09-11 15:41:07,9月,フルーツライン エリア,18.フルーツライン エリア,あわら市,あわら市・坂井市,,日帰り,福井県内には宿泊しない,福井県内には宿泊しない,福井県外には宿泊しない,その他家族,"買い物、アウトレット
",0,0,0,0,0,0,1,0,0,0,0,0,0,0,0,0,0,0,"新聞・雑誌・ガイドブック
",0,1,0,0,0,0,0,0,0,0,0,0,0,0,"自家用車
",1,0,0,0,0,0,0,"自家用車
",0,0,0,0,満足,野菜や果物が新しいので,"5,000円以上 10,000円未満","3,000円以上 5,000円未満","5,000円以上 10,000円未満",11回目以上,三国サンセットビーチ,,選択なし/該当施設なし,,"3,000円以上 5,000円未満",満足,,感じなかった,,8,野菜や果物が安くて新鮮です,米、果物、サツマイモ,機会があれば行きたい,,web,満足,野菜の苗も沢山有るので
120473,,女,1958,65,60代,福井県,坂井市,100万円未満,mobile/android,2023-09-11 15:35:09,9月,三国湊 エリア,09.三国湊 エリア,坂井市,あわら市・坂井市,(一社)DMOさかい観光局,日帰り,福井県内には宿泊しない,福井県内には宿泊しない,福井県外には宿泊しない,その他家族,"買い物、アウトレット
",0,0,0,0,0,0,1,0,0,0,0,0,0,0,0,0,0,0,"新聞・雑誌・ガイドブック
",0,1,0,0,0,0,0,0,0,0,0,0,0,0,"自家用車
",1,0,0,0,0,0,0,"自家用車
",0,0,0,0,満足,温泉が良いので,"5,000円以上 10,000円未満","3,000円以上 5,000円未満","5,000円以上 10,000円未満",6～10回目,選択なし/該当施設なし,越前たかす荘,選択なし/該当施設なし,,"1,000円以上 3,000円未満",満足,,感じなかった,,8,,海産物、蕎麦,機会があれば行きたい,米、蕎麦、花火大会,web,満足,軽食が有るので便利です
120473,,女,1958,65,60代,福井県,坂井市,100万円未満,mobile/android,2023-09-11 15:26:35,9月,越前海岸 北部 エリア,07.越前海岸 北部 エリア,福井市,福井市・永平寺町,,日帰り,福井県内には宿泊しない,福井県内には宿泊しない,福井県外には宿泊しない,その他家族,"温泉や露天風呂
買い物、アウトレット
",0,1,0,0,0,0,1,0,0,0,0,0,0,0,0,0,0,0,"観光展・物産展
新聞・雑誌・ガイドブック
",1,1,0,0,0,0,0,0,0,0,0,0,0,0,"自家用車
",1,0,0,0,0,0,0,"自家用車
",0,0,0,0,とても満足,,"5,000円以上 10,000円未満","3,000円以上 5,000円未満","5,000円以上 10,000円未満",2～5回目,選択なし/該当施設なし,,選択なし/該当施設なし,,"5,000円以上 10,000円未満",満足,景色が良い,感じなかった,,8,温泉が良い,海産物,機会があれば行きたい,越前蕎麦,web,満足,温泉の泉質が良い
