会員ID,登録エリア,性別,生まれ年,回答時の年齢,年代,都道府県,会員市町村,世帯年収,UA,回答日時,回答月,回答エリア,回答エリア2,市町村,6分類,DMO,宿泊数（全体）,宿泊数（県内）,宿泊エリア（県内）,宿泊エリア（県外）,同行者,訪問目的ALL,宿でのんびり過ごす,温泉や露天風呂,地元の美味しいものを食べる,花見や紅葉などの自然鑑賞,名所、旧跡の観光,テーマパーク（遊園地、動物園、博物館など）,買い物、アウトレット,お祭りやイベントへの参加・見物,スポーツ観戦や芸能鑑賞（コンサート等）,アウトドア（海水浴、釣り、登山など）,まちあるき、都市散策,各種体験（手作り、果物狩りなど）,スキー・スノボ、マリンスポーツ,その他スポーツ（ゴルフ、テニスなど）,ドライブ・ツーリング,友人・親戚を尋ねる,出張など仕事関係,その他,福井県までの交通手段ALL,自家用車,レンタカー,新幹線,在来線,飛行機,旅行会社ツアーバス,県外から訪れていない（福井県在住）,福井県内での交通手段ALL,タクシー,路線バス,徒歩,レンタサイクル,福井県内での交通手段の満足度,福井県内での交通手段の満足度の理由,宿泊費,交通費,県内消費額,エリア訪問回数,情報収集ALL,観光展・物産展,新聞・雑誌・ガイドブック,TV・ラジオ番組やCM,観光パンフレット・ポスター,観光連盟やDMOのHP,インターネット・アプリ,Twitter,Instagram,Facebook,ブログ,友人・知人,観光協会等の案内所,タクシードライバーや地元の人,宿泊施設,アンケート回答前に訪問した主な場所,アンケート回答前に訪問した主な場所FA,アンケート回答後に訪問する予定の主な場所,エリア総消費額,満足度(商品・サービス),満足度(商品・サービス)の理由,満足度,満足度の理由,不便さ,不便さの内容,NPS,推奨項目,施設に求めるもの,今後の来訪意向,福井県に求めるもの
142902,金ヶ崎 エリア,男,2014,9,10歳未満,兵庫県,神戸市東灘区,分からない/無回答,pc/others,2023-09-03 11:24:10,9月,金ヶ崎 エリア,64.金ヶ崎 エリア,敦賀市,嶺南東部,,日帰り,福井県内には宿泊しない,福井県内には宿泊しない,福井県外には宿泊しない,親,"地元の美味しいものを食べる
花見や紅葉などの自然鑑賞
名所、旧跡の観光
テーマパーク（遊園地、動物園、博物館など）
買い物、アウトレット
お祭りやイベントへの参加・見物
まちあるき、都市散策
",0,0,1,1,1,1,1,1,0,0,1,0,0,0,0,0,0,0,"在来線
",0,0,0,0,0,0,0,"路線バス
徒歩
",0,1,1,0,とても満足,"ぐるっと敦賀周遊バスの観光案内がとても分かりやすかった。次にまた行きたいところが増えた。
バス停に恐竜のオブジェがいたのは腰を抜かして面白かった。",使わない,"1,000円以上 3,000円未満","10,000円以上 20,000円未満",初めて,"観光パンフレット・ポスター
インターネット・アプリ
",0,0,0,1,0,1,0,0,0,0,0,0,0,0,敦賀駅,,気比の松原,"1,000円以上 3,000円未満",とても満足,どこへ行っても親切にしていただきました。,とても満足,ジオラマが、工作の参考になった。古い建物や線路、キハ28の車両など、ゆっくり見ることができてとてもよかった。,感じた,自動販売機のおつりがなくて、飲み物を買えなかった。ランプ小屋がどこにあるのか分からなかった。,10,鉄道好きにはとても魅力的な場所だったから。,テイクアウトできる食べ物が物足りなかった。,また行きたい（1年以内）,敦賀駅にはいろいろなお土産が買いやすく気に入りましたが、福井市や石川のものなども買えるとより買い物が楽しくなると思います。
