会員ID,登録エリア,性別,生まれ年,回答時の年齢,年代,都道府県,会員市町村,世帯年収,UA,回答日時,回答月,回答エリア,回答エリア2,市町村,6分類,DMO,宿泊数（全体）,宿泊数（県内）,宿泊エリア（県内）,宿泊エリア（県外）,同行者,訪問目的ALL,宿でのんびり過ごす,温泉や露天風呂,地元の美味しいものを食べる,花見や紅葉などの自然鑑賞,名所、旧跡の観光,テーマパーク（遊園地、動物園、博物館など）,買い物、アウトレット,お祭りやイベントへの参加・見物,スポーツ観戦や芸能鑑賞（コンサート等）,アウトドア（海水浴、釣り、登山など）,まちあるき、都市散策,各種体験（手作り、果物狩りなど）,スキー・スノボ、マリンスポーツ,その他スポーツ（ゴルフ、テニスなど）,ドライブ・ツーリング,友人・親戚を尋ねる,出張など仕事関係,その他,福井県までの交通手段ALL,自家用車,レンタカー,新幹線,在来線,飛行機,旅行会社ツアーバス,県外から訪れていない（福井県在住）,福井県内での交通手段ALL,タクシー,路線バス,徒歩,レンタサイクル,福井県内での交通手段の満足度,福井県内での交通手段の満足度の理由,宿泊費,交通費,県内消費額,エリア訪問回数,情報収集ALL,観光展・物産展,新聞・雑誌・ガイドブック,TV・ラジオ番組やCM,観光パンフレット・ポスター,観光連盟やDMOのHP,インターネット・アプリ,Twitter,Instagram,Facebook,ブログ,友人・知人,観光協会等の案内所,タクシードライバーや地元の人,宿泊施設,アンケート回答前に訪問した主な場所,アンケート回答前に訪問した主な場所FA,アンケート回答後に訪問する予定の主な場所,エリア総消費額,満足度(商品・サービス),満足度(商品・サービス)の理由,満足度,満足度の理由,不便さ,不便さの内容,NPS,推奨項目,施設に求めるもの,今後の来訪意向,福井県に求めるもの
145961,名勝 養浩館庭園 エリア,女,1964,59,50代,福井県,福井市,600万円以上 700万円未満,mobile/iphone,2023-10-29 11:43:09,10月,名勝 養浩館庭園 エリア,04.名勝 養浩館庭園 エリア,福井市,福井市・永平寺町,,日帰り,福井県内には宿泊しない,福井県内には宿泊しない,福井県外には宿泊しない,自分ひとり,"各種体験（手作り、果物狩りなど）
",0,0,0,0,0,0,0,0,0,0,0,1,0,0,0,0,0,0,"県外から訪れていない（福井県在住）
",0,0,0,0,0,0,1,"その他
",0,0,0,0,どちらでもない,バスのスタッフさん。笑っていただきたかったです。,使わない,"1,000円以上 3,000円未満","1,000円以上 3,000円未満",11回目以上,"新聞・雑誌・ガイドブック
観光パンフレット・ポスター
",0,1,0,1,0,0,0,0,0,0,0,0,0,0,選択なし/該当施設なし,,白山平泉寺歴史探遊館 まほろば,使わない,満足,綺麗で充実した施設でした。スタッフさんもわかりやすく説明してくださいました。,満足,,感じなかった,,10,ようこうかんは、他県の庭園と比べても、絶対引けをとりません。おススメです。,オシャレな飲食店は少ないですね。お土産は特に今のままでもいいかと思います。,福井県在住,福井特産物を生かした、食べ歩きできそうな美味しいもの。明るい雰囲気の、テーマが統一された街並み。など、もう少し力を入れてもいいかなと思います。恐竜はもっと活用してください。
145961,名勝 養浩館庭園 エリア,女,1964,59,50代,福井県,福井市,600万円以上 700万円未満,mobile/iphone,2023-11-03 17:14:31,11月,福井駅前 エリア,01.福井駅前 エリア,福井市,福井市・永平寺町,,日帰り,福井県内には宿泊しない,福井県内には宿泊しない,福井県外には宿泊しない,自分ひとり,"お祭りやイベントへの参加・見物
",0,0,0,0,0,0,0,1,0,0,0,0,0,0,0,0,0,0,"県外から訪れていない（福井県在住）
",1,0,0,0,0,0,1,"自家用車
徒歩
",0,0,1,0,,,"1,000円未満","1,000円未満","3,000円以上 5,000円未満",11回目以上,"観光パンフレット・ポスター
インターネット・アプリ
",0,0,0,1,0,1,0,0,0,0,0,0,0,0,福井駅,,選択なし/該当施設なし,"3,000円以上 5,000円未満",とても満足,,とても満足,,感じた,アーケード街や歩道で、すれ違う歩行者の方と、クロスして歩きにくさを感じました。,10,ハピテラスのイベント,,福井県在住,
145961,名勝 養浩館庭園 エリア,女,1964,59,50代,福井県,福井市,600万円以上 700万円未満,mobile/iphone,2023-11-11 07:33:10,11月,名勝 養浩館庭園 エリア,04.名勝 養浩館庭園 エリア,福井市,福井市・永平寺町,,日帰り,福井県内には宿泊しない,福井県内には宿泊しない,福井県外には宿泊しない,自分ひとり,"まちあるき、都市散策
",0,0,0,0,0,0,0,0,0,0,1,0,0,0,0,0,0,0,"県外から訪れていない（福井県在住）
",0,0,0,0,0,0,1,"徒歩
",0,0,1,0,,,"1,000円未満",使わない,使わない,11回目以上,"新聞・雑誌・ガイドブック
Facebook
観光協会等の案内所
",0,1,0,0,0,0,0,0,1,0,0,1,0,0,選択なし/該当施設なし,,選択なし/該当施設なし,使わない,満足,,満足,,感じなかった,,9,,,福井県在住,街の統一された雰囲気があると、素敵だと思います。また、他県で、公共交通機関の関係者の方の対応が、杜撰で、ガッカリしたことあって、我が街は！と思っています。福井県に好感を持って欲しいです。
