会員ID,登録施設,性別,生まれ年,回答時の年齢,年代,都道府県,会員市町村,世帯年収,UA,回答日時,回答月,回答エリア,回答エリア2,市町村,6分類,DMO,宿泊数（全体）,宿泊数（県内）,宿泊エリア（県内）,宿泊エリア（県外）,同行者,訪問目的ALL,宿でのんびり過ごす,温泉や露天風呂,地元の美味しいものを食べる,花見や紅葉などの自然鑑賞,名所、旧跡の観光,テーマパーク（遊園地、動物園、博物館など）,買い物、アウトレット,お祭りやイベントへの参加・見物,スポーツ観戦や芸能鑑賞（コンサート等）,アウトドア（海水浴、釣り、登山など）,まちあるき、都市散策,各種体験（手作り、果物狩りなど）,スキー・スノボ、マリンスポーツ,その他スポーツ（ゴルフ、テニスなど）,ドライブ・ツーリング,友人・親戚を尋ねる,出張など仕事関係,その他,情報収集ALL,観光展・物産展,新聞・雑誌・ガイドブック,TV・ラジオ番組やCM,観光パンフレット・ポスター,観光連盟やDMOのHP,インターネット・アプリ,Twitter,Instagram,Facebook,ブログ,友人・知人,観光協会等の案内所,タクシードライバーや地元の人,宿泊施設,福井県までの交通手段ALL,自家用車,レンタカー,新幹線,在来線,飛行機,旅行会社ツアーバス,県外から訪れていない（福井県在住）,福井県内での交通手段ALL,タクシー,路線バス,徒歩,レンタサイクル,福井県内での交通手段の満足度,福井県内での交通手段の満足度の理由,宿泊費,交通費,県内消費額,エリア訪問回数,アンケート回答前に訪問した主な場所,アンケート回答前に訪問した主な場所FA,アンケート回答後に訪問する予定の主な場所,アンケート回答後に訪問する予定の主な場所FA,エリア総消費額,満足度,満足度の理由,不便さ,不便さの内容,NPS,推奨項目,施設に求めるもの,今後の来訪意向,福井県に求めるもの,登録エリア,満足度(商品・サービス),満足度(商品・サービス)の理由
107600,道の駅「越前おおの荒島の郷」 エリア,女,1969,53,50代,三重県,鈴鹿市,600万円以上 700万円未満,mobile/android,2022-06-25 10:01:01,6月,道の駅「越前おおの荒島の郷」 エリア,16.道の駅「越前おおの荒島の郷」 エリア,大野市,勝山市・大野市,,1泊,1泊,越前エリア（越前市・越前町・鯖江市・池田町・南越前町）,福井県外には宿泊しない,夫婦2人,"温泉や露天風呂
地元の美味しいものを食べる
花見や紅葉などの自然鑑賞
その他
",0,1,1,1,0,0,0,0,0,0,0,0,0,0,0,0,0,0,"観光連盟やDMOのHP
",0,0,0,0,1,0,0,0,0,0,0,0,0,0,"自家用車
",1,0,0,0,0,0,0,"自家用車
",0,0,0,0,選択肢なし,,使わない,"10,000円以上 20,000円未満","5,000円以上 10,000円未満",6～10回目,選択なし/該当施設なし,黒谷の防雪壁、一乗滝,選択なし/該当施設なし,決めていない,"1,000円以上 3,000円未満",とても満足,,感じなかった,,10,,,また行きたい（1年以内）,魚介,,,
107600,,女,1969,54,50代,三重県,鈴鹿市,600万円以上 700万円未満,mobile/android,2023-06-24 12:18:01,6月,道の駅みくに ふれあいパーク三里浜 エリア,15.道の駅みくに ふれあいパーク三里浜 エリア,坂井市,あわら市・坂井市,(一社)DMOさかい観光局,1泊,福井県内には宿泊しない,福井県内には宿泊しない,滋賀県,夫婦2人,"地元の美味しいものを食べる
花見や紅葉などの自然鑑賞
名所、旧跡の観光
その他
",0,0,1,1,1,0,0,0,0,0,0,0,0,0,0,0,0,0,"インターネット・アプリ
",0,0,0,0,0,1,0,0,0,0,0,0,0,0,"自家用車
",1,0,0,0,0,0,0,"自家用車
",0,0,0,0,,,使わない,"10,000円以上 20,000円未満","5,000円以上 10,000円未満",初めて,大安禅寺,三国ラベンダーファーム,選択なし/該当施設なし,,"1,000円未満",満足,駐車場で木陰になる場所が少ないので日陰がほしいです。,感じなかった,,9,"福井はのんびりしていて落ちつきます。
カニがない季節も魅力的な場所が多いので何度でも来たいです。",,また行きたい（1年以内）,"越前がにが高くなりすぎ。
せいこも高い。
もう少し安いと助かります。",道の駅「越前おおの荒島の郷」 エリア,満足,"PayPayが使えるのでありがたい。
その場で買って食べられる小分けの地元のお菓子がもっとあるといいと思います。
トイレは手洗い石鹸がほしいです。"
