会員ID,登録エリア,性別,生まれ年,回答時の年齢,年代,都道府県,会員市町村,世帯年収,UA,回答日時,回答月,回答エリア,回答エリア2,市町村,6分類,DMO,宿泊数（全体）,宿泊数（県内）,宿泊エリア（県内）,宿泊エリア（県外）,同行者,訪問目的ALL,宿でのんびり過ごす,温泉や露天風呂,地元の美味しいものを食べる,花見や紅葉などの自然鑑賞,名所、旧跡の観光,テーマパーク（遊園地、動物園、博物館など）,買い物、アウトレット,お祭りやイベントへの参加・見物,スポーツ観戦や芸能鑑賞（コンサート等）,アウトドア（海水浴、釣り、登山など）,まちあるき、都市散策,各種体験（手作り、果物狩りなど）,スキー・スノボ、マリンスポーツ,その他スポーツ（ゴルフ、テニスなど）,ドライブ・ツーリング,友人・親戚を尋ねる,出張など仕事関係,その他,福井県までの交通手段ALL,自家用車,レンタカー,新幹線,在来線,飛行機,旅行会社ツアーバス,県外から訪れていない（福井県在住）,福井県内での交通手段ALL,タクシー,路線バス,徒歩,レンタサイクル,福井県内での交通手段の満足度,福井県内での交通手段の満足度の理由,宿泊費,交通費,県内消費額,エリア訪問回数,情報収集ALL,観光展・物産展,新聞・雑誌・ガイドブック,TV・ラジオ番組やCM,観光パンフレット・ポスター,観光連盟やDMOのHP,インターネット・アプリ,Twitter,Instagram,Facebook,ブログ,友人・知人,観光協会等の案内所,タクシードライバーや地元の人,宿泊施設,アンケート回答前に訪問した主な場所,アンケート回答前に訪問した主な場所FA,アンケート回答後に訪問する予定の主な場所,エリア総消費額,満足度(商品・サービス),満足度(商品・サービス)の理由,満足度,満足度の理由,不便さ,不便さの内容,NPS,推奨項目,施設に求めるもの,今後の来訪意向,福井県に求めるもの
149486,越前海岸 越前岬 エリア,無回答,1969,55,50代,愛知県,北名古屋市,700万円以上 800万円未満,mobile/iphone,2024-01-09 22:36:23,1月,越前海岸 越前岬 エリア,53.越前海岸 越前岬 エリア,越前町,丹南,一般社団法人 越前町観光連盟,1泊,1泊,越前エリア（越前市・越前町・鯖江市・池田町・南越前町）,福井県外には宿泊しない,中学生以上連れの家族,"温泉や露天風呂
地元の美味しいものを食べる
花見や紅葉などの自然鑑賞
名所、旧跡の観光
その他
",0,1,1,1,1,0,0,0,0,0,0,0,0,0,0,0,0,0,"自家用車
",1,0,0,0,0,0,0,"自家用車
",0,0,0,0,,,"10,000円以上 20,000円未満","1,000円以上 3,000円未満","5,000円以上 10,000円未満",初めて,"観光パンフレット・ポスター
観光連盟やDMOのHP
",0,0,0,1,1,0,0,0,0,0,0,0,0,0,人道の港 敦賀ムゼウム,紫式部の館　庭園,選択なし/該当施設なし,"3,000円以上 5,000円未満",とても満足,,とても満足,"今庄宿の案内が少なく、事前にお店の当日の営業日時が分からなかった。
日本酒を買いたかったので、宿のフロントで道の駅で買えると聞いたので、道の駅に行った。宿で聞いてよかったと思う。、",感じなかった,,8,温泉と現地で飲む普段は入手困難なお酒も飲めて、冬の水ようかんなどのオヤツも美味しい、辛味大根のそば、魚介類も美味しく、へしこも美味しい、酒粕も豆腐も厚揚げも、大根も、麹つけの魚の切り身も、酒も買って帰れば自宅で旅の余韻が楽しめる。落ち着いた雰囲気で休まる。,古の歴史、落ち着いた街並み、地元の産品、酒など,また行きたい（1年以内）,蟹以外にも、お魚は美味しい、200年位続く酒蔵がたくさんあり、そばもオロシ大根が美味しい、天ぷらも美味しい。お肉も本当は美味しいが今回は食べられなかった。越前の海鮮丼のパンフには定義が書いてあり、安心だった。水ようかんは、どこで買うと良いか、(道の駅以外で街歩き中に)などの情報がWEBで簡単に見つかるともっと楽しくなると思った。
