会員ID,登録エリア,性別,生まれ年,回答時の年齢,年代,都道府県,会員市町村,世帯年収,UA,回答日時,回答月,回答エリア,回答エリア2,市町村,6分類,DMO,宿泊数（全体）,宿泊数（県内）,宿泊エリア（県内）,宿泊エリア（県外）,同行者,訪問目的ALL,宿でのんびり過ごす,温泉や露天風呂,地元の美味しいものを食べる,花見や紅葉などの自然鑑賞,名所、旧跡の観光,テーマパーク（遊園地、動物園、博物館など）,買い物、アウトレット,お祭りやイベントへの参加・見物,スポーツ観戦や芸能鑑賞（コンサート等）,アウトドア（海水浴、釣り、登山など）,まちあるき、都市散策,各種体験（手作り、果物狩りなど）,スキー・スノボ、マリンスポーツ,その他スポーツ（ゴルフ、テニスなど）,ドライブ・ツーリング,友人・親戚を尋ねる,出張など仕事関係,その他,福井県までの交通手段ALL,自家用車,レンタカー,新幹線,在来線,飛行機,旅行会社ツアーバス,県外から訪れていない（福井県在住）,福井県内での交通手段ALL,タクシー,路線バス,徒歩,レンタサイクル,福井県内での交通手段の満足度,福井県内での交通手段の満足度の理由,宿泊費,交通費,県内消費額,エリア訪問回数,情報収集ALL,観光展・物産展,新聞・雑誌・ガイドブック,TV・ラジオ番組やCM,観光パンフレット・ポスター,観光連盟やDMOのHP,インターネット・アプリ,Twitter,Instagram,Facebook,ブログ,友人・知人,観光協会等の案内所,タクシードライバーや地元の人,宿泊施設,アンケート回答前に訪問した主な場所,アンケート回答前に訪問した主な場所FA,アンケート回答後に訪問する予定の主な場所,エリア総消費額,満足度(商品・サービス),満足度(商品・サービス)の理由,満足度,満足度の理由,不便さ,不便さの内容,NPS,推奨項目,施設に求めるもの,今後の来訪意向,福井県に求めるもの
149787,道の駅「越前」 エリア,女,1968,56,50代,滋賀県,大津市,分からない/無回答,mobile/iphone,2024-01-25 13:17:06,1月,道の駅「越前」 エリア,49.道の駅「越前」 エリア,越前町,丹南,一般社団法人 越前町観光連盟,日帰り,福井県内には宿泊しない,越前エリア（越前市・越前町・鯖江市・池田町・南越前町）,滋賀県,自分ひとり,"温泉や露天風呂
地元の美味しいものを食べる
ドライブ・ツーリング
",0,1,1,0,0,0,0,0,0,0,0,0,0,0,1,0,0,0,"自家用車
",1,0,0,0,0,0,0,"自家用車
",0,0,0,0,とても満足,フリー時間はストレス無し。景色を満喫できる。,"30,000円以上 40,000円未満","3,000円以上 5,000円未満","20,000円以上 30,000円未満",11回目以上,"友人・知人
タクシードライバーや地元の人
",0,0,0,0,0,0,0,0,0,0,1,0,1,0,選択なし/該当施設なし,道の駅「越前」は一日ゆっくりできる。リセットする時にいく,選択なし/該当施設なし,"30,000円以上 40,000円未満",満足,買い物、食事、お風呂と一日ゆっくりでるのが良い。景色も最高！夕陽をみて露天風呂は大変気持ちがよい。,満足,お風呂は地元の人が多い。静かに入浴したいが、時間帯によっては賑やか､､,感じた,"食事。軽食がない､､
横になれる休憩場所がない。有料､､
喫煙が外のみ､､",3,前はプールもあったから薦められたが、今は普通。遠方からわざわざ行く特別なモノがなく、数回で飽きるかな。,お風呂、定期的に掃除してもらいたい。もう少し清潔にしてほしい。入れ墨タトゥーの指摘かねて！,機会があれば行きたい,"お魚美味しい！
簡単、気軽に新鮮な魚を定期に購入できるルートあればいいな～"
