会員ID,登録エリア,性別,生まれ年,回答時の年齢,年代,都道府県,会員市町村,世帯年収,UA,回答日時,回答月,回答エリア,回答エリア2,市町村,6分類,DMO,宿泊数（全体）,宿泊数（県内）,宿泊エリア（県内）,宿泊エリア（県外）,同行者,訪問目的ALL,宿でのんびり過ごす,温泉や露天風呂,地元の美味しいものを食べる,花見や紅葉などの自然鑑賞,名所、旧跡の観光,テーマパーク（遊園地、動物園、博物館など）,買い物、アウトレット,お祭りやイベントへの参加・見物,スポーツ観戦や芸能鑑賞（コンサート等）,アウトドア（海水浴、釣り、登山など）,まちあるき、都市散策,各種体験（手作り、果物狩りなど）,スキー・スノボ、マリンスポーツ,その他スポーツ（ゴルフ、テニスなど）,ドライブ・ツーリング,友人・親戚を尋ねる,出張など仕事関係,その他,福井県までの交通手段ALL,自家用車,レンタカー,新幹線,在来線,飛行機,旅行会社ツアーバス,県外から訪れていない（福井県在住）,福井県内での交通手段ALL,タクシー,路線バス,徒歩,レンタサイクル,福井県内での交通手段の満足度,福井県内での交通手段の満足度の理由,宿泊費,交通費,県内消費額,エリア訪問回数,情報収集ALL,観光展・物産展,新聞・雑誌・ガイドブック,TV・ラジオ番組やCM,観光パンフレット・ポスター,観光連盟やDMOのHP,インターネット・アプリ,Twitter,Instagram,Facebook,ブログ,友人・知人,観光協会等の案内所,タクシードライバーや地元の人,宿泊施設,アンケート回答前に訪問した主な場所,アンケート回答前に訪問した主な場所FA,アンケート回答後に訪問する予定の主な場所,エリア総消費額,満足度(商品・サービス),満足度(商品・サービス)の理由,満足度,満足度の理由,不便さ,不便さの内容,NPS,推奨項目,施設に求めるもの,今後の来訪意向,福井県に求めるもの
138709,大本山 永平寺 エリア,女,1961,62,60代,大阪府,茨木市,分からない/無回答,mobile/iphone,2023-07-18 20:24:39,7月,福井駅前 エリア（宿泊施設）,02.福井駅前 エリア（宿泊施設）,福井市,福井市・永平寺町,,1泊,1泊,福井エリア（福井市・永平寺町）,福井県外には宿泊しない,その他家族,"名所、旧跡の観光
",0,0,0,0,1,0,0,0,0,0,0,0,0,0,0,0,0,0,"在来線
",0,0,0,1,0,0,0,"在来線
",0,0,0,0,とても満足,意外に近かったから,"5,000円以上 10,000円未満","5,000円以上 10,000円未満","10,000円以上 20,000円未満",初めて,"インターネット・アプリ
",0,0,0,0,0,1,0,0,0,0,0,0,0,0,大本山永平寺,,選択なし/該当施設なし,"5,000円以上 10,000円未満",満足,朝食が改悪したとの噂があるから,満足,朝食の件でマイナス1,感じなかった,,9,近くて清潔なこと。,早く駅前の改装工事が済んで欲しい,また行きたい（1年以内）,もっと宣伝してください
138709,大本山 永平寺 エリア,女,1961,62,60代,大阪府,茨木市,分からない/無回答,mobile/iphone,2023-07-18 15:16:34,7月,福井駅前 エリア,01.福井駅前 エリア,福井市,福井市・永平寺町,,1泊,1泊,福井エリア（福井市・永平寺町）,福井県外には宿泊しない,その他家族,"名所、旧跡の観光
",0,0,0,0,1,0,0,0,0,0,0,0,0,0,0,0,0,0,"在来線
",0,0,0,1,0,0,0,"在来線
",0,0,0,0,満足,地元スーパーが改装中だったから,"5,000円以上 10,000円未満","5,000円以上 10,000円未満","10,000円以上 20,000円未満",初めて,"インターネット・アプリ
",0,0,0,0,0,1,0,0,0,0,0,0,0,0,大本山永平寺,,福井県立恐竜博物館,"3,000円以上 5,000円未満",満足,地元スーパーが改装中だから,満足,こじんまりと整っている,感じた,工事中のところ,8,明日一日残っているので。満点になるかも。,改装中のとこほご完成したら今以上によくなると思う,また行きたい（1年以内）,もっと宣伝しましょう。
138709,大本山 永平寺 エリア,女,1961,62,60代,大阪府,茨木市,分からない/無回答,mobile/iphone,2023-07-18 12:54:14,7月,大本山 永平寺 エリア,34.大本山 永平寺 エリア,永平寺町,福井市・永平寺町,,1泊,1泊,福井エリア（福井市・永平寺町）,福井県外には宿泊しない,その他家族,"名所、旧跡の観光
",0,0,0,0,1,0,0,0,0,0,0,0,0,0,0,0,0,0,"在来線
",0,0,0,0,0,0,0,"路線バス
",0,1,0,0,とても満足,一度は来てみたかった大本山永平寺。心が洗われるような、とても良いところでした。,"5,000円以上 10,000円未満","5,000円以上 10,000円未満","10,000円以上 20,000円未満",初めて,"インターネット・アプリ
",0,0,0,0,0,1,0,0,0,0,0,0,0,0,大本山永平寺,,丸岡城,"3,000円以上 5,000円未満",満足,少しアンケートに時間がかかる,とても満足,何も不満な点がないので,感じなかった,,10,清らかな気持ちになって欲しいから,不満な点はありません。もう少し宣伝してもいいかと思います。,また行きたい（1年以内）,もっともっと宣伝しましょう。いいところなんだから。
138709,大本山 永平寺 エリア,女,1961,62,60代,大阪府,茨木市,分からない/無回答,mobile/iphone,2023-07-19 13:48:21,7月,スーベニアショップ ラプトル エリア,25.スーベニアショップ ラプトル エリア,勝山市,勝山市・大野市,勝山市観光まちづくり(株),1泊,1泊,福井エリア（福井市・永平寺町）,福井県外には宿泊しない,その他家族,"名所、旧跡の観光
",0,0,0,0,1,0,0,0,0,0,0,0,0,0,0,0,0,0,"在来線
",0,0,0,0,0,0,0,"路線バス
",0,1,0,0,とても満足,大満足！,"5,000円以上 10,000円未満","5,000円以上 10,000円未満","10,000円以上 20,000円未満",初めて,"インターネット・アプリ
",0,0,0,0,0,1,0,0,0,0,0,0,0,0,福井県立恐竜博物館,,選択なし/該当施設なし,"1,000円以上 3,000円未満",とても満足,いいものを買えたから,とても満足,楽しかったので,感じなかった,,8,少し遠いけれど是非,もっと宣伝しよう,また行きたい（1年以内）,いいところです！
