会員ID,登録施設,性別,生まれ年,回答時の年齢,年代,都道府県,会員市町村,世帯年収,UA,回答日時,回答月,回答エリア,回答エリア2,市町村,6分類,DMO,宿泊数（全体）,宿泊数（県内）,宿泊エリア（県内）,宿泊エリア（県外）,同行者,訪問目的ALL,宿でのんびり過ごす,温泉や露天風呂,地元の美味しいものを食べる,花見や紅葉などの自然鑑賞,名所、旧跡の観光,テーマパーク（遊園地、動物園、博物館など）,買い物、アウトレット,お祭りやイベントへの参加・見物,スポーツ観戦や芸能鑑賞（コンサート等）,アウトドア（海水浴、釣り、登山など）,まちあるき、都市散策,各種体験（手作り、果物狩りなど）,スキー・スノボ、マリンスポーツ,その他スポーツ（ゴルフ、テニスなど）,ドライブ・ツーリング,友人・親戚を尋ねる,出張など仕事関係,その他,情報収集ALL,観光展・物産展,新聞・雑誌・ガイドブック,TV・ラジオ番組やCM,観光パンフレット・ポスター,観光連盟やDMOのHP,インターネット・アプリ,Twitter,Instagram,Facebook,ブログ,友人・知人,観光協会等の案内所,タクシードライバーや地元の人,宿泊施設,福井県までの交通手段ALL,自家用車,レンタカー,新幹線,在来線,飛行機,旅行会社ツアーバス,県外から訪れていない（福井県在住）,福井県内での交通手段ALL,タクシー,路線バス,徒歩,レンタサイクル,福井県内での交通手段の満足度,福井県内での交通手段の満足度の理由,宿泊費,交通費,県内消費額,エリア訪問回数,アンケート回答前に訪問した主な場所,アンケート回答前に訪問した主な場所FA,アンケート回答後に訪問する予定の主な場所,アンケート回答後に訪問する予定の主な場所FA,エリア総消費額,満足度,満足度の理由,不便さ,不便さの内容,NPS,推奨項目,施設に求めるもの,今後の来訪意向,福井県に求めるもの
114280,越前海岸 エリア,女,1957,65,60代,福井県,越前市,200万円以上 300万円未満,mobile/android,2022-09-19 18:54:39,9月,越前海岸 エリア,02.越前海岸 エリア,福井市,福井市・永平寺町,,1泊,1泊,三国・あわらエリア（あわら市・坂井市）,福井県外には宿泊しない,親と兄弟∥姉妹,"温泉や露天風呂
地元の美味しいものを食べる
名所、旧跡の観光
",0,1,1,0,1,0,0,0,0,0,0,0,0,0,0,0,0,0,"観光連盟やDMOのHP
その他
",0,0,0,0,1,0,0,0,0,0,0,0,0,0,"県外から訪れていない（福井県在住）
",1,0,0,0,0,0,1,"自家用車
",0,0,0,0,,,"10,000円以上 20,000円未満","3,000円以上 5,000円未満","5,000円以上 10,000円未満",11回目以上,ふれあいパーク三里浜(道の駅「みくに」),,選択なし/該当施設なし,,"3,000円以上 5,000円未満",満足,新鮮な魚介類が買えたり食事が美味しい,感じなかった,,8,新鮮な魚介類の買い物と美味しい海鮮のお食事,宿泊施設や色んなショップなどの情報が欲しい 足りない,また行きたい（1年以内）,手軽に出来るアクティビティや魅力のあるお土産を開発し、PRして欲しい
114280,越前海岸 エリア,女,1957,65,60代,福井県,越前市,200万円以上 300万円未満,mobile/android,2022-09-27 13:26:10,9月,永平寺町 エリア,27.永平寺町 エリア,永平寺町,福井市・永平寺町,,日帰り,福井県内には宿泊しない,福井県内には宿泊しない,福井県外には宿泊しない,夫婦2人,"地元の美味しいものを食べる
",0,0,1,0,0,0,0,0,0,0,0,0,0,0,0,0,0,0,"新聞・雑誌・ガイドブック
観光パンフレット・ポスター
",0,1,0,1,0,0,0,0,0,0,0,0,0,0,"県外から訪れていない（福井県在住）
",1,0,0,0,0,0,1,"自家用車
",0,0,0,0,,,"5,000円以上 10,000円未満",使わない,"5,000円以上 10,000円未満",2～5回目,一乗谷朝倉氏遺跡,,選択なし/該当施設なし,,"5,000円以上 10,000円未満",満足,,感じなかった,,7,,,また行きたい（1年以内）,
