会員ID,登録施設,性別,生まれ年,回答時の年齢,年代,都道府県,会員市町村,世帯年収,UA,回答日時,回答月,回答エリア,回答エリア2,市町村,6分類,DMO,宿泊数（全体）,宿泊数（県内）,宿泊エリア（県内）,宿泊エリア（県外）,同行者,訪問目的ALL,宿でのんびり過ごす,温泉や露天風呂,地元の美味しいものを食べる,花見や紅葉などの自然鑑賞,名所、旧跡の観光,テーマパーク（遊園地、動物園、博物館など）,買い物、アウトレット,お祭りやイベントへの参加・見物,スポーツ観戦や芸能鑑賞（コンサート等）,アウトドア（海水浴、釣り、登山など）,まちあるき、都市散策,各種体験（手作り、果物狩りなど）,スキー・スノボ、マリンスポーツ,その他スポーツ（ゴルフ、テニスなど）,ドライブ・ツーリング,友人・親戚を尋ねる,出張など仕事関係,その他,情報収集ALL,観光展・物産展,新聞・雑誌・ガイドブック,TV・ラジオ番組やCM,観光パンフレット・ポスター,観光連盟やDMOのHP,インターネット・アプリ,Twitter,Instagram,Facebook,ブログ,友人・知人,観光協会等の案内所,タクシードライバーや地元の人,宿泊施設,福井県までの交通手段ALL,自家用車,レンタカー,新幹線,在来線,飛行機,旅行会社ツアーバス,県外から訪れていない（福井県在住）,福井県内での交通手段ALL,タクシー,路線バス,徒歩,レンタサイクル,福井県内での交通手段の満足度,福井県内での交通手段の満足度の理由,宿泊費,交通費,県内消費額,エリア訪問回数,アンケート回答前に訪問した主な場所,アンケート回答前に訪問した主な場所FA,アンケート回答後に訪問する予定の主な場所,アンケート回答後に訪問する予定の主な場所FA,エリア総消費額,満足度,満足度の理由,不便さ,不便さの内容,NPS,推奨項目,施設に求めるもの,今後の来訪意向,福井県に求めるもの,登録エリア,満足度(商品・サービス),満足度(商品・サービス)の理由
102737,web,女,1973,49,40代,福井県,福井市,分からない/無回答,mobile/iphone,2022-05-05 19:08:49,5月,越前和紙の里 エリア,28.越前和紙の里 エリア,越前市,丹南,,日帰り,福井県内には宿泊しない,福井県内には宿泊しない,福井県外には宿泊しない,小学生以下連れの家族,"各種体験（手作り、果物狩りなど）
",0,0,0,0,0,0,0,0,0,0,0,1,0,0,0,0,0,0,"新聞・雑誌・ガイドブック
",0,1,0,0,0,0,0,0,0,0,0,0,0,0,"県外から訪れていない（福井県在住）
",1,0,0,0,0,0,1,"自家用車
",0,0,0,0,,,"10,000円以上 20,000円未満",使わない,"10,000円以上 20,000円未満",初めて,選択なし/該当施設なし,,選択なし/該当施設なし,,"1,000円以上 3,000円未満",とても満足,紙すきを丁寧に教えてくれたので。,感じなかった,,10,職人さんの紙すきを近くで見ることが出来、自分達も実際に体験できて、オリジナルの作品が作れるので。,"もう少し飲食店があるといいと思います。
お寿司や、魚が食べたかったので、越前市まで出て食べました。",福井県在住,,,,
102737,,女,1973,50,50代,福井県,福井市,分からない/無回答,mobile/iphone,2023-11-12 13:16:38,11月,道の駅「越前」 エリア,49.道の駅「越前」 エリア,越前町,丹南,一般社団法人 越前町観光連盟,日帰り,福井県内には宿泊しない,福井県内には宿泊しない,福井県外には宿泊しない,小学生以下連れの家族,"お祭りやイベントへの参加・見物
",0,0,0,0,0,0,0,1,0,0,0,0,0,0,0,0,0,0,"TV・ラジオ番組やCM
",0,0,1,0,0,0,0,0,0,0,0,0,0,0,"自家用車
",1,0,0,0,0,0,0,"自家用車
",0,0,0,0,,,使わない,使わない,"10,000円以上 20,000円未満",11回目以上,選択なし/該当施設なし,,劔神社,,"10,000円以上 20,000円未満",どちらでもない,イベント中止の影響で食事の場所もいつもの倍待ち時間があったので。,感じた,道の駅までの細い道で、路駐してある側の車がガンガン進んできて、なかなかこちら側がすすめなかった。,5,今回は海の景色くらい。,もう少し、売店の質を上げて欲しい,福井県在住,今後の福井駅に期待してます,web,不満,"朝の旅サラダを見てイベントを知り来たのに、強風で中止になっていたこと。
せっかく来たので、前のかねいちで3杯セットのカニを2袋買ったら、ひとつにタグがついてないことに食べる時に気づいてとても残念な気持ちになった。外れただけだと信じてるけど、モヤモヤしてるし、今後はしっかり見て買わなきゃと思いました。今回はお店の方が選んでくれたので。。"
