会員ID,登録施設,性別,生まれ年,回答時の年齢,年代,都道府県,会員市町村,世帯年収,UA,回答日時,回答月,回答エリア,回答エリア2,市町村,6分類,DMO,宿泊数（全体）,宿泊数（県内）,宿泊エリア（県内）,宿泊エリア（県外）,同行者,訪問目的ALL,宿でのんびり過ごす,温泉や露天風呂,地元の美味しいものを食べる,花見や紅葉などの自然鑑賞,名所、旧跡の観光,テーマパーク（遊園地、動物園、博物館など）,買い物、アウトレット,お祭りやイベントへの参加・見物,スポーツ観戦や芸能鑑賞（コンサート等）,アウトドア（海水浴、釣り、登山など）,まちあるき、都市散策,各種体験（手作り、果物狩りなど）,スキー・スノボ、マリンスポーツ,その他スポーツ（ゴルフ、テニスなど）,ドライブ・ツーリング,友人・親戚を尋ねる,出張など仕事関係,その他,情報収集ALL,観光展・物産展,新聞・雑誌・ガイドブック,TV・ラジオ番組やCM,観光パンフレット・ポスター,観光連盟やDMOのHP,インターネット・アプリ,Twitter,Instagram,Facebook,ブログ,友人・知人,観光協会等の案内所,タクシードライバーや地元の人,宿泊施設,福井県までの交通手段ALL,自家用車,レンタカー,新幹線,在来線,飛行機,旅行会社ツアーバス,県外から訪れていない（福井県在住）,福井県内での交通手段ALL,タクシー,路線バス,徒歩,レンタサイクル,福井県内での交通手段の満足度,福井県内での交通手段の満足度の理由,宿泊費,交通費,県内消費額,エリア訪問回数,アンケート回答前に訪問した主な場所,アンケート回答前に訪問した主な場所FA,アンケート回答後に訪問する予定の主な場所,アンケート回答後に訪問する予定の主な場所FA,エリア総消費額,満足度,満足度の理由,不便さ,不便さの内容,NPS,推奨項目,施設に求めるもの,今後の来訪意向,福井県に求めるもの
102999,レインボーライン エリア,女,1980,42,40代,大阪府,枚方市,分からない/無回答,mobile/android,2022-05-07 10:42:46,5月,レインボーライン エリア,59.レインボーライン エリア,美浜町,嶺南東部,三方五湖DMO(株),2泊,1泊,嶺南エリア（敦賀市・美浜町・若狭町・小浜市・おおい町・高浜町）,京都府,親,"地元の美味しいものを食べる
花見や紅葉などの自然鑑賞
",0,0,1,1,0,0,0,0,0,0,0,0,0,0,0,0,0,0,"観光連盟やDMOのHP
インターネット・アプリ
",0,0,0,0,1,1,0,0,0,0,0,0,0,0,"自家用車
",1,0,0,0,0,0,0,"自家用車
",0,0,0,0,選択肢なし,,"5,000円以上 10,000円未満","3,000円以上 5,000円未満","10,000円以上 20,000円未満",2～5回目,舞鶴（京都府）,,道の駅「若狭おばま」,,"1,000円以上 3,000円未満",とても不満,"レインボーラインの運用が最悪でした。混雑するのは仕方ないですが、山頂付近が駐車場の待ち列で通り過ぎたり戻ったりすることもできないのはどうかと思います。
また、並んでいる時に第3駐車場からのシャトルバスが逆走状態で走り、対向車と行き当たっては車列に割り込んでいる様子を見ましたが不公平感が強い上に危険だと感じました。
混むことがわかっている時は並ぶ車とは別に離脱して帰れる経路を確保して頂きたいです。
たとえば混雑期間中は一方通行にしてシャトルバスの通る時だけ手前で一般車を抑止するなどすれば待機時間や不公平感が軽減するのではないでしょうか？",感じた,5月4日の午後に訪問したときは一旦諦めてレインボーラインを通過するのみで帰ったのですが、混雑を避けるために5日の朝に山頂公園を再訪してところ、売店が営業していなくてホームページに載っているようなメニューが全然買えなくてがっかりしました。唯一営業しておられた団子屋さんも手際が悪すぎてあっという間に行列になっていました。駐車場の待ち列が捌けないわけだと思いました。混雑するとわかっている時は早く開ける・増員するなどの対応を行って頂きたいです,3,"レインボーライン山頂公園からの景色は素晴らしいので人出のピークシーズン以外であれば勧めたいと思いました。
また、道の駅若狭おばまで購入したサバサンドや干物は美味しかったです。おすすめできます。",ホットサンドが朝から食べられるようになってほしいです。朝ごはんにしようと思ったらランチのみでがっかりしました。また、ホームページの情報で買える場所や時間についてはっきり書いておいてほしい。麓でも買えるのかと思ったら置いていませんでした。期待していたものが買えないとなるとガッカリして印象が悪くなりますので,機会があれば行きたい,今回、初めてゴールデンウィーク中に訪問しましたが総じてどこも手際が悪く、少し混んだだけでサービスの質が極端に下がってしまうように見受けられました。今後は連休のようなシーズンは避けようと思いますが、オペレーションを改善していただけると幸いです
