会員ID,登録施設,性別,生まれ年,回答時の年齢,年代,都道府県,会員市町村,世帯年収,UA,回答日時,回答月,回答エリア,回答エリア2,市町村,6分類,DMO,宿泊数（全体）,宿泊数（県内）,宿泊エリア（県内）,宿泊エリア（県外）,同行者,訪問目的ALL,宿でのんびり過ごす,温泉や露天風呂,地元の美味しいものを食べる,花見や紅葉などの自然鑑賞,名所、旧跡の観光,テーマパーク（遊園地、動物園、博物館など）,買い物、アウトレット,お祭りやイベントへの参加・見物,スポーツ観戦や芸能鑑賞（コンサート等）,アウトドア（海水浴、釣り、登山など）,まちあるき、都市散策,各種体験（手作り、果物狩りなど）,スキー・スノボ、マリンスポーツ,その他スポーツ（ゴルフ、テニスなど）,ドライブ・ツーリング,友人・親戚を尋ねる,出張など仕事関係,その他,情報収集ALL,観光展・物産展,新聞・雑誌・ガイドブック,TV・ラジオ番組やCM,観光パンフレット・ポスター,観光連盟やDMOのHP,インターネット・アプリ,Twitter,Instagram,Facebook,ブログ,友人・知人,観光協会等の案内所,タクシードライバーや地元の人,宿泊施設,福井県までの交通手段ALL,自家用車,レンタカー,新幹線,在来線,飛行機,旅行会社ツアーバス,県外から訪れていない（福井県在住）,福井県内での交通手段ALL,タクシー,路線バス,徒歩,レンタサイクル,福井県内での交通手段の満足度,福井県内での交通手段の満足度の理由,宿泊費,交通費,県内消費額,エリア訪問回数,アンケート回答前に訪問した主な場所,アンケート回答前に訪問した主な場所FA,アンケート回答後に訪問する予定の主な場所,アンケート回答後に訪問する予定の主な場所FA,エリア総消費額,満足度,満足度の理由,不便さ,不便さの内容,NPS,推奨項目,施設に求めるもの,今後の来訪意向,福井県に求めるもの
122306,web,女,1974,48,40代,兵庫県,尼崎市,分からない/無回答,mobile/android,2022-10-27 15:20:36,10月,東尋坊 エリア,06.東尋坊 エリア,坂井市,あわら市・坂井市,(一社)DMOさかい観光局,1泊,1泊,三国・あわらエリア（あわら市・坂井市）,福井県外には宿泊しない,親,"温泉や露天風呂
名所、旧跡の観光
",0,1,0,0,1,0,0,0,0,0,0,0,0,0,0,0,0,0,"観光パンフレット・ポスター
インターネット・アプリ
Twitter
",0,0,0,1,0,1,1,0,0,0,0,0,0,0,"在来線
",0,0,0,0,0,0,0,"路線バス
",0,1,0,0,どちらでもない,本数が少ないのが難,"5,000円以上 10,000円未満","5,000円以上 10,000円未満","5,000円以上 10,000円未満",6～10回目,選択なし/該当施設なし,なし,あわら温泉街,,"5,000円以上 10,000円未満",満足,天気が良かった,感じた,休みの店が多い,6,イワバカフェ,観光地価格だなと思う,機会があれば行きたい,交通の便をもっと良くして欲しい
122306,web,女,1974,48,40代,兵庫県,尼崎市,分からない/無回答,mobile/android,2022-10-31 11:18:17,10月,福井駅前 エリア,04.福井駅前 エリア,福井市,福井市・永平寺町,,1泊,1泊,三国・あわらエリア（あわら市・坂井市）,福井県外には宿泊しない,親,"名所、旧跡の観光
",0,0,0,0,1,0,0,0,0,0,0,0,0,0,0,0,0,0,"Twitter
",0,0,0,0,0,0,1,0,0,0,0,0,0,0,"在来線
",0,0,0,1,0,0,0,"在来線
路線バス
",0,1,0,0,どちらでもない,"運転手さんは親切でしたが
本数が少ないです。
せめて主要駅から観光地までは1時間に2本程度は欲しいです。","5,000円以上 10,000円未満","5,000円以上 10,000円未満","5,000円以上 10,000円未満",2～5回目,大本山永平寺,,選択なし/該当施設なし,帰宅の為無し,"3,000円以上 5,000円未満",満足,ほしい物は大抵揃ってるので便利,感じた,"トイレやバス停,観光案内所などの場所がわかりづらい",5,食事はどこも美味しかったです,"バリアフリーはあまり対応してない感じでした。
工事中が目立つので場所がいまいちわかりづらかったです。",機会があれば行きたい,"WiFi対応されてない所が全体的に多く感じました。
公共交通機関の本数が少なく乗り換えのタイミングが、各社あまり関係考えずに組み立ててるの待ち時間に時間を取られ、あまり廻れなかったのが残念でした。"
