会員ID,登録施設,性別,生まれ年,回答時の年齢,年代,都道府県,会員市町村,世帯年収,UA,回答日時,回答月,回答エリア,回答エリア2,市町村,6分類,DMO,宿泊数（全体）,宿泊数（県内）,宿泊エリア（県内）,宿泊エリア（県外）,同行者,訪問目的ALL,宿でのんびり過ごす,温泉や露天風呂,地元の美味しいものを食べる,花見や紅葉などの自然鑑賞,名所、旧跡の観光,テーマパーク（遊園地、動物園、博物館など）,買い物、アウトレット,お祭りやイベントへの参加・見物,スポーツ観戦や芸能鑑賞（コンサート等）,アウトドア（海水浴、釣り、登山など）,まちあるき、都市散策,各種体験（手作り、果物狩りなど）,スキー・スノボ、マリンスポーツ,その他スポーツ（ゴルフ、テニスなど）,ドライブ・ツーリング,友人・親戚を尋ねる,出張など仕事関係,その他,情報収集ALL,観光展・物産展,新聞・雑誌・ガイドブック,TV・ラジオ番組やCM,観光パンフレット・ポスター,観光連盟やDMOのHP,インターネット・アプリ,Twitter,Instagram,Facebook,ブログ,友人・知人,観光協会等の案内所,タクシードライバーや地元の人,宿泊施設,福井県までの交通手段ALL,自家用車,レンタカー,新幹線,在来線,飛行機,旅行会社ツアーバス,県外から訪れていない（福井県在住）,福井県内での交通手段ALL,タクシー,路線バス,徒歩,レンタサイクル,福井県内での交通手段の満足度,福井県内での交通手段の満足度の理由,宿泊費,交通費,県内消費額,エリア訪問回数,アンケート回答前に訪問した主な場所,アンケート回答前に訪問した主な場所FA,アンケート回答後に訪問する予定の主な場所,アンケート回答後に訪問する予定の主な場所FA,エリア総消費額,満足度,満足度の理由,不便さ,不便さの内容,NPS,推奨項目,施設に求めるもの,今後の来訪意向,福井県に求めるもの,登録エリア,満足度(商品・サービス),満足度(商品・サービス)の理由
122401,熊川宿 エリア,女,1962,60,60代,福井県,福井市,100万円未満,mobile/iphone,2022-10-27 10:28:21,10月,越前大野城・城下町 エリア,15.越前大野城・城下町 エリア,大野市,勝山市・大野市,,日帰り,福井県内には宿泊しない,福井県内には宿泊しない,福井県外には宿泊しない,その他家族,"ドライブ・ツーリング
",0,0,0,0,0,0,0,0,0,0,0,0,0,0,1,0,0,0,"観光パンフレット・ポスター
",0,0,0,1,0,0,0,0,0,0,0,0,0,0,"県外から訪れていない（福井県在住）
",1,0,0,0,0,0,1,"自家用車
",0,0,0,0,,,"10,000円以上 20,000円未満","5,000円以上 10,000円未満","5,000円以上 10,000円未満",2～5回目,選択なし/該当施設なし,,選択なし/該当施設なし,,"10,000円以上 20,000円未満",満足,駐車場があり、街も整備されているから,感じなかった,,9,,,福井県在住,今回は&quot;マイカーで&quot;のキャンペーンで訪れましたが、一番楽しみにしていた食事は内容が料金と見合ってないと感じました。,,,
122401,熊川宿 エリア,女,1962,60,60代,福井県,福井市,100万円未満,mobile/iphone,2022-10-27 10:08:39,10月,熊川宿 エリア,62.熊川宿 エリア,若狭町,嶺南東部,,日帰り,福井県内には宿泊しない,福井県内には宿泊しない,福井県外には宿泊しない,その他家族,"まちあるき、都市散策
ドライブ・ツーリング
",0,0,0,0,0,0,0,0,0,0,1,0,0,0,1,0,0,0,"新聞・雑誌・ガイドブック
観光パンフレット・ポスター
",0,1,0,1,0,0,0,0,0,0,0,0,0,0,"県外から訪れていない（福井県在住）
",1,0,0,0,0,0,1,"自家用車
",0,0,0,0,満足,近くに駐車場があるから,"10,000円以上 20,000円未満","5,000円以上 10,000円未満","5,000円以上 10,000円未満",2～5回目,若狭瓜割名水公園 瓜割の滝,,福井県年縞博物館,,"1,000円以上 3,000円未満",どちらでもない,もう少し街並みが再現されているといいかと思います。,感じなかった,,6,,,福井県在住,,,,
122401,,女,1962,61,60代,福井県,福井市,100万円未満,mobile/iphone,2023-07-17 15:30:39,7月,えちぜん鉄道 永平寺口駅 エリア,31.えちぜん鉄道 永平寺口駅 エリア,永平寺町,福井市・永平寺町,,日帰り,福井県内には宿泊しない,福井県内には宿泊しない,福井県外には宿泊しない,親,"各種体験（手作り、果物狩りなど）
",0,0,0,0,0,0,0,0,0,0,0,1,0,0,0,0,0,以前も楽しかったから,"その他
",0,0,0,0,0,0,0,0,0,0,0,0,0,0,"県外から訪れていない（福井県在住）
",1,0,0,0,0,0,1,"自家用車
",0,0,0,0,,,使わない,"1,000円以上 3,000円未満","5,000円以上 10,000円未満",2～5回目,選択なし/該当施設なし,,選択なし/該当施設なし,,"3,000円以上 5,000円未満",どちらでもない,,感じなかった,,6,,,福井県在住,,熊川宿 エリア,どちらでもない,訪れたレストランでカフェタイムなのにスイーツが品切れで食べられなかった。
122401,,女,1962,61,60代,福井県,福井市,100万円未満,mobile/iphone,2023-07-17 15:26:56,7月,はたや記念館 ゆめおーれ勝山 エリア,30.はたや記念館 ゆめおーれ勝山 エリア,勝山市,勝山市・大野市,勝山市観光まちづくり(株),日帰り,福井県内には宿泊しない,福井県内には宿泊しない,福井県外には宿泊しない,親,"各種体験（手作り、果物狩りなど）
",0,0,0,0,0,0,0,0,0,0,0,1,0,0,0,0,0,以前も楽しかったから,"その他
",0,0,0,0,0,0,0,0,0,0,0,0,0,0,"県外から訪れていない（福井県在住）
",1,0,0,0,0,0,1,"自家用車
",0,0,0,0,,,使わない,"1,000円以上 3,000円未満","5,000円以上 10,000円未満",2～5回目,選択なし/該当施設なし,,選択なし/該当施設なし,,"1,000円以上 3,000円未満",満足,,感じなかった,,8,,,福井県在住,,熊川宿 エリア,満足,機織り体験をしましたが、スタッフの方たちが大変親切で明るく気持ちよかったです。仕上がりにも満足しました。
