会員ID,登録施設,性別,生まれ年,回答時の年齢,年代,都道府県,会員市町村,世帯年収,UA,回答日時,回答月,回答エリア,回答エリア2,市町村,6分類,DMO,宿泊数（全体）,宿泊数（県内）,宿泊エリア（県内）,宿泊エリア（県外）,同行者,訪問目的ALL,宿でのんびり過ごす,温泉や露天風呂,地元の美味しいものを食べる,花見や紅葉などの自然鑑賞,名所、旧跡の観光,テーマパーク（遊園地、動物園、博物館など）,買い物、アウトレット,お祭りやイベントへの参加・見物,スポーツ観戦や芸能鑑賞（コンサート等）,アウトドア（海水浴、釣り、登山など）,まちあるき、都市散策,各種体験（手作り、果物狩りなど）,スキー・スノボ、マリンスポーツ,その他スポーツ（ゴルフ、テニスなど）,ドライブ・ツーリング,友人・親戚を尋ねる,出張など仕事関係,その他,情報収集ALL,観光展・物産展,新聞・雑誌・ガイドブック,TV・ラジオ番組やCM,観光パンフレット・ポスター,観光連盟やDMOのHP,インターネット・アプリ,Twitter,Instagram,Facebook,ブログ,友人・知人,観光協会等の案内所,タクシードライバーや地元の人,宿泊施設,福井県までの交通手段ALL,自家用車,レンタカー,新幹線,在来線,飛行機,旅行会社ツアーバス,県外から訪れていない（福井県在住）,福井県内での交通手段ALL,タクシー,路線バス,徒歩,レンタサイクル,福井県内での交通手段の満足度,福井県内での交通手段の満足度の理由,宿泊費,交通費,県内消費額,エリア訪問回数,アンケート回答前に訪問した主な場所,アンケート回答前に訪問した主な場所FA,アンケート回答後に訪問する予定の主な場所,アンケート回答後に訪問する予定の主な場所FA,エリア総消費額,満足度,満足度の理由,不便さ,不便さの内容,NPS,推奨項目,施設に求めるもの,今後の来訪意向,福井県に求めるもの
122525,小浜町家ステイ エリア,男,1975,47,40代,東京都,目黒区,200万円以上 300万円未満,mobile/iphone,2022-10-28 15:08:02,10月,小浜町家ステイ エリア,52.小浜町家ステイ エリア,小浜市,嶺南西部,(株)まちづくり小浜,2泊,2泊,嶺南エリア（敦賀市・美浜町・若狭町・小浜市・おおい町・高浜町）,福井県外には宿泊しない,自分ひとり,"宿でのんびり過ごす
地元の美味しいものを食べる
",1,0,1,0,0,0,0,0,0,0,0,0,0,0,0,0,0,0,"インターネット・アプリ
宿泊施設
",0,0,0,0,0,1,0,0,0,0,0,0,0,1,"新幹線
在来線
",0,0,1,0,0,0,0,"徒歩
レンタサイクル
",0,0,1,1,満足,"電動自転車で、また扱いやすかったこと。
平日だったせいか人通りが少なく、また道幅があったため。","30,000円以上 40,000円未満","20,000円以上 30,000円未満","20,000円以上 30,000円未満",初めて,道の駅「若狭おばま」,,若狭フィッシャーマンズワーフ,,"10,000円以上 20,000円未満",満足,"海が非常に近い。
行きたいお店が徒歩圏内にある。",感じた,"コンビニがない。
日が落ちると人通りがない上、道が暗い。",6,"食事、特に海産物が何を食べてもおいしい。
町が静かなので、落ち着いた時間を過ごすことができる。",チェックインは駅前の観光所でできるようにしてもらえると便利です。,機会があれば行きたい,"電子化が進むといいと思います。
お土産屋さんでサンプルを見て試食をして、後はAmazonようにスマホで選んで自宅に届くようになれば、もっと気軽に買い物ができるのではないでしょうか。"
