会員ID,登録施設,性別,生まれ年,回答時の年齢,年代,都道府県,会員市町村,世帯年収,UA,回答日時,回答月,回答エリア,回答エリア2,市町村,6分類,DMO,宿泊数（全体）,宿泊数（県内）,宿泊エリア（県内）,宿泊エリア（県外）,同行者,訪問目的ALL,宿でのんびり過ごす,温泉や露天風呂,地元の美味しいものを食べる,花見や紅葉などの自然鑑賞,名所、旧跡の観光,テーマパーク（遊園地、動物園、博物館など）,買い物、アウトレット,お祭りやイベントへの参加・見物,スポーツ観戦や芸能鑑賞（コンサート等）,アウトドア（海水浴、釣り、登山など）,まちあるき、都市散策,各種体験（手作り、果物狩りなど）,スキー・スノボ、マリンスポーツ,その他スポーツ（ゴルフ、テニスなど）,ドライブ・ツーリング,友人・親戚を尋ねる,出張など仕事関係,その他,情報収集ALL,観光展・物産展,新聞・雑誌・ガイドブック,TV・ラジオ番組やCM,観光パンフレット・ポスター,観光連盟やDMOのHP,インターネット・アプリ,Twitter,Instagram,Facebook,ブログ,友人・知人,観光協会等の案内所,タクシードライバーや地元の人,宿泊施設,福井県までの交通手段ALL,自家用車,レンタカー,新幹線,在来線,飛行機,旅行会社ツアーバス,県外から訪れていない（福井県在住）,福井県内での交通手段ALL,タクシー,路線バス,徒歩,レンタサイクル,福井県内での交通手段の満足度,福井県内での交通手段の満足度の理由,宿泊費,交通費,県内消費額,エリア訪問回数,アンケート回答前に訪問した主な場所,アンケート回答前に訪問した主な場所FA,アンケート回答後に訪問する予定の主な場所,アンケート回答後に訪問する予定の主な場所FA,エリア総消費額,満足度,満足度の理由,不便さ,不便さの内容,NPS,推奨項目,施設に求めるもの,今後の来訪意向,福井県に求めるもの
122872,スーベニアショップ ラプトル エリア,男,1962,60,60代,愛知県,尾張旭市,分からない/無回答,mobile/android,2022-10-30 20:38:52,10月,スーベニアショップ ラプトル エリア,19.スーベニアショップ ラプトル エリア,大野市,勝山市・大野市,勝山市観光まちづくり(株),日帰り,福井県内には宿泊しない,福井県内には宿泊しない,福井県外には宿泊しない,職場の同僚,"地元の美味しいものを食べる
テーマパーク（遊園地、動物園、博物館など）
ドライブ・ツーリング
",0,0,1,0,0,1,0,0,0,0,0,0,0,0,1,0,0,0,"インターネット・アプリ
",0,0,0,0,0,1,0,0,0,0,0,0,0,0,"自家用車
",1,0,0,0,0,0,0,"自家用車
",0,0,0,0,,,使わない,"5,000円以上 10,000円未満","5,000円以上 10,000円未満",2～5回目,福井県立恐竜博物館,,道の駅「九頭竜・和泉ふれあい会館」,,"1,000円未満",不満,会社へ持って行くようなお土産が少ない,感じなかった,,4,"福井県恐竜博物館は凄い展示なのに、大人が楽しめる内容ではない。
ソースカツ丼と越前蕎麦が美味しい。","お土産の展示方法、充実感がない。
ただ、並べてるだけで、そのお土産の美味しさが伝わらない。",機会があれば行きたい,なんか地味なモノが多い。
