会員ID,登録施設,性別,生まれ年,回答時の年齢,年代,都道府県,会員市町村,世帯年収,UA,回答日時,回答月,回答エリア,回答エリア2,市町村,6分類,DMO,宿泊数（全体）,宿泊数（県内）,宿泊エリア（県内）,宿泊エリア（県外）,同行者,訪問目的ALL,宿でのんびり過ごす,温泉や露天風呂,地元の美味しいものを食べる,花見や紅葉などの自然鑑賞,名所、旧跡の観光,テーマパーク（遊園地、動物園、博物館など）,買い物、アウトレット,お祭りやイベントへの参加・見物,スポーツ観戦や芸能鑑賞（コンサート等）,アウトドア（海水浴、釣り、登山など）,まちあるき、都市散策,各種体験（手作り、果物狩りなど）,スキー・スノボ、マリンスポーツ,その他スポーツ（ゴルフ、テニスなど）,ドライブ・ツーリング,友人・親戚を尋ねる,出張など仕事関係,その他,情報収集ALL,観光展・物産展,新聞・雑誌・ガイドブック,TV・ラジオ番組やCM,観光パンフレット・ポスター,観光連盟やDMOのHP,インターネット・アプリ,Twitter,Instagram,Facebook,ブログ,友人・知人,観光協会等の案内所,タクシードライバーや地元の人,宿泊施設,福井県までの交通手段ALL,自家用車,レンタカー,新幹線,在来線,飛行機,旅行会社ツアーバス,県外から訪れていない（福井県在住）,福井県内での交通手段ALL,タクシー,路線バス,徒歩,レンタサイクル,福井県内での交通手段の満足度,福井県内での交通手段の満足度の理由,宿泊費,交通費,県内消費額,エリア訪問回数,アンケート回答前に訪問した主な場所,アンケート回答前に訪問した主な場所FA,アンケート回答後に訪問する予定の主な場所,アンケート回答後に訪問する予定の主な場所FA,エリア総消費額,満足度,満足度の理由,不便さ,不便さの内容,NPS,推奨項目,施設に求めるもの,今後の来訪意向,福井県に求めるもの
123853,web,女,1956,66,60代,福井県,あわら市,分からない/無回答,mobile/android,2022-11-08 09:37:39,11月,JA福井県ファーマーズマーケットきららの丘 エリア,13.JA福井県ファーマーズマーケットきららの丘 エリア,あわら市,あわら市・坂井市,,日帰り,4泊以上,三国・あわらエリア（あわら市・坂井市）,福井県外には宿泊しない,夫婦2人,"地元の美味しいものを食べる
買い物、アウトレット
",0,0,1,0,0,0,1,0,0,0,0,0,0,0,0,0,0,0,"新聞・雑誌・ガイドブック
観光パンフレット・ポスター
友人・知人
その他
",0,1,0,1,0,0,0,0,0,0,1,0,0,0,"県外から訪れていない（福井県在住）
",1,0,0,0,0,0,1,"自家用車
",0,0,0,0,,,使わない,使わない,"1,000円以上 3,000円未満",11回目以上,選択なし/該当施設なし,,選択なし/該当施設なし,県畜産試験場なかよし牧場,"1,000円以上 3,000円未満",満足,"新鮮で質の良い野菜が手に入る
県外への贈答品としての品が選びやすい",感じた,電子マネー決済の種類を増やして欲しい,8,,JA取り扱いの食材を使った飲食店が併設しているとよい,福井県在住,"安全な中で豊かな自然をたのしめる仕組みがあるとよい
県外への情報発信ももっと必要"
123853,web,女,1956,66,60代,福井県,あわら市,分からない/無回答,mobile/android,2022-11-13 21:34:19,11月,道の駅「越前おおの荒島の郷」 エリア,16.道の駅「越前おおの荒島の郷」 エリア,大野市,勝山市・大野市,,日帰り,4泊以上,三国・あわらエリア（あわら市・坂井市）,福井県外には宿泊しない,団体旅行,"地元の美味しいものを食べる
名所、旧跡の観光
テーマパーク（遊園地、動物園、博物館など）
買い物、アウトレット
",0,0,1,0,1,1,1,0,0,0,0,0,0,0,0,0,0,0,"新聞・雑誌・ガイドブック
観光パンフレット・ポスター
観光連盟やDMOのHP
インターネット・アプリ
",0,1,0,1,1,1,0,0,0,0,0,0,0,0,"旅行会社ツアーバス
",0,0,0,0,0,1,0,"旅行会社ツアーバス
",0,0,0,0,とても満足,旅行中でも旅行客の希望に対して行程やスケジュールを柔軟に対応してくれた,使わない,"5,000円以上 10,000円未満","5,000円以上 10,000円未満",2～5回目,選択なし/該当施設なし,,一乗谷朝倉氏遺跡,,"3,000円以上 5,000円未満",とても満足,"大野を味わえる物産の取り扱いが多い
休憩スペースが広い",感じなかった,,9,同じ敷地内にアウトドアの専門店が有ったり焼きたてパンの販売店がある,,福井県在住,福井の農産物を活かした福井独自のメニューをもっと宣伝するとよい
