会員ID,登録エリア,性別,生まれ年,回答時の年齢,年代,都道府県,会員市町村,世帯年収,UA,回答日時,回答月,回答エリア,回答エリア2,市町村,6分類,DMO,宿泊数（全体）,宿泊数（県内）,宿泊エリア（県内）,宿泊エリア（県外）,同行者,訪問目的ALL,宿でのんびり過ごす,温泉や露天風呂,地元の美味しいものを食べる,花見や紅葉などの自然鑑賞,名所、旧跡の観光,テーマパーク（遊園地、動物園、博物館など）,買い物、アウトレット,お祭りやイベントへの参加・見物,スポーツ観戦や芸能鑑賞（コンサート等）,アウトドア（海水浴、釣り、登山など）,まちあるき、都市散策,各種体験（手作り、果物狩りなど）,スキー・スノボ、マリンスポーツ,その他スポーツ（ゴルフ、テニスなど）,ドライブ・ツーリング,友人・親戚を尋ねる,出張など仕事関係,その他,福井県までの交通手段ALL,自家用車,レンタカー,新幹線,在来線,飛行機,旅行会社ツアーバス,県外から訪れていない（福井県在住）,福井県内での交通手段ALL,タクシー,路線バス,徒歩,レンタサイクル,福井県内での交通手段の満足度,福井県内での交通手段の満足度の理由,宿泊費,交通費,県内消費額,エリア訪問回数,情報収集ALL,観光展・物産展,新聞・雑誌・ガイドブック,TV・ラジオ番組やCM,観光パンフレット・ポスター,観光連盟やDMOのHP,インターネット・アプリ,Twitter,Instagram,Facebook,ブログ,友人・知人,観光協会等の案内所,タクシードライバーや地元の人,宿泊施設,アンケート回答前に訪問した主な場所,アンケート回答前に訪問した主な場所FA,アンケート回答後に訪問する予定の主な場所,エリア総消費額,満足度(商品・サービス),満足度(商品・サービス)の理由,満足度,満足度の理由,不便さ,不便さの内容,NPS,推奨項目,施設に求めるもの,今後の来訪意向,福井県に求めるもの
153026,紫式部公園 エリア,男,1982,42,40代,香川県,高松市,300万円以上 400万円未満,mobile/android,2024-03-24 15:04:23,3月,紫式部公園 エリア,41.紫式部公園 エリア,越前市,丹南,,1泊,福井県内には宿泊しない,福井県内には宿泊しない,石川県加賀市,団体旅行,"宿でのんびり過ごす
温泉や露天風呂
地元の美味しいものを食べる
名所、旧跡の観光
買い物、アウトレット
まちあるき、都市散策
",1,1,1,0,1,0,1,0,0,0,1,0,0,0,0,0,0,特になし,"旅行会社ツアーバス
",0,0,0,0,0,1,0,"旅行会社ツアーバス
",0,0,0,0,満足,特に停めれない等の問題もなかったため,使わない,"20,000円以上 30,000円未満","3,000円以上 5,000円未満",初めて,"その他
",0,0,0,0,0,0,0,0,0,0,0,0,0,0,選択なし/該当施設なし,,越前大野城,使わない,どちらでもない,特に欲しいとかすごいと思うようなものはなかったので。,満足,もう少し見応えがあると良かったが、期待していなかったのでそれなりに楽しめた。,感じた,ツアー客が多いので、特に女子トイレの混雑が不便そうだった。,6,また公園しか見ていないが、魅力的な場所は多そうなので。,周辺のお土産屋の情報が知りたかった。,機会があれば行きたい,少し遠いので頑張って行ったかいがあったと思える良い場所がたくさんあると嬉しいです。
153026,紫式部公園 エリア,男,1982,42,40代,香川県,高松市,300万円以上 400万円未満,mobile/android,2024-03-25 14:44:31,3月,越前大野城・城下町 エリア,21.越前大野城・城下町 エリア,大野市,勝山市・大野市,,1泊,福井県内には宿泊しない,福井県内には宿泊しない,石川県加賀市,団体旅行,"まちあるき、都市散策
",0,0,0,0,0,0,0,0,0,0,1,0,0,0,0,0,0,特になし,"旅行会社ツアーバス
",0,0,0,0,0,1,0,"旅行会社ツアーバス
",0,0,0,0,満足,道が混んでなくてスムーズだったので。,使わない,"20,000円以上 30,000円未満","3,000円以上 5,000円未満",初めて,"その他
",0,0,0,0,0,0,0,0,0,0,0,0,0,0,越前大仏,,越前そばの里,"1,000円以上 3,000円未満",どちらでもない,もう少し見易いマップが欲しかった、お菓子屋さんでケース内の品物がないですと言われてあまりの回答の早さにそもそも作ってないのかなと思ったりしたのも残念だった。,どちらでもない,思ったよりお店の数が少なくて立ち寄る場所があまりなかった。,感じた,見所が紹介されているのだが、城下町の道があまり親切な感じではなく、マップに書いてる場所に看板があるわけでもないのが少しガッカリ感を助長していた。,5,人が暖かいとは思うが、ちょっと寂れた感じが拭えないので、一部だけでもまとまった開発をしてみたらどうか。,そば屋さんマップを中心にするか、城下町には抹茶を飲めるところがあるとか、あったのかもしれないが少しの工夫で気持ちからもう少し楽しめるようになるのではと思った。,機会があれば行きたい,恐竜ライドできるアクティビティがほしい、ジップラインがプテラノドンとか。
