会員ID,登録エリア,性別,生まれ年,回答時の年齢,年代,都道府県,会員市町村,世帯年収,UA,回答日時,回答月,回答エリア,回答エリア2,市町村,6分類,DMO,宿泊数（全体）,宿泊数（県内）,宿泊エリア（県内）,宿泊エリア（県外）,同行者,訪問目的ALL,宿でのんびり過ごす,温泉や露天風呂,地元の美味しいものを食べる,花見や紅葉などの自然鑑賞,名所、旧跡の観光,テーマパーク（遊園地、動物園、博物館など）,買い物、アウトレット,お祭りやイベントへの参加・見物,スポーツ観戦や芸能鑑賞（コンサート等）,アウトドア（海水浴、釣り、登山など）,まちあるき、都市散策,各種体験（手作り、果物狩りなど）,スキー・スノボ、マリンスポーツ,その他スポーツ（ゴルフ、テニスなど）,ドライブ・ツーリング,友人・親戚を尋ねる,出張など仕事関係,その他,福井県までの交通手段ALL,自家用車,レンタカー,新幹線,在来線,飛行機,旅行会社ツアーバス,県外から訪れていない（福井県在住）,福井県内での交通手段ALL,タクシー,路線バス,徒歩,レンタサイクル,福井県内での交通手段の満足度,福井県内での交通手段の満足度の理由,宿泊費,交通費,県内消費額,エリア訪問回数,情報収集ALL,観光展・物産展,新聞・雑誌・ガイドブック,TV・ラジオ番組やCM,観光パンフレット・ポスター,観光連盟やDMOのHP,インターネット・アプリ,Twitter,Instagram,Facebook,ブログ,友人・知人,観光協会等の案内所,タクシードライバーや地元の人,宿泊施設,アンケート回答前に訪問した主な場所,アンケート回答前に訪問した主な場所FA,アンケート回答後に訪問する予定の主な場所,エリア総消費額,満足度(商品・サービス),満足度(商品・サービス)の理由,満足度,満足度の理由,不便さ,不便さの内容,NPS,推奨項目,施設に求めるもの,今後の来訪意向,福井県に求めるもの
153733,メガネストリート エリア,女,1979,45,40代,石川県,七尾市,200万円以上 300万円未満,mobile/android,2024-03-30 23:56:49,3月,メガネストリート エリア,45.メガネストリート エリア,鯖江市,丹南,,日帰り,福井県内には宿泊しない,福井県内には宿泊しない,福井県外には宿泊しない,友人,"温泉や露天風呂
地元の美味しいものを食べる
名所、旧跡の観光
買い物、アウトレット
まちあるき、都市散策
",0,1,1,0,1,0,1,0,0,0,1,0,0,0,0,0,0,0,"在来線
",0,0,0,1,0,0,0,"在来線
徒歩
",0,0,1,0,満足,鯖江駅から歩きましたが、経路が非常にわかりやすく、道々にメガネの仕掛けがたくさんあり楽しめました。,使わない,"1,000円未満","5,000円以上 10,000円未満",2～5回目,"インターネット・アプリ
友人・知人
",0,0,0,0,0,1,0,0,0,0,1,0,0,0,選択なし/該当施設なし,日帰り入浴　アパホテル福井,福井駅,"1,000円以上 3,000円未満",満足,昔違う友人とめがねミュージアムにきたのですが、また違う展示がされており満足でした。,満足,街中にメガネの仕掛けがたくさんで写真もたくさんとりました。お土産の紙袋もメガネの視力検査風がかわいくて、好きです。,感じなかった,特にないです。,8,メガネをかけているひともいないひとも一度はきてみたらよいと思います。鯖江に電車で来たなら、電車時間待ち合わせに駅から少し歩きますが､昭和堂のお菓子も美味しいです。近くのなんか和菓子屋でもと悩んでいたら、駅の案内所の方が親切に教えてくださり、町の雰囲気がとても良いです。,今回は、時間的に食事の時間はとれませんでしたが、次回ありましたら食事もしてみたいです。お土産にアメガネも購入しましたが、眼鏡職人味というのがおもしろかったです。,機会があれば行きたい,今回は地震で、北陸お出かけパスが安かったのと断水でお風呂にはいりたくて日帰り温泉にしましたが、福井駅ではぴりんや物産館もみました。次は車でもとも思いますが、駐車料金が気になってゆっくりできないのは悲しいなと思います。
