会員ID,登録施設,性別,生まれ年,回答時の年齢,年代,都道府県,会員市町村,世帯年収,UA,回答日時,回答月,回答エリア,回答エリア2,市町村,6分類,DMO,宿泊数（全体）,宿泊数（県内）,宿泊エリア（県内）,宿泊エリア（県外）,同行者,訪問目的ALL,宿でのんびり過ごす,温泉や露天風呂,地元の美味しいものを食べる,花見や紅葉などの自然鑑賞,名所、旧跡の観光,テーマパーク（遊園地、動物園、博物館など）,買い物、アウトレット,お祭りやイベントへの参加・見物,スポーツ観戦や芸能鑑賞（コンサート等）,アウトドア（海水浴、釣り、登山など）,まちあるき、都市散策,各種体験（手作り、果物狩りなど）,スキー・スノボ、マリンスポーツ,その他スポーツ（ゴルフ、テニスなど）,ドライブ・ツーリング,友人・親戚を尋ねる,出張など仕事関係,その他,情報収集ALL,観光展・物産展,新聞・雑誌・ガイドブック,TV・ラジオ番組やCM,観光パンフレット・ポスター,観光連盟やDMOのHP,インターネット・アプリ,Twitter,Instagram,Facebook,ブログ,友人・知人,観光協会等の案内所,タクシードライバーや地元の人,宿泊施設,福井県までの交通手段ALL,自家用車,レンタカー,新幹線,在来線,飛行機,旅行会社ツアーバス,県外から訪れていない（福井県在住）,福井県内での交通手段ALL,タクシー,路線バス,徒歩,レンタサイクル,福井県内での交通手段の満足度,福井県内での交通手段の満足度の理由,宿泊費,交通費,県内消費額,エリア訪問回数,アンケート回答前に訪問した主な場所,アンケート回答前に訪問した主な場所FA,アンケート回答後に訪問する予定の主な場所,アンケート回答後に訪問する予定の主な場所FA,エリア総消費額,満足度,満足度の理由,不便さ,不便さの内容,NPS,推奨項目,施設に求めるもの,今後の来訪意向,福井県に求めるもの
109947,道の駅「越前」 エリア,男,1962,60,60代,神奈川県,横浜市中区,400万円以上 500万円未満,mobile/iphone,2022-07-30 05:41:02,7月,越前大野城・城下町 エリア,15.越前大野城・城下町 エリア,,,,4泊以上,2泊,福井エリア（福井市・永平寺町）,石川県金沢市,自分ひとり,"まちあるき、都市散策
",0,0,0,0,0,0,0,0,0,0,1,0,0,0,0,0,0,0,"インターネット・アプリ
",0,0,0,0,0,1,0,0,0,0,0,0,0,0,"在来線
",0,0,0,0,0,0,0,"路線バス
徒歩
",0,1,1,0,どちらでもない,福井市からのアクセスにおいて、バスもあれば鉄道もあるととらえれば、極端に不便ではなかったので。,"10,000円以上 20,000円未満","50,000円以上 100,000円未満","30,000円以上 40,000円未満",初めて,北の庄城址・柴田公園,,勝山城博物館,,"1,000円以上 3,000円未満",不満,天空の城展望台へアクセスルートが全て封鎖されているが、告知が全くなく、時間を無駄に費やされ不愉快。,感じた,上に同じ,1,天空の城は寒さ厳しき冬季しか拝めないので、おすすめしない。,,機会があれば行きたい,
109947,道の駅「越前」 エリア,男,1962,60,60代,神奈川県,横浜市中区,400万円以上 500万円未満,mobile/iphone,2022-07-30 05:23:46,7月,丸岡城 エリア,08.丸岡城 エリア,,,(一社)DMOさかい観光局,4泊以上,2泊,福井エリア（福井市・永平寺町）,石川県金沢市,自分ひとり,"まちあるき、都市散策
",0,0,0,0,0,0,0,0,0,0,1,0,0,0,0,0,0,0,"インターネット・アプリ
",0,0,0,0,0,1,0,0,0,0,0,0,0,0,"在来線
",0,0,0,0,0,0,0,"路線バス
",0,1,0,0,どちらでもない,,"10,000円以上 20,000円未満","50,000円以上 100,000円未満","30,000円以上 40,000円未満",初めて,越前大野城,,三国サンセットビーチ,,"1,000円未満",満足,交通アクセスが不便ではあったが、丸岡城エリアには満足,感じなかった,,8,木造の城があること,,機会があれば行きたい,
109947,道の駅「越前」 エリア,男,1962,60,60代,神奈川県,横浜市中区,400万円以上 500万円未満,mobile/iphone,2022-07-30 05:12:39,7月,道の駅「越前」 エリア,38.道の駅「越前」 エリア,,,,4泊以上,2泊,福井エリア（福井市・永平寺町）,石川県金沢市,自分ひとり,"地元の美味しいものを食べる
お祭りやイベントへの参加・見物
まちあるき、都市散策
",0,0,1,0,0,0,0,1,0,0,1,0,0,0,0,0,0,0,"新聞・雑誌・ガイドブック
インターネット・アプリ
",0,1,0,0,0,1,0,0,0,0,0,0,0,0,"新幹線
在来線
",0,1,1,0,0,0,0,"レンタカー
",0,0,0,0,満足,時間に縛られず自由に行動できた,"10,000円以上 20,000円未満","50,000円以上 100,000円未満","30,000円以上 40,000円未満",初めて,選択なし/該当施設なし,福井県内で最初に訪れたのが越前,劔神社,,"1,000円未満",不満,物販エリアが少ない,感じなかった,,6,景色がきれい,,機会があれば行きたい,
