会員ID,登録エリア,性別,生まれ年,回答時の年齢,年代,都道府県,会員市町村,世帯年収,UA,回答日時,回答月,回答エリア,回答エリア2,市町村,6分類,DMO,宿泊数（全体）,宿泊数（県内）,宿泊エリア（県内）,宿泊エリア（県外）,同行者,訪問目的ALL,宿でのんびり過ごす,温泉や露天風呂,地元の美味しいものを食べる,花見や紅葉などの自然鑑賞,名所、旧跡の観光,テーマパーク（遊園地、動物園、博物館など）,買い物、アウトレット,お祭りやイベントへの参加・見物,スポーツ観戦や芸能鑑賞（コンサート等）,アウトドア（海水浴、釣り、登山など）,まちあるき、都市散策,各種体験（手作り、果物狩りなど）,スキー・スノボ、マリンスポーツ,その他スポーツ（ゴルフ、テニスなど）,ドライブ・ツーリング,友人・親戚を尋ねる,出張など仕事関係,その他,福井県までの交通手段ALL,自家用車,レンタカー,新幹線,在来線,飛行機,旅行会社ツアーバス,県外から訪れていない（福井県在住）,福井県内での交通手段ALL,タクシー,路線バス,徒歩,レンタサイクル,福井県内での交通手段の満足度,福井県内での交通手段の満足度の理由,宿泊費,交通費,県内消費額,エリア訪問回数,情報収集ALL,観光展・物産展,新聞・雑誌・ガイドブック,TV・ラジオ番組やCM,観光パンフレット・ポスター,観光連盟やDMOのHP,インターネット・アプリ,Twitter,Instagram,Facebook,ブログ,友人・知人,観光協会等の案内所,タクシードライバーや地元の人,宿泊施設,アンケート回答前に訪問した主な場所,アンケート回答前に訪問した主な場所FA,アンケート回答後に訪問する予定の主な場所,エリア総消費額,満足度(商品・サービス),満足度(商品・サービス)の理由,満足度,満足度の理由,不便さ,不便さの内容,NPS,推奨項目,施設に求めるもの,今後の来訪意向,福井県に求めるもの
133183,あわら湯のまち エリア,男,1974,49,40代,埼玉県,川口市,"900万円以上 1,000万円未満",mobile/android,2023-05-07 16:36:26,5月,あわら湯のまち エリア,17.あわら湯のまち エリア,あわら市,あわら市・坂井市,,4泊以上,4泊以上,三国・あわらエリア（あわら市・坂井市）,福井県外には宿泊しない,自分ひとり,"宿でのんびり過ごす
地元の美味しいものを食べる
名所、旧跡の観光
まちあるき、都市散策
",1,0,1,0,1,0,0,0,0,0,1,0,0,0,0,0,0,0,"在来線
その他
",0,0,0,1,0,0,0,"在来線
",0,0,0,0,とても満足,電車の乗務員さんが親切だったことに加えて、運転士さんが１日フリーきっぷがお得であることを案内してくれた、,"30,000円以上 40,000円未満","10,000円以上 20,000円未満","5,000円以上 10,000円未満",初めて,"新聞・雑誌・ガイドブック
インターネット・アプリ
",0,1,0,0,0,1,0,0,0,0,0,0,0,0,選択なし/該当施設なし,三国港,選択なし/該当施設なし,"1,000円未満",とても満足,美味しいパフェが食べられた,とても満足,上と同じ,感じなかった,,10,"人道の港 敦賀ムゼウム
ポーランド難民及びユダヤの人々と敦賀の人々の関わりあいを展示しているが、とても泣ける展示もあった。いまのウクライナ侵攻を考えると、平和とは何かということを改めて考えさせられた。",求めていたものがあったので、満足です。,また行きたい（1年以内）,とにかく福井県へ行かなければ得られないものがいいです。
133183,あわら湯のまち エリア,男,1974,49,40代,埼玉県,川口市,"900万円以上 1,000万円未満",mobile/android,2023-05-08 14:04:27,5月,福井駅前 エリア,01.福井駅前 エリア,福井市,福井市・永平寺町,,4泊以上,4泊以上,三国・あわらエリア（あわら市・坂井市）,福井県外には宿泊しない,自分ひとり,"まちあるき、都市散策
",0,0,0,0,0,0,0,0,0,0,1,0,0,0,0,0,0,0,"その他
",0,0,0,1,0,0,0,"在来線
",0,0,0,0,とても満足,えちぜん鉄道が他の地方の第3セクターに比べて、案内やアデンダントさん等がしっかりしていたから。,"30,000円以上 40,000円未満","10,000円以上 20,000円未満","5,000円以上 10,000円未満",2～5回目,"インターネット・アプリ
",0,0,0,0,0,1,0,0,0,0,0,0,0,0,三國湊レトロ,自宅,選択なし/該当施設なし,"1,000円以上 3,000円未満",とても満足,1000円のバイキングで福井県の美味しいものがたくさん食べられたから。,とても満足,先の設問の理由と同じです。,感じなかった,,9,やはり敦賀市にある敦賀ムゼウムは、平和を再認識するために行っておいたほうがいい。,特になし,また行きたい（1年以内）,福井でしか得られないものに出会いたいです。
133183,あわら湯のまち エリア,男,1974,49,40代,埼玉県,川口市,"900万円以上 1,000万円未満",mobile/android,2023-05-08 10:03:39,5月,三国湊 エリア,09.三国湊 エリア,坂井市,あわら市・坂井市,(一社)DMOさかい観光局,4泊以上,4泊以上,三国・あわらエリア（あわら市・坂井市）,福井県外には宿泊しない,自分ひとり,"まちあるき、都市散策
",0,0,0,0,0,0,0,0,0,0,1,0,0,0,0,0,0,0,"その他
",0,0,0,0,0,0,0,"徒歩
",0,0,1,0,,,"30,000円以上 40,000円未満","10,000円以上 20,000円未満","5,000円以上 10,000円未満",初めて,"インターネット・アプリ
",0,0,0,0,0,1,0,0,0,0,0,0,0,0,あわら温泉街,,福井駅,"1,000円未満",どちらでもない,そこまで引き付けられるものはなかった。,どちらでもない,前問と同じ,感じなかった,,3,前で訊かれた理由と同じ,特になし,また行きたい（1年以内）,特になし
133183,あわら湯のまち エリア,男,1974,49,40代,埼玉県,川口市,"900万円以上 1,000万円未満",mobile/android,2023-05-08 07:51:45,5月,大本山 永平寺 エリア,34.大本山 永平寺 エリア,永平寺町,福井市・永平寺町,,4泊以上,4泊以上,三国・あわらエリア（あわら市・坂井市）,福井県外には宿泊しない,自分ひとり,"まちあるき、都市散策
",0,0,0,0,0,0,0,0,0,0,1,0,0,0,0,0,0,0,"その他
",0,0,0,1,0,0,0,"在来線
路線バス
",0,1,0,0,とても満足,雲水さんの説明がわかりやすかったことに加えて、寺の隅々まで見ることができた。,"30,000円以上 40,000円未満","10,000円以上 20,000円未満","5,000円以上 10,000円未満",初めて,"インターネット・アプリ
",0,0,0,0,0,1,0,0,0,0,0,0,0,0,越前大野城,福井県立歴史博物館,選択なし/該当施設なし,"1,000円以上 3,000円未満",とても満足,①での理由と同じ,とても満足,①での理由と同じ,感じなかった,,8,福井の代表的な観光地のため,特になし。むしろ、永平寺にいる雲水さんたちの修行に配慮した観光を今後も考えていくべきです。,また行きたい（1年以内）,ひとりで行っても楽しめることを求めます。例えば、ひとりでの宿泊を受け入れない宿もあるので、そろそろ考えを改めてほしいです。
