会員ID,登録エリア,性別,生まれ年,回答時の年齢,年代,都道府県,会員市町村,世帯年収,UA,回答日時,回答月,回答エリア,回答エリア2,市町村,6分類,DMO,宿泊数（全体）,宿泊数（県内）,宿泊エリア（県内）,宿泊エリア（県外）,同行者,訪問目的ALL,宿でのんびり過ごす,温泉や露天風呂,地元の美味しいものを食べる,花見や紅葉などの自然鑑賞,名所、旧跡の観光,テーマパーク（遊園地、動物園、博物館など）,買い物、アウトレット,お祭りやイベントへの参加・見物,スポーツ観戦や芸能鑑賞（コンサート等）,アウトドア（海水浴、釣り、登山など）,まちあるき、都市散策,各種体験（手作り、果物狩りなど）,スキー・スノボ、マリンスポーツ,その他スポーツ（ゴルフ、テニスなど）,ドライブ・ツーリング,友人・親戚を尋ねる,出張など仕事関係,その他,福井県までの交通手段ALL,自家用車,レンタカー,新幹線,在来線,飛行機,旅行会社ツアーバス,県外から訪れていない（福井県在住）,福井県内での交通手段ALL,タクシー,路線バス,徒歩,レンタサイクル,福井県内での交通手段の満足度,福井県内での交通手段の満足度の理由,宿泊費,交通費,県内消費額,エリア訪問回数,情報収集ALL,観光展・物産展,新聞・雑誌・ガイドブック,TV・ラジオ番組やCM,観光パンフレット・ポスター,観光連盟やDMOのHP,インターネット・アプリ,Twitter,Instagram,Facebook,ブログ,友人・知人,観光協会等の案内所,タクシードライバーや地元の人,宿泊施設,アンケート回答前に訪問した主な場所,アンケート回答前に訪問した主な場所FA,アンケート回答後に訪問する予定の主な場所,エリア総消費額,満足度(商品・サービス),満足度(商品・サービス)の理由,満足度,満足度の理由,不便さ,不便さの内容,NPS,推奨項目,施設に求めるもの,今後の来訪意向,福井県に求めるもの
133554,福井駅前 エリア,女,1971,52,50代,福井県,福井市,300万円以上 400万円未満,mobile/iphone,2023-05-13 03:13:16,5月,福井駅前 エリア,01.福井駅前 エリア,福井市,福井市・永平寺町,,日帰り,福井県内には宿泊しない,福井県内には宿泊しない,福井県外には宿泊しない,自分ひとり,"各種体験（手作り、果物狩りなど）
",0,0,0,0,0,0,0,0,0,0,0,1,0,0,0,0,0,特になし,"県外から訪れていない（福井県在住）
",0,0,0,0,0,0,1,"路線バス
",0,1,0,0,,,使わない,"1,000円未満","10,000円以上 20,000円未満",11回目以上,"その他
",0,0,0,0,0,0,0,0,0,0,0,0,0,0,選択なし/該当施設なし,護国神社,選択なし/該当施設なし,"1,000円以上 3,000円未満",満足,,どちらでもない,アオッサにあるお店がハピリンにあれば便利。飲食店の選択肢が少ない。,感じた,ハピリン２階の福福館やkirariの通路が狭いと感じた。(ワレモノなどの売り場は特に気をつかった),7,,"1人1000円以内で飲食できる手軽なお店。
普通の洋食店。池田や大野の産直レストラン。IMAXシアター。産直野菜。キャラクターなどの期間限定カフェ。小規模の県営市営ジム(",福井県在住,(飲食)ひとり1000円以内で飲食できる気軽なお店。普通の洋食店。(土産)福井の作家作品。(アクティビティ)IMAXシアター、県営市営の小規模ジム
