会員ID,登録エリア,性別,生まれ年,回答時の年齢,年代,都道府県,会員市町村,世帯年収,UA,回答日時,回答月,回答エリア,回答エリア2,市町村,6分類,DMO,宿泊数（全体）,宿泊数（県内）,宿泊エリア（県内）,宿泊エリア（県外）,同行者,訪問目的ALL,宿でのんびり過ごす,温泉や露天風呂,地元の美味しいものを食べる,花見や紅葉などの自然鑑賞,名所、旧跡の観光,テーマパーク（遊園地、動物園、博物館など）,買い物、アウトレット,お祭りやイベントへの参加・見物,スポーツ観戦や芸能鑑賞（コンサート等）,アウトドア（海水浴、釣り、登山など）,まちあるき、都市散策,各種体験（手作り、果物狩りなど）,スキー・スノボ、マリンスポーツ,その他スポーツ（ゴルフ、テニスなど）,ドライブ・ツーリング,友人・親戚を尋ねる,出張など仕事関係,その他,福井県までの交通手段ALL,自家用車,レンタカー,新幹線,在来線,飛行機,旅行会社ツアーバス,県外から訪れていない（福井県在住）,福井県内での交通手段ALL,タクシー,路線バス,徒歩,レンタサイクル,福井県内での交通手段の満足度,福井県内での交通手段の満足度の理由,宿泊費,交通費,県内消費額,エリア訪問回数,情報収集ALL,観光展・物産展,新聞・雑誌・ガイドブック,TV・ラジオ番組やCM,観光パンフレット・ポスター,観光連盟やDMOのHP,インターネット・アプリ,Twitter,Instagram,Facebook,ブログ,友人・知人,観光協会等の案内所,タクシードライバーや地元の人,宿泊施設,アンケート回答前に訪問した主な場所,アンケート回答前に訪問した主な場所FA,アンケート回答後に訪問する予定の主な場所,エリア総消費額,満足度(商品・サービス),満足度(商品・サービス)の理由,満足度,満足度の理由,不便さ,不便さの内容,NPS,推奨項目,施設に求めるもの,今後の来訪意向,福井県に求めるもの
133804,一乗谷朝倉氏遺跡 エリア,女,1963,60,60代,石川県,加賀市,400万円以上 500万円未満,mobile/iphone,2023-05-15 02:27:29,5月,一乗谷朝倉氏遺跡 エリア,06.一乗谷朝倉氏遺跡 エリア,福井市,福井市・永平寺町,,日帰り,福井県内には宿泊しない,嶺南エリア（敦賀市・美浜町・若狭町・小浜市・おおい町・高浜町）,滋賀県,親,"温泉や露天風呂
地元の美味しいものを食べる
",0,1,1,0,0,0,0,0,0,0,0,0,0,0,0,0,0,0,"自家用車
",0,0,0,0,0,0,0,"路線バス
",0,1,0,0,どちらでもない,交通機関は自家用車が無いと不便,"5,000円以上 10,000円未満","1,000円以上 3,000円未満","5,000円以上 10,000円未満",2～5回目,"新聞・雑誌・ガイドブック
",0,1,0,0,0,0,0,0,0,0,0,0,0,0,越前大野城,,福井県立恐竜博物館,"5,000円以上 10,000円未満",満足,静かな時間が流れていて、癒される,満足,,感じた,バリアフリーになっていなく大変,9,雰囲気が良い,,また行きたい（1年以内）,"せっかくの素敵な自然や施設が沢山あるのに、あまり知られていないので、残念に思います。
又、従業員が受け身"
