会員ID,登録エリア,性別,生まれ年,回答時の年齢,年代,都道府県,会員市町村,世帯年収,UA,回答日時,回答月,回答エリア,回答エリア2,市町村,6分類,DMO,宿泊数（全体）,宿泊数（県内）,宿泊エリア（県内）,宿泊エリア（県外）,同行者,訪問目的ALL,宿でのんびり過ごす,温泉や露天風呂,地元の美味しいものを食べる,花見や紅葉などの自然鑑賞,名所、旧跡の観光,テーマパーク（遊園地、動物園、博物館など）,買い物、アウトレット,お祭りやイベントへの参加・見物,スポーツ観戦や芸能鑑賞（コンサート等）,アウトドア（海水浴、釣り、登山など）,まちあるき、都市散策,各種体験（手作り、果物狩りなど）,スキー・スノボ、マリンスポーツ,その他スポーツ（ゴルフ、テニスなど）,ドライブ・ツーリング,友人・親戚を尋ねる,出張など仕事関係,その他,福井県までの交通手段ALL,自家用車,レンタカー,新幹線,在来線,飛行機,旅行会社ツアーバス,県外から訪れていない（福井県在住）,福井県内での交通手段ALL,タクシー,路線バス,徒歩,レンタサイクル,福井県内での交通手段の満足度,福井県内での交通手段の満足度の理由,宿泊費,交通費,県内消費額,エリア訪問回数,情報収集ALL,観光展・物産展,新聞・雑誌・ガイドブック,TV・ラジオ番組やCM,観光パンフレット・ポスター,観光連盟やDMOのHP,インターネット・アプリ,Twitter,Instagram,Facebook,ブログ,友人・知人,観光協会等の案内所,タクシードライバーや地元の人,宿泊施設,アンケート回答前に訪問した主な場所,アンケート回答前に訪問した主な場所FA,アンケート回答後に訪問する予定の主な場所,エリア総消費額,満足度(商品・サービス),満足度(商品・サービス)の理由,満足度,満足度の理由,不便さ,不便さの内容,NPS,推奨項目,施設に求めるもの,今後の来訪意向,福井県に求めるもの
133863,大本山 永平寺 エリア,男,1952,71,70代,福島県,郡山市,300万円以上 400万円未満,mobile/iphone,2023-05-15 20:35:19,5月,大本山 永平寺 エリア,34.大本山 永平寺 エリア,永平寺町,福井市・永平寺町,,4泊以上,1泊,福井エリア（福井市・永平寺町）,石川県金沢市,自分ひとり,"地元の美味しいものを食べる
名所、旧跡の観光
",0,0,1,0,1,0,0,0,0,0,0,0,0,0,0,0,0,0,"在来線
飛行機
",0,0,0,1,1,0,0,"在来線
路線バス
",0,1,0,0,どちらでもない,"永平寺に早朝行きたいが、電車バスの乗り継ぎでも9時着。帰りは直行バスという変則の選択肢は初めての観光客には分かりづらい。案を作成したら
福井県に来たことのない人に見てもらうのも一案です。","10,000円以上 20,000円未満","20,000円以上 30,000円未満","5,000円以上 10,000円未満",初めて,"インターネット・アプリ
",0,0,0,0,0,1,0,0,0,0,0,0,0,0,福井駅,今回は永平寺のみ,選択なし/該当施設なし,"5,000円以上 10,000円未満",満足,"今後こうした質問には番号を付して下さい。
(例　Q6  回答はA6 )コメントする場合に便利です。上記はアンケート施設を聞いているのか　商品サービスなのか、質問がわかりにくいです。",とても満足,永平寺の内部移動のわかりやすさと坐禅体験を500円で行なってくれたことに感謝です。海外からの客には護摩焚きが人気です。胡麻豆腐と護摩炊きのEnjoy  Gomaでアピールも良いと思います。,感じなかった,早朝に永平寺に福井駅から直行できるバスの運行。例えば早朝に行き散策したい等です。,8,"福井はやはり海産物が新鮮で値段も手頃です。
永平寺の坐禅体験。2024年新幹線開通を今からアピールしてアクセス方法の検討が出来るようにする。小浜市のサバももう一度アピール。",永平寺周辺の遊歩道や散策ルートの整備。海外からの客にはFreeWiFiと電子マネーと写真付きのメニューが必須です。一年後の新幹線開通を控えこれらを整備しないと、海外からは来ないと思います。これをいち早く整備して海外からの客が日本人より圧倒的に多い白川郷や高野山が手本になると思います。従業員や僧侶も英語で対応しています。日本とは思えない感じです。,機会があれば行きたい,"福井県は恐竜も有名ですが、私は海産物が新鮮で値段も手頃で最高でした。福井駅中心にバス半日コース等の整備。予約はネット、Cashless、FWは
必須です。高野山のバスは日本語英語フランス語のアナウンスです。高野山に行くと世界がわかります。特に欧米人が多い。日本人の数倍。"
