会員ID,登録エリア,性別,生まれ年,回答時の年齢,年代,都道府県,会員市町村,世帯年収,UA,回答日時,回答月,回答エリア,回答エリア2,市町村,6分類,DMO,宿泊数（全体）,宿泊数（県内）,宿泊エリア（県内）,宿泊エリア（県外）,同行者,訪問目的ALL,宿でのんびり過ごす,温泉や露天風呂,地元の美味しいものを食べる,花見や紅葉などの自然鑑賞,名所、旧跡の観光,テーマパーク（遊園地、動物園、博物館など）,買い物、アウトレット,お祭りやイベントへの参加・見物,スポーツ観戦や芸能鑑賞（コンサート等）,アウトドア（海水浴、釣り、登山など）,まちあるき、都市散策,各種体験（手作り、果物狩りなど）,スキー・スノボ、マリンスポーツ,その他スポーツ（ゴルフ、テニスなど）,ドライブ・ツーリング,友人・親戚を尋ねる,出張など仕事関係,その他,福井県までの交通手段ALL,自家用車,レンタカー,新幹線,在来線,飛行機,旅行会社ツアーバス,県外から訪れていない（福井県在住）,福井県内での交通手段ALL,タクシー,路線バス,徒歩,レンタサイクル,福井県内での交通手段の満足度,福井県内での交通手段の満足度の理由,宿泊費,交通費,県内消費額,エリア訪問回数,情報収集ALL,観光展・物産展,新聞・雑誌・ガイドブック,TV・ラジオ番組やCM,観光パンフレット・ポスター,観光連盟やDMOのHP,インターネット・アプリ,Twitter,Instagram,Facebook,ブログ,友人・知人,観光協会等の案内所,タクシードライバーや地元の人,宿泊施設,アンケート回答前に訪問した主な場所,アンケート回答前に訪問した主な場所FA,アンケート回答後に訪問する予定の主な場所,エリア総消費額,満足度(商品・サービス),満足度(商品・サービス)の理由,満足度,満足度の理由,不便さ,不便さの内容,NPS,推奨項目,施設に求めるもの,今後の来訪意向,福井県に求めるもの
137522,JR美浜駅 エリア,女,1958,65,60代,福井県,あわら市,300万円以上 400万円未満,mobile/android,2023-07-04 14:05:55,7月,JR美浜駅 エリア,79.JR美浜駅 エリア,美浜町,嶺南東部,三方五湖DMO(株),日帰り,福井県内には宿泊しない,福井県内には宿泊しない,福井県外には宿泊しない,夫婦2人,"ドライブ・ツーリング
",0,0,0,0,0,0,0,0,0,0,0,0,0,0,1,0,0,0,"自家用車
県外から訪れていない（福井県在住）
",1,0,0,0,0,0,1,"自家用車
",0,0,0,0,,,使わない,"1,000円以上 3,000円未満","3,000円以上 5,000円未満",初めて,"TV・ラジオ番組やCM
インターネット・アプリ
",0,0,1,0,0,1,0,0,0,0,0,0,0,0,選択なし/該当施設なし,,選択なし/該当施設なし,"3,000円以上 5,000円未満",満足,こちらでしか買えない物が買えたから。,満足,はまびよりが素敵だったから。,感じなかった,,7,海辺の景色。ヘシコなどの海産物,ここでしかなかなか買えない物（お酒、海産物）を置いてほしい。,福井県在住,その土地で取れる物を中心とした飲食物の提供
137522,JR美浜駅 エリア,女,1958,65,60代,福井県,あわら市,300万円以上 400万円未満,mobile/android,2023-10-28 16:52:40,10月,道の駅「三方五湖」  エリア,83.道の駅「三方五湖」 エリア,若狭町,嶺南東部,三方五湖DMO(株),1泊,1泊,嶺南エリア（敦賀市・美浜町・若狭町・小浜市・おおい町・高浜町）,福井県外には宿泊しない,友人,"温泉や露天風呂
地元の美味しいものを食べる
",0,1,1,0,0,0,0,0,0,0,0,0,0,0,0,0,0,0,"県外から訪れていない（福井県在住）
",1,0,0,0,0,0,1,"自家用車
",0,0,0,0,,,"10,000円以上 20,000円未満","3,000円以上 5,000円未満","3,000円以上 5,000円未満",2～5回目,"友人・知人
",0,0,0,0,0,0,0,0,0,0,1,0,0,0,選択なし/該当施設なし,,敦賀赤レンガ倉庫,"20,000円以上 30,000円未満",満足,,とても満足,お料理がとても美味しかった!,感じなかった,,9,温泉、景色、お料理が最高！,,,
137522,JR美浜駅 エリア,女,1958,65,60代,福井県,あわら市,300万円以上 400万円未満,mobile/android,2023-12-09 20:39:36,12月,北潟湖 エリア,20.北潟湖 エリア,あわら市,あわら市・坂井市,,日帰り,福井県内には宿泊しない,福井県内には宿泊しない,福井県外には宿泊しない,夫婦2人,"花見や紅葉などの自然鑑賞
ドライブ・ツーリング
",0,0,0,1,0,0,0,0,0,0,0,0,0,0,1,0,0,0,"県外から訪れていない（福井県在住）
",1,0,0,0,0,0,1,"自家用車
",0,0,0,0,,,使わない,"1,000円未満","1,000円以上 3,000円未満",2～5回目,"新聞・雑誌・ガイドブック
TV・ラジオ番組やCM
友人・知人
",0,1,1,0,0,0,0,0,0,0,1,0,0,0,選択なし/該当施設なし,鴨池観察館,選択なし/該当施設なし,"1,000円未満",どちらでもない,売り場面積が狭く、商品数が少ない。,どちらでもない,,感じなかった,,7,道の駅、カフェからの景色,焼き芋屋、さつまいもを使ったスイーツ,福井県在住,
137522,JR美浜駅 エリア,女,1958,65,60代,福井県,あわら市,300万円以上 400万円未満,mobile/android,2023-12-10 14:10:15,12月,JR芦原温泉駅 エリア,16.JR芦原温泉駅 エリア,あわら市,あわら市・坂井市,,日帰り,福井県内には宿泊しない,福井県内には宿泊しない,福井県外には宿泊しない,夫婦2人,"ドライブ・ツーリング
",0,0,0,0,0,0,0,0,0,0,0,0,0,0,1,0,0,0,"県外から訪れていない（福井県在住）
",1,0,0,0,0,0,1,"自家用車
",0,0,0,0,満足,,使わない,"1,000円未満","1,000円以上 3,000円未満",6～10回目,"友人・知人
",0,0,0,0,0,0,0,0,0,0,1,0,0,0,選択なし/該当施設なし,,選択なし/該当施設なし,"1,000円以上 3,000円未満",満足,アフレアがきれいで気持ちがいい,満足,,感じなかった,,6,芦原温泉のおもてなし、料理,駅前通りがもう少し活気ができるといい。,福井県在住,
137522,JR美浜駅 エリア,女,1958,65,60代,福井県,あわら市,300万円以上 400万円未満,mobile/android,2023-12-10 12:36:19,12月,道の駅「越前」 エリア,49.道の駅「越前」 エリア,越前町,丹南,一般社団法人 越前町観光連盟,日帰り,福井県内には宿泊しない,福井県内には宿泊しない,福井県外には宿泊しない,夫婦2人,"ドライブ・ツーリング
",0,0,0,0,0,0,0,0,0,0,0,0,0,0,1,0,0,0,"県外から訪れていない（福井県在住）
",1,0,0,0,0,0,1,"自家用車
",0,0,0,0,,,使わない,"1,000円未満","1,000円以上 3,000円未満",2～5回目,"友人・知人
",0,0,0,0,0,0,0,0,0,0,1,0,0,0,選択なし/該当施設なし,,越前がにミュージアム,"10,000円以上 20,000円未満",満足,海鮮丼等地元の美味しい物が食べられたから,満足,,感じた,昔あった魚屋さんがすっかりさびれ店を閉めている所が何件もあったこと,8,海の幸が美味しく、日本海の景色も美しいから。,水仙が安く買えるとうれしい,福井県在住,
137522,JR美浜駅 エリア,女,1958,65,60代,福井県,あわら市,300万円以上 400万円未満,mobile/android,2023-12-15 19:52:14,12月,あわら湯のまち エリア,17.あわら湯のまち エリア,あわら市,あわら市・坂井市,,日帰り,福井県内には宿泊しない,福井県内には宿泊しない,福井県外には宿泊しない,自分ひとり,"温泉や露天風呂
買い物、アウトレット
",0,1,0,0,0,0,1,0,0,0,0,0,0,0,0,0,0,0,"県外から訪れていない（福井県在住）
",1,0,0,0,0,0,1,"自家用車
",0,0,0,0,,,"1,000円以上 3,000円未満","1,000円未満","1,000円以上 3,000円未満",11回目以上,"観光パンフレット・ポスター
友人・知人
",0,0,0,1,0,0,0,0,0,0,1,0,0,0,道の駅「さかい」（坂井地域交流センター「いねす」）,,あわら温泉「芦湯」,"1,000円以上 3,000円未満",満足,,満足,,感じた,足湯は癒やされるのですが、お湯が熱い所が多いので、もう少しぬるいお湯があってもいいと思います。,8,芦原温泉の料理とおもてなし,,,
137522,JR美浜駅 エリア,女,1958,66,60代,福井県,あわら市,300万円以上 400万円未満,mobile/android,2024-02-04 20:13:03,2月,JR九頭竜湖駅 エリア,23.JR九頭竜湖駅 エリア,大野市,勝山市・大野市,,日帰り,福井県内には宿泊しない,福井県内には宿泊しない,福井県外には宿泊しない,夫婦2人,"お祭りやイベントへの参加・見物
",0,0,0,0,0,0,0,1,0,0,0,0,0,0,0,0,0,0,"県外から訪れていない（福井県在住）
",1,0,0,0,0,0,1,"自家用車
",0,0,0,0,,,使わない,"1,000円以上 3,000円未満","1,000円以上 3,000円未満",2～5回目,"新聞・雑誌・ガイドブック
",0,1,0,0,0,0,0,0,0,0,0,0,0,0,選択なし/該当施設なし,丸岡町,選択なし/該当施設なし,"1,000円以上 3,000円未満",どちらでもない,冬期ということで道の駅が閉鎖していたから,どちらでもない,道の駅近くのコンビニの中に九頭竜地区のお土産が売っていたが、数が少なかったから,感じなかった,,7,自然が美しい,地元の美味しい物を食べられるお店があるといい。冬期間、道の駅が閉まっていても。,福井県在住,
137522,JR美浜駅 エリア,女,1958,66,60代,福井県,あわら市,300万円以上 400万円未満,mobile/android,2024-03-24 11:53:11,3月,あわら湯のまち エリア,17.あわら湯のまち エリア,あわら市,あわら市・坂井市,,日帰り,福井県内には宿泊しない,福井県内には宿泊しない,福井県外には宿泊しない,その他家族,"その他
",0,0,0,0,0,0,0,0,0,0,0,0,0,0,0,0,0,0,"自家用車
",1,0,0,0,0,0,0,"自家用車
",0,0,0,0,満足,,使わない,使わない,"5,000円以上 10,000円未満",11回目以上,"友人・知人
",0,0,0,0,0,0,0,0,0,0,1,0,0,0,選択なし/該当施設なし,,選択なし/該当施設なし,"5,000円以上 10,000円未満",満足,旅館の対応がよかったです。,満足,,感じなかった,,9,旅館の接客、サービスがよい。,,福井県在住,
