会員ID,登録エリア,性別,生まれ年,回答時の年齢,年代,都道府県,会員市町村,世帯年収,UA,回答日時,回答月,回答エリア,回答エリア2,市町村,6分類,DMO,宿泊数（全体）,宿泊数（県内）,宿泊エリア（県内）,宿泊エリア（県外）,同行者,訪問目的ALL,宿でのんびり過ごす,温泉や露天風呂,地元の美味しいものを食べる,花見や紅葉などの自然鑑賞,名所、旧跡の観光,テーマパーク（遊園地、動物園、博物館など）,買い物、アウトレット,お祭りやイベントへの参加・見物,スポーツ観戦や芸能鑑賞（コンサート等）,アウトドア（海水浴、釣り、登山など）,まちあるき、都市散策,各種体験（手作り、果物狩りなど）,スキー・スノボ、マリンスポーツ,その他スポーツ（ゴルフ、テニスなど）,ドライブ・ツーリング,友人・親戚を尋ねる,出張など仕事関係,その他,福井県までの交通手段ALL,自家用車,レンタカー,新幹線,在来線,飛行機,旅行会社ツアーバス,県外から訪れていない（福井県在住）,福井県内での交通手段ALL,タクシー,路線バス,徒歩,レンタサイクル,福井県内での交通手段の満足度,福井県内での交通手段の満足度の理由,宿泊費,交通費,県内消費額,エリア訪問回数,情報収集ALL,観光展・物産展,新聞・雑誌・ガイドブック,TV・ラジオ番組やCM,観光パンフレット・ポスター,観光連盟やDMOのHP,インターネット・アプリ,Twitter,Instagram,Facebook,ブログ,友人・知人,観光協会等の案内所,タクシードライバーや地元の人,宿泊施設,アンケート回答前に訪問した主な場所,アンケート回答前に訪問した主な場所FA,アンケート回答後に訪問する予定の主な場所,エリア総消費額,満足度(商品・サービス),満足度(商品・サービス)の理由,満足度,満足度の理由,不便さ,不便さの内容,NPS,推奨項目,施設に求めるもの,今後の来訪意向,福井県に求めるもの
137595,北ノ庄 エリア,女,1970,53,50代,新潟県,新潟市西区,100万円未満,mobile/iphone,2023-07-05 15:38:02,7月,北ノ庄 エリア,03.北ノ庄 エリア,福井市,福井市・永平寺町,,1泊,1泊,福井エリア（福井市・永平寺町）,福井県外には宿泊しない,自分ひとり,"地元の美味しいものを食べる
名所、旧跡の観光
まちあるき、都市散策
",0,0,1,0,1,0,0,0,0,0,1,0,0,0,0,0,0,0,"自家用車
",1,0,0,0,0,0,0,"自家用車
徒歩
",0,0,1,0,,,"5,000円以上 10,000円未満","3,000円以上 5,000円未満","10,000円以上 20,000円未満",初めて,"観光パンフレット・ポスター
",0,0,0,1,0,0,0,0,0,0,0,0,0,0,北の庄城址・柴田公園,,岡太神社・大瀧神社,"1,000円未満",とても満足,柴田神社御朱印が見開き2ページいただけた,とても満足,"北ノ庄城址資料館で
柴田勝家、前田利家、賤ヶ岳の戦いのことを
調べるきっかけとなった",感じた,"北ノ庄城址は石垣、礎石など残していただき見れるようになっているが、
イメージがしにくかった。",10,"どうする家康の舞台や関係者が多く
見どころがたくさんある",,また行きたい（1年以内）,ぐじ料理が食べたい
137595,北ノ庄 エリア,女,1970,53,50代,新潟県,新潟市西区,100万円未満,mobile/iphone,2023-08-11 20:48:19,8月,平泉寺白山神社 エリア,29.平泉寺白山神社 エリア,勝山市,勝山市・大野市,勝山市観光まちづくり(株),3泊,3泊,奥越前エリア（勝山市・大野市）,福井県外には宿泊しない,夫婦2人,"名所、旧跡の観光
",0,0,0,0,1,0,0,0,0,0,0,0,0,0,0,0,0,0,"自家用車
",1,0,0,0,0,0,0,"自家用車
",0,0,0,0,,,"20,000円以上 30,000円未満","5,000円以上 10,000円未満","20,000円以上 30,000円未満",初めて,"観光パンフレット・ポスター
観光連盟やDMOのHP
観光協会等の案内所
",0,0,0,1,1,0,0,0,0,0,0,1,0,0,選択なし/該当施設なし,,岡太神社・大瀧神社,"1,000円以上 3,000円未満",満足,どこも御朱印の金額が安く金儲け主義ではない,とても満足,"福井現地の人に
平泉寺は絶対行った方がいいと言われたとおり
大変素晴らしいところだった
知らない人多いと思う
もっと観光アピールした方が良い
ガイドさんが、ボランティア精神で
金儲け主義ではない",感じた,"無料高速道路の無料の部分を
大きく表示してほしい
高速かと思い乗り損ねたり　前の車も迷っていた",10,"平泉寺
空気賀違う
かつての都市の賑わいや活気を感じ
パワースポットと感じた
特に遺跡発掘現場は
500年前をタイムスリップできる",,また行きたい（1年以内）,"パンフレットのクオリティが高い
歴史的見どころがたくさんあるので　　
大きくアピールした方がいい"
137595,北ノ庄 エリア,女,1970,53,50代,新潟県,新潟市西区,100万円未満,mobile/iphone,2023-08-15 10:57:33,8月,熊川宿 エリア,81.熊川宿 エリア,若狭町,嶺南東部,三方五湖DMO(株),3泊,3泊,奥越前エリア（勝山市・大野市）,福井県外には宿泊しない,夫婦2人,"名所、旧跡の観光
",0,0,0,0,1,0,0,0,0,0,0,0,0,0,0,0,0,0,"自家用車
",1,0,0,0,0,0,0,"自家用車
",0,0,0,0,とても満足,駐車場が多い,"20,000円以上 30,000円未満","5,000円以上 10,000円未満","20,000円以上 30,000円未満",初めて,"観光協会等の案内所
",0,0,0,0,0,0,0,0,0,0,0,1,0,0,明通寺,,福井県年縞博物館,"1,000円未満",満足,水饅頭屋さんの奥さんが、手のかかる水饅頭を一生懸命作っておられて出来立てをいただいた,どちらでもない,"一応マップにはお店がありましたが
お盆のため店は空いておらず。
ここは商業施設ではなく
住宅地であり
ただ風景を楽しむところだと言われた
（その通り）",感じなかった,,7,,"積極的な観光地ではなく
人が住んでいる場所であることは
パンフレットからは伺えず。
食べ歩きできる観光地だと思うと
がっかりするかも。
人が住んでる民家なので
ご迷惑ないよう見学しないとですね
道の駅があって良いです",また行きたい（1年以内）,"ぐじが名物ということで
旅の目的でぐじ焼き定食を食べたいと小浜まで行った
希少な魚なのか
提供する店も少なく
行った店は、昨日で売り切れましたと言われ
がっかりしました。

鯖のように、どこでもいつでも食べれるわけではないといのは、知らなかった。"
137595,北ノ庄 エリア,女,1970,53,50代,新潟県,新潟市西区,100万円未満,mobile/iphone,2023-08-15 10:37:59,8月,明通寺 エリア,73.明通寺 エリア,小浜市,嶺南西部,(株)まちづくり小浜,3泊,3泊,奥越前エリア（勝山市・大野市）,福井県外には宿泊しない,夫婦2人,"名所、旧跡の観光
",0,0,0,0,1,0,0,0,0,0,0,0,0,0,0,0,0,0,"自家用車
",1,0,0,0,0,0,0,"自家用車
",0,0,0,0,とても満足,,"20,000円以上 30,000円未満","5,000円以上 10,000円未満","20,000円以上 30,000円未満",初めて,"観光協会等の案内所
",0,0,0,0,0,0,0,0,0,0,0,1,0,0,レインボーライン,,熊川宿,"1,000円以上 3,000円未満",満足,,とても満足,明通寺では、お寺の方がきちんとご説明してくださった,感じなかった,,10,,"明通寺の近くには飲食店がなく
唯一蓬莱屋があって良かった",また行きたい（1年以内）,
