会員ID,登録エリア,性別,生まれ年,回答時の年齢,年代,都道府県,会員市町村,世帯年収,UA,回答日時,回答月,回答エリア,回答エリア2,市町村,6分類,DMO,宿泊数（全体）,宿泊数（県内）,宿泊エリア（県内）,宿泊エリア（県外）,同行者,訪問目的ALL,宿でのんびり過ごす,温泉や露天風呂,地元の美味しいものを食べる,花見や紅葉などの自然鑑賞,名所、旧跡の観光,テーマパーク（遊園地、動物園、博物館など）,買い物、アウトレット,お祭りやイベントへの参加・見物,スポーツ観戦や芸能鑑賞（コンサート等）,アウトドア（海水浴、釣り、登山など）,まちあるき、都市散策,各種体験（手作り、果物狩りなど）,スキー・スノボ、マリンスポーツ,その他スポーツ（ゴルフ、テニスなど）,ドライブ・ツーリング,友人・親戚を尋ねる,出張など仕事関係,その他,福井県までの交通手段ALL,自家用車,レンタカー,新幹線,在来線,飛行機,旅行会社ツアーバス,県外から訪れていない（福井県在住）,福井県内での交通手段ALL,タクシー,路線バス,徒歩,レンタサイクル,福井県内での交通手段の満足度,福井県内での交通手段の満足度の理由,宿泊費,交通費,県内消費額,エリア訪問回数,情報収集ALL,観光展・物産展,新聞・雑誌・ガイドブック,TV・ラジオ番組やCM,観光パンフレット・ポスター,観光連盟やDMOのHP,インターネット・アプリ,Twitter,Instagram,Facebook,ブログ,友人・知人,観光協会等の案内所,タクシードライバーや地元の人,宿泊施設,アンケート回答前に訪問した主な場所,アンケート回答前に訪問した主な場所FA,アンケート回答後に訪問する予定の主な場所,エリア総消費額,満足度(商品・サービス),満足度(商品・サービス)の理由,満足度,満足度の理由,不便さ,不便さの内容,NPS,推奨項目,施設に求めるもの,今後の来訪意向,福井県に求めるもの
148205,道の駅「西山公園」 エリア,女,1978,45,40代,愛知県,海部郡,100万円以上 200万円未満,mobile/iphone,2023-12-04 21:21:26,12月,道の駅「西山公園」 エリア,44.道の駅「西山公園」 エリア,鯖江市,丹南,,日帰り,2泊,福井エリア（福井市・永平寺町）,滋賀県,小学生以下連れの家族,"名所、旧跡の観光
スポーツ観戦や芸能鑑賞（コンサート等）
",0,0,0,0,1,0,0,0,1,0,0,0,0,0,0,0,0,0,"自家用車
",1,0,0,0,0,0,0,"自家用車
",0,0,0,0,どちらでもない,近くに駅が無いから、電車では行きにくいかなぁと思います。,"10,000円以上 20,000円未満","10,000円以上 20,000円未満","10,000円以上 20,000円未満",2～5回目,"観光展・物産展
観光パンフレット・ポスター
",1,0,0,1,0,0,0,0,0,0,0,0,0,0,丸岡城,福井駅,選択なし/該当施設なし,"1,000円以上 3,000円未満",とても満足,"動物園が無料なのはありがたいです。
遊ぶとこも沢山ありますし、食事もリーズナブルで、お土産もなんとなく他より安い気がします。",とても満足,お土産の種類が多いし、子供連れでも、動物園があって楽しめるし、アップダウン歩くのきついですが、運動になります！,感じなかった,,10,"かわいいレッサーパンダ達が、好きなだけ無料で見れるのはすごく楽しいです。
ゆっくり休める場所もあるのがいいです。",お土産、動物園、すごく楽しめます。来たら毎回行きたいです！レッサーパンダが近すぎて可愛すぎます！,また行きたい（1年以内）,"ゴーゴーカレーがあったので、行きました！ちょっと辛いけど、美味しかったです。
越前水族館も、西山動物園も、近くてほんと楽しいです"
