会員ID,登録エリア,性別,生まれ年,回答時の年齢,年代,都道府県,会員市町村,世帯年収,UA,回答日時,回答月,回答エリア,回答エリア2,市町村,6分類,DMO,宿泊数（全体）,宿泊数（県内）,宿泊エリア（県内）,宿泊エリア（県外）,同行者,訪問目的ALL,宿でのんびり過ごす,温泉や露天風呂,地元の美味しいものを食べる,花見や紅葉などの自然鑑賞,名所、旧跡の観光,テーマパーク（遊園地、動物園、博物館など）,買い物、アウトレット,お祭りやイベントへの参加・見物,スポーツ観戦や芸能鑑賞（コンサート等）,アウトドア（海水浴、釣り、登山など）,まちあるき、都市散策,各種体験（手作り、果物狩りなど）,スキー・スノボ、マリンスポーツ,その他スポーツ（ゴルフ、テニスなど）,ドライブ・ツーリング,友人・親戚を尋ねる,出張など仕事関係,その他,福井県までの交通手段ALL,自家用車,レンタカー,新幹線,在来線,飛行機,旅行会社ツアーバス,県外から訪れていない（福井県在住）,福井県内での交通手段ALL,タクシー,路線バス,徒歩,レンタサイクル,福井県内での交通手段の満足度,福井県内での交通手段の満足度の理由,宿泊費,交通費,県内消費額,エリア訪問回数,情報収集ALL,観光展・物産展,新聞・雑誌・ガイドブック,TV・ラジオ番組やCM,観光パンフレット・ポスター,観光連盟やDMOのHP,インターネット・アプリ,Twitter,Instagram,Facebook,ブログ,友人・知人,観光協会等の案内所,タクシードライバーや地元の人,宿泊施設,アンケート回答前に訪問した主な場所,アンケート回答前に訪問した主な場所FA,アンケート回答後に訪問する予定の主な場所,エリア総消費額,満足度(商品・サービス),満足度(商品・サービス)の理由,満足度,満足度の理由,不便さ,不便さの内容,NPS,推奨項目,施設に求めるもの,今後の来訪意向,福井県に求めるもの
148436,福井駅前 エリア（宿泊施設）,男,1997,26,20代,滋賀県,野洲市,700万円以上 800万円未満,mobile/iphone,2023-12-10 08:52:49,12月,福井駅前 エリア（宿泊施設）,02.福井駅前 エリア（宿泊施設）,福井市,福井市・永平寺町,,2泊,2泊,三国・あわらエリア（あわら市・坂井市）,福井県外には宿泊しない,恋人,"温泉や露天風呂
地元の美味しいものを食べる
名所、旧跡の観光
",0,1,1,0,1,0,0,0,0,0,0,0,0,0,0,0,0,0,"自家用車
",1,0,0,0,0,0,0,"自家用車
",0,0,0,0,,,"20,000円以上 30,000円未満","5,000円以上 10,000円未満","50,000円以上 100,000円未満",初めて,"観光連盟やDMOのHP
",0,0,0,0,1,0,0,0,0,0,0,0,0,0,道の駅「越前」,恐竜博物館,一乗谷朝倉氏遺跡,"10,000円以上 20,000円未満",とても満足,"インバウンド旅行客が少なく落ち着いて宿泊出来たから。
駅前の商店街では、地元の名物を取り扱った居酒屋で、美味しいものに舌鼓をうちつつ、パートナーと素敵なひと時を過ごすことができたから。",とても満足,駅前という好立地にも関わらず、駐車場があり旅行客としては非常に有り難かった。,感じた,繁華街の位置がわかりづらい。居酒屋を探すのにやや苦労した。,8,海鮮料理を始めとした食文化の素晴らしさを感じることが出来るから。自然豊かで風情ある街並みを歩き楽しむことができるから。,ものづくり福井といいながら、それをアピールする催し、イベントが見られない。メーカーで働いているものとして、非常に気になるところではあった。,また行きたい（1年以内）,こんなにも素敵な街なのに、旅行に行かれる人が少ないのはもったいないと思う。知人に今後旅行を勧めようと思いますが、人伝ての宣伝よりも、自治体が積極的にターゲットを絞り広告宣伝することで、より多くの人が福井の素晴らしさを感じることが出来ると思う。
148436,福井駅前 エリア（宿泊施設）,男,1997,27,20代,滋賀県,野洲市,700万円以上 800万円未満,mobile/iphone,2024-02-23 18:55:30,2月,東尋坊 エリア,10.東尋坊 エリア,坂井市,あわら市・坂井市,(一社)DMOさかい観光局,2泊,2泊,三国・あわらエリア（あわら市・坂井市）,福井県外には宿泊しない,恋人,"温泉や露天風呂
地元の美味しいものを食べる
テーマパーク（遊園地、動物園、博物館など）
",0,1,1,0,0,1,0,0,0,0,0,0,0,0,0,0,0,0,"自家用車
",1,0,0,0,0,0,0,"自家用車
",0,0,0,0,,,"30,000円以上 40,000円未満","5,000円以上 10,000円未満","20,000円以上 30,000円未満",初めて,"新聞・雑誌・ガイドブック
インターネット・アプリ
",0,1,0,0,0,1,0,0,0,0,0,0,0,0,福井県立恐竜博物館,,選択なし/該当施設なし,"1,000円以上 3,000円未満",満足,,とても満足,,感じた,,7,,,また行きたい（1年以内）,
