会員ID,登録エリア,性別,生まれ年,回答時の年齢,年代,都道府県,会員市町村,世帯年収,UA,回答日時,回答月,回答エリア,回答エリア2,市町村,6分類,DMO,宿泊数（全体）,宿泊数（県内）,宿泊エリア（県内）,宿泊エリア（県外）,同行者,訪問目的ALL,宿でのんびり過ごす,温泉や露天風呂,地元の美味しいものを食べる,花見や紅葉などの自然鑑賞,名所、旧跡の観光,テーマパーク（遊園地、動物園、博物館など）,買い物、アウトレット,お祭りやイベントへの参加・見物,スポーツ観戦や芸能鑑賞（コンサート等）,アウトドア（海水浴、釣り、登山など）,まちあるき、都市散策,各種体験（手作り、果物狩りなど）,スキー・スノボ、マリンスポーツ,その他スポーツ（ゴルフ、テニスなど）,ドライブ・ツーリング,友人・親戚を尋ねる,出張など仕事関係,その他,福井県までの交通手段ALL,自家用車,レンタカー,新幹線,在来線,飛行機,旅行会社ツアーバス,県外から訪れていない（福井県在住）,福井県内での交通手段ALL,タクシー,路線バス,徒歩,レンタサイクル,福井県内での交通手段の満足度,福井県内での交通手段の満足度の理由,宿泊費,交通費,県内消費額,エリア訪問回数,情報収集ALL,観光展・物産展,新聞・雑誌・ガイドブック,TV・ラジオ番組やCM,観光パンフレット・ポスター,観光連盟やDMOのHP,インターネット・アプリ,Twitter,Instagram,Facebook,ブログ,友人・知人,観光協会等の案内所,タクシードライバーや地元の人,宿泊施設,アンケート回答前に訪問した主な場所,アンケート回答前に訪問した主な場所FA,アンケート回答後に訪問する予定の主な場所,エリア総消費額,満足度(商品・サービス),満足度(商品・サービス)の理由,満足度,満足度の理由,不便さ,不便さの内容,NPS,推奨項目,施設に求めるもの,今後の来訪意向,福井県に求めるもの
148527,明通寺 エリア,女,1973,50,50代,福井県,敦賀市,"900万円以上 1,000万円未満",mobile/android,2023-12-11 21:38:01,12月,明通寺 エリア,73.明通寺 エリア,小浜市,嶺南西部,(株)まちづくり小浜,日帰り,福井県内には宿泊しない,福井県内には宿泊しない,福井県外には宿泊しない,自分ひとり,"花見や紅葉などの自然鑑賞
名所、旧跡の観光
",0,0,0,1,1,0,0,0,0,0,0,0,0,0,0,0,0,0,"県外から訪れていない（福井県在住）
",1,0,0,0,0,0,1,"自家用車
",0,0,0,0,とても満足,自分の好きな時間に好きな場所へ移動できるから。,使わない,"1,000円未満","1,000円未満",2～5回目,"Instagram
Facebook
",0,0,0,0,0,0,0,1,1,0,0,0,0,0,羽賀寺,,選択なし/該当施設なし,"1,000円以上 3,000円未満",満足,説明もあり、知識が増えた。,満足,紅葉がきれいだった。,感じなかった,,9,紅葉の時期の美しさ。他とは違った美しさを見ることができるため。,"飲食店がもっとあれば嬉しいです。
あまり情報もなくて、分かりませんでした。",福井県在住,アクティビティに関してまとめた冊子があるといいなと思います。
148527,明通寺 エリア,女,1973,51,50代,福井県,敦賀市,"900万円以上 1,000万円未満",mobile/android,2024-01-24 21:48:17,1月,まちの市場 こってコテいけだ エリア,47.まちの市場 こってコテいけだ エリア,池田町,丹南,一般財団法人 池田屋DMO準備室,日帰り,福井県内には宿泊しない,福井県内には宿泊しない,福井県外には宿泊しない,自分ひとり,"花見や紅葉などの自然鑑賞
名所、旧跡の観光
ドライブ・ツーリング
",0,0,0,1,1,0,0,0,0,0,0,0,0,0,1,0,0,0,"県外から訪れていない（福井県在住）
",1,0,0,0,0,0,1,"自家用車
",0,0,0,0,,,使わない,"1,000円未満","1,000円未満",2～5回目,"観光パンフレット・ポスター
観光連盟やDMOのHP
",0,0,0,1,1,0,0,0,0,0,0,0,0,0,選択なし/該当施設なし,,水晶浜海水浴場,"1,000円未満",とても満足,母屋の食事が丁寧でとてもおいしかったため。,とても満足,全体的に定休日の日でしたが、母屋は開いていて、満足のいく食事ができたため。,感じた,ちょうど定休日のところが多かった。,8,母屋の食事が美味しかった。,以前にも利用したことがありますが、全体の雰囲気もよく、気に入ってきます。,また行きたい（1年以内）,手軽にできるアクティビティがたくさんあるといいなと思います。
148527,明通寺 エリア,女,1973,51,50代,福井県,敦賀市,"900万円以上 1,000万円未満",mobile/android,2024-01-27 16:56:32,1月,タケフナイフビレッジ エリア,39.タケフナイフビレッジ エリア,越前市,丹南,,日帰り,福井県内には宿泊しない,福井県内には宿泊しない,福井県外には宿泊しない,自分ひとり,"ドライブ・ツーリング
",0,0,0,0,0,0,0,0,0,0,0,0,0,0,1,0,0,0,"県外から訪れていない（福井県在住）
",1,0,0,0,0,0,1,"自家用車
",0,0,0,0,,,使わない,"1,000円未満","1,000円未満",2～5回目,"観光連盟やDMOのHP
",0,0,0,0,1,0,0,0,0,0,0,0,0,0,選択なし/該当施設なし,,万葉の里  味真野苑（ミズバショウ・フジ・スイレン・ハギ）,使わない,とても満足,丁寧に対応していただけた。,とても満足,見たり撮影したり、しっかり楽しめた。,感じなかった,,9,"知らないことをたくさん知れる。
フォトスポットがある。",もう少し手軽なお土産が買えるといいなと思います。,また行きたい（1年以内）,手軽な体験ができるようなものがあると嬉しい。
148527,明通寺 エリア,女,1973,51,50代,福井県,敦賀市,"900万円以上 1,000万円未満",mobile/android,2024-02-24 19:03:33,2月,はたや記念館 ゆめおーれ勝山 エリア,30.はたや記念館 ゆめおーれ勝山 エリア,勝山市,勝山市・大野市,勝山市観光まちづくり(株),日帰り,福井県内には宿泊しない,福井県内には宿泊しない,福井県外には宿泊しない,団体旅行,"名所、旧跡の観光
お祭りやイベントへの参加・見物
まちあるき、都市散策
各種体験（手作り、果物狩りなど）
",0,0,0,0,1,0,0,1,0,0,1,1,0,0,0,0,0,0,"旅行会社ツアーバス
",0,0,0,0,0,1,0,"旅行会社ツアーバス
",0,0,0,0,とても満足,観光案内のアナウンスもあり、これまで知らなかった情報も得ることができたため。,使わない,"1,000円未満","1,000円以上 3,000円未満",初めて,"友人・知人
",0,0,0,0,0,0,0,0,0,0,1,0,0,0,選択なし/該当施設なし,,福井駅,"1,000円未満",とても満足,"石鹸の使用体験ができた。
はたおり体験が、楽しかった。",とても満足,いろいろな説明が分かりやすく紹介されていて、知らなかったことを知ることができた。,感じなかった,,8,雰囲気の良い展示がたくさんあった。,時間があればもっと飲食なども楽しみたかった。,また行きたい（1年以内）,アクティビティに関して、もっと選択肢があればいいなと思います。
148527,明通寺 エリア,女,1973,51,50代,福井県,敦賀市,"900万円以上 1,000万円未満",mobile/android,2024-03-05 21:26:45,3月,JR敦賀駅前 エリア,63.JR敦賀駅前 エリア,敦賀市,嶺南東部,,日帰り,福井県内には宿泊しない,福井県内には宿泊しない,福井県外には宿泊しない,自分ひとり,"買い物、アウトレット
",0,0,0,0,0,0,1,0,0,0,0,0,0,0,0,0,0,0,"県外から訪れていない（福井県在住）
",0,0,0,0,0,0,1,"徒歩
",0,0,1,0,,,使わない,使わない,"1,000円未満",11回目以上,"友人・知人
",0,0,0,0,0,0,0,0,0,0,1,0,0,0,選択なし/該当施設なし,,選択なし/該当施設なし,"5,000円以上 10,000円未満",とても満足,希望のお土産ものが買えた。,満足,少し寒かった。,感じなかった,,9,こじんまりとしているが、特に不便も感じない。,おみやげ物は充実していて満足。,また行きたい（1年以内）,敦賀ならではのお土産がもっとあればいいなと思います。
148527,明通寺 エリア,女,1973,51,50代,福井県,敦賀市,"900万円以上 1,000万円未満",mobile/android,2024-03-10 16:44:03,3月,あわら湯のまち エリア,17.あわら湯のまち エリア,あわら市,あわら市・坂井市,,日帰り,福井県内には宿泊しない,福井県内には宿泊しない,福井県外には宿泊しない,自分ひとり,"買い物、アウトレット
",0,0,0,0,0,0,1,0,0,0,0,0,0,0,0,0,0,0,"県外から訪れていない（福井県在住）
",1,0,0,0,0,0,1,"自家用車
",0,0,0,0,とても満足,,使わない,使わない,"1,000円未満",2～5回目,"友人・知人
",0,0,0,0,0,0,0,0,0,0,1,0,0,0,水晶浜海水浴場,,選択なし/該当施設なし,"1,000円未満",とても満足,足湯が気持ちよかった。,とても満足,雰囲気が良くリラックスできた。,感じた,少し寒かった。,8,狭いエリアの中で雰囲気を味わったり、楽しんだりできる。,飲食はできるが、お土産はもう少しお店があればいいなと思いました。,また行きたい（1年以内）,それぞれの地域の特徴が出せるといいなと思います。
148527,明通寺 エリア,女,1973,51,50代,福井県,敦賀市,"900万円以上 1,000万円未満",mobile/android,2024-03-10 16:34:29,3月,水晶浜 エリア,75.水晶浜 エリア,美浜町,嶺南東部,三方五湖DMO(株),日帰り,福井県内には宿泊しない,福井県内には宿泊しない,福井県外には宿泊しない,自分ひとり,"買い物、アウトレット
",0,0,0,0,0,0,1,0,0,0,0,0,0,0,0,0,0,0,"県外から訪れていない（福井県在住）
",1,0,0,0,0,0,1,"自家用車
",0,0,0,0,,,使わない,使わない,"1,000円未満",11回目以上,"友人・知人
",0,0,0,0,0,0,0,0,0,0,1,0,0,0,西福寺,,あわら温泉屋台村「湯けむり横丁」,"1,000円以上 3,000円未満",とても満足,美味しいランチをいただきました。,とても満足,景色がとても綺麗でした。,感じなかった,,10,お天気が良かったので、海がとてもきれいでした。,"全体的に選択肢が少ない。
風景がキレイでも駐車できる場所が少ないのが残念。",また行きたい（1年以内）,"全体的に満足です。
もう少しアクティビティがわかりやすいといいと思います。"
148527,明通寺 エリア,女,1973,51,50代,福井県,敦賀市,"900万円以上 1,000万円未満",mobile/android,2024-03-19 18:55:12,3月,神楽通り エリア,62.神楽通りエリア,敦賀市,嶺南東部,,日帰り,福井県内には宿泊しない,福井県内には宿泊しない,福井県外には宿泊しない,友人,"お祭りやイベントへの参加・見物
まちあるき、都市散策
",0,0,0,0,0,0,0,1,0,0,1,0,0,0,0,0,0,0,"自家用車
",1,0,0,0,0,0,0,"自家用車
",0,0,0,0,,,使わない,"1,000円未満","1,000円以上 3,000円未満",11回目以上,"観光パンフレット・ポスター
インターネット・アプリ
Instagram
Facebook
友人・知人
観光協会等の案内所
",0,0,0,1,0,1,0,1,1,0,1,1,0,0,敦賀赤レンガ倉庫,,敦賀駅,"1,000円以上 3,000円未満",とても満足,イベントだったので、賑やかで、屋台もたくさんあったため。,とても満足,駅からは少し離れているが、雰囲気もよく、歩いていて楽しい。,感じなかった,,9,神楽通りのお店と、通り。雰囲気がよい。,アクティビティはもっとアピールされたものがあるといいなと思う。,また行きたい（1年以内）,地域の特色を生かした食べ物やお土産をたくさん利用したい。
