会員ID,登録エリア,性別,生まれ年,回答時の年齢,年代,都道府県,会員市町村,世帯年収,UA,回答日時,回答月,回答エリア,回答エリア2,市町村,6分類,DMO,宿泊数（全体）,宿泊数（県内）,宿泊エリア（県内）,宿泊エリア（県外）,同行者,訪問目的ALL,宿でのんびり過ごす,温泉や露天風呂,地元の美味しいものを食べる,花見や紅葉などの自然鑑賞,名所、旧跡の観光,テーマパーク（遊園地、動物園、博物館など）,買い物、アウトレット,お祭りやイベントへの参加・見物,スポーツ観戦や芸能鑑賞（コンサート等）,アウトドア（海水浴、釣り、登山など）,まちあるき、都市散策,各種体験（手作り、果物狩りなど）,スキー・スノボ、マリンスポーツ,その他スポーツ（ゴルフ、テニスなど）,ドライブ・ツーリング,友人・親戚を尋ねる,出張など仕事関係,その他,福井県までの交通手段ALL,自家用車,レンタカー,新幹線,在来線,飛行機,旅行会社ツアーバス,県外から訪れていない（福井県在住）,福井県内での交通手段ALL,タクシー,路線バス,徒歩,レンタサイクル,福井県内での交通手段の満足度,福井県内での交通手段の満足度の理由,宿泊費,交通費,県内消費額,エリア訪問回数,情報収集ALL,観光展・物産展,新聞・雑誌・ガイドブック,TV・ラジオ番組やCM,観光パンフレット・ポスター,観光連盟やDMOのHP,インターネット・アプリ,Twitter,Instagram,Facebook,ブログ,友人・知人,観光協会等の案内所,タクシードライバーや地元の人,宿泊施設,アンケート回答前に訪問した主な場所,アンケート回答前に訪問した主な場所FA,アンケート回答後に訪問する予定の主な場所,エリア総消費額,満足度(商品・サービス),満足度(商品・サービス)の理由,満足度,満足度の理由,不便さ,不便さの内容,NPS,推奨項目,施設に求めるもの,今後の来訪意向,福井県に求めるもの
140155,名田庄 エリア,女,1991,32,30代,大阪府,豊中市,100万円以上 200万円未満,mobile/iphone,2023-08-12 18:27:20,8月,若狭フィッシャーマンズワーフ エリア,70.若狭フィッシャーマンズワーフ エリア,小浜市,嶺南西部,(株)まちづくり小浜,日帰り,2泊,嶺南エリア（敦賀市・美浜町・若狭町・小浜市・おおい町・高浜町）,福井県外には宿泊しない,親,"ドライブ・ツーリング
",0,0,0,0,0,0,0,0,0,0,0,0,0,0,1,0,0,ドライブでぶらり,"自家用車
",1,0,0,0,0,0,0,"自家用車
",0,0,0,0,,,使わない,使わない,"10,000円以上 20,000円未満",11回目以上,"その他
",0,0,0,0,0,0,0,0,0,0,0,0,0,0,箸のふるさと館WAKASA,,選択なし/該当施設なし,"5,000円以上 10,000円未満",とても満足,美味しい海鮮が多く、商品も豊富に置かれているため、選ぶ楽しさがあってよかったです。店内で食べれる場所もあり、年に数回訪れて鯖寿司やその他海鮮を食べにきています。,とても満足,"店内も明るく綺麗で、商品の見せ方もいいと思いました。レストランにイートインに、訪れた人それぞれが選べる環境もよかったです。
仕方ないことですが、遠くから福井をいろいろ周りながら夕方に着くと海鮮(寿司などの生もの系)が何もない時は少し悲しいです。",感じなかった,特にありません,8,"海鮮が美味しいので、ぜひ勧めたいです。
今回は車で来たので、バスや電車など交通的にも充実していたらもっと紹介したいと思えました。(既にあったらすみません。)",十分堪能できました。,また行きたい（1年以内）,美味しい物が食べたいです！
140155,名田庄 エリア,女,1991,32,30代,大阪府,豊中市,100万円以上 200万円未満,mobile/iphone,2023-08-12 18:11:43,8月,箸のふるさと館WAKASA エリア,74.箸のふるさと館WAKASA エリア,小浜市,嶺南西部,(株)まちづくり小浜,日帰り,2泊,嶺南エリア（敦賀市・美浜町・若狭町・小浜市・おおい町・高浜町）,福井県外には宿泊しない,親,"ドライブ・ツーリング
",0,0,0,0,0,0,0,0,0,0,0,0,0,0,1,0,0,ドライブでぶらり,"自家用車
",1,0,0,0,0,0,0,"自家用車
",0,0,0,0,,,使わない,使わない,"10,000円以上 20,000円未満",2～5回目,"その他
",0,0,0,0,0,0,0,0,0,0,0,0,0,0,道の駅「名田庄」,,若狭フィッシャーマンズワーフ,"3,000円以上 5,000円未満",満足,道の駅「若狭おばま」では、鯖をメインとした商品が数多く、推したい物がわかりやすく楽しく買い物できました。,満足,施設が新しく、店内のデザインがおしゃれで楽しく見て回ることができました。飲食店もその土地で薦める食を味わえることができて、来てよかったと思えました。,感じなかった,特にありません,7,その土地の美味しい物が味わえることで来た甲斐があったと思えたことです。交通的にも、車でも道が広く、ゆったり走ることもできるため、安心して訪れることができると思いました。,"十分楽しめました。
もう少しお手頃に買えるものがあれば、もっと嬉しいです。",また行きたい（1年以内）,美味しい物が食べたいです！
140155,名田庄 エリア,女,1991,32,30代,大阪府,豊中市,100万円以上 200万円未満,mobile/iphone,2023-08-12 16:22:58,8月,名田庄 エリア,86.名田庄 エリア,おおい町,嶺南西部,,日帰り,2泊,嶺南エリア（敦賀市・美浜町・若狭町・小浜市・おおい町・高浜町）,福井県外には宿泊しない,親,"地元の美味しいものを食べる
アウトドア（海水浴、釣り、登山など）
ドライブ・ツーリング
",0,0,1,0,0,0,0,0,0,1,0,0,0,0,1,0,0,ドライブでぶらり,"自家用車
",1,0,0,0,0,0,0,"自家用車
",0,0,0,0,,,使わない,使わない,"10,000円以上 20,000円未満",11回目以上,"その他
",0,0,0,0,0,0,0,0,0,0,0,0,0,0,選択なし/該当施設なし,,若狭フィッシャーマンズワーフ,"1,000円未満",どちらでもない,名田庄漬が美味しくお手頃で毎回購入してます。その他は特に買うものがない、また小浜へ行く際の通過点のため、道の駅「名田庄」で休憩する以外特にサービスを利用することは少ないです。,満足,"道の駅「名田庄」で休憩する程度です。
ドライブで通るため施設を使用するというより、自然を楽しむ方が大きく、自然に溢れている意味では満足です。",感じた,山道が少し荒れていて車で通るにはいいが、バイクの人は危ないかもしれないです。,5,名田庄を観光で薦めるには自然過ぎるため、自然の中をドライブしたい人には薦めるかもしれません。宿泊やお土産だと、小浜方面を進めると思います。,自然が多いため、自然を活かせるイベントは楽しいかと思います。車を走らせたまま楽しめるスポットがあれば、インパクトに残ると思います。,また行きたい（1年以内）,その地の美味しいものが食べたいです！
140155,名田庄 エリア,女,1991,32,30代,大阪府,豊中市,100万円以上 200万円未満,mobile/iphone,2023-12-09 14:04:37,12月,名田庄 エリア,86.名田庄 エリア,おおい町,嶺南西部,,日帰り,福井県内には宿泊しない,福井県内には宿泊しない,福井県外には宿泊しない,親,"ドライブ・ツーリング
",0,0,0,0,0,0,0,0,0,0,0,0,0,0,1,0,0,いつも来ているため、何も見ずに来ました,"自家用車
",1,0,0,0,0,0,0,"自家用車
",0,0,0,0,,,使わない,"3,000円以上 5,000円未満","3,000円以上 5,000円未満",11回目以上,"その他
",0,0,0,0,0,0,0,0,0,0,0,0,0,0,若狭フィッシャーマンズワーフ,京都美山,選択なし/該当施設なし,"1,000円未満",満足,"ドライブの休憩のためによっていて、トイレや飲み物があって十分休憩できました！
前に名田庄の漬物が美味しいので再度購入しました！",満足,建物もキレイで休憩所でゆっくりできました！,感じなかった,,8,買い物メインの道の駅ではなく、山道であるためツーリングしてる人にのんびり走れていいところだと薦めたいです！,ちょっと小腹が空いた時用の手軽なお弁当があればいいなと思いました！,また行きたい（1年以内）,
140155,名田庄 エリア,女,1991,32,30代,大阪府,豊中市,100万円以上 200万円未満,mobile/iphone,2023-12-09 13:48:32,12月,若狭フィッシャーマンズワーフ エリア,70.若狭フィッシャーマンズワーフ エリア,小浜市,嶺南西部,(株)まちづくり小浜,日帰り,福井県内には宿泊しない,福井県内には宿泊しない,福井県外には宿泊しない,親,"地元の美味しいものを食べる
ドライブ・ツーリング
",0,0,1,0,0,0,0,0,0,0,0,0,0,0,1,0,0,いつも来ているため、何も見ずに来ました,"自家用車
",1,0,0,0,0,0,0,"自家用車
",0,0,0,0,どちらでもない,,使わない,"3,000円以上 5,000円未満","3,000円以上 5,000円未満",11回目以上,"その他
",0,0,0,0,0,0,0,0,0,0,0,0,0,0,選択なし/該当施設なし,京都美山の道の駅,選択なし/該当施設なし,"3,000円以上 5,000円未満",満足,地元の魚を使った寿司や、若広の鯖寿司が美味しいです！お土産も充実しており満足です。,満足,"店内が広くゆっくり買い物ができました。
またレストランや店内で買ったものを食べられるスペースがあるのもよかったです！",感じなかった,,9,"・美味しい海鮮が食べられるところ
・お土産の選択肢が多いところ",これからも地元の美味しい物を提供し続けて欲しいです！,また行きたい（1年以内）,
