会員ID,登録エリア,性別,生まれ年,回答時の年齢,年代,都道府県,会員市町村,世帯年収,UA,回答日時,回答月,回答エリア,回答エリア2,市町村,6分類,DMO,宿泊数（全体）,宿泊数（県内）,宿泊エリア（県内）,宿泊エリア（県外）,同行者,訪問目的ALL,宿でのんびり過ごす,温泉や露天風呂,地元の美味しいものを食べる,花見や紅葉などの自然鑑賞,名所、旧跡の観光,テーマパーク（遊園地、動物園、博物館など）,買い物、アウトレット,お祭りやイベントへの参加・見物,スポーツ観戦や芸能鑑賞（コンサート等）,アウトドア（海水浴、釣り、登山など）,まちあるき、都市散策,各種体験（手作り、果物狩りなど）,スキー・スノボ、マリンスポーツ,その他スポーツ（ゴルフ、テニスなど）,ドライブ・ツーリング,友人・親戚を尋ねる,出張など仕事関係,その他,福井県までの交通手段ALL,自家用車,レンタカー,新幹線,在来線,飛行機,旅行会社ツアーバス,県外から訪れていない（福井県在住）,福井県内での交通手段ALL,タクシー,路線バス,徒歩,レンタサイクル,福井県内での交通手段の満足度,福井県内での交通手段の満足度の理由,宿泊費,交通費,県内消費額,エリア訪問回数,情報収集ALL,観光展・物産展,新聞・雑誌・ガイドブック,TV・ラジオ番組やCM,観光パンフレット・ポスター,観光連盟やDMOのHP,インターネット・アプリ,Twitter,Instagram,Facebook,ブログ,友人・知人,観光協会等の案内所,タクシードライバーや地元の人,宿泊施設,アンケート回答前に訪問した主な場所,アンケート回答前に訪問した主な場所FA,アンケート回答後に訪問する予定の主な場所,エリア総消費額,満足度(商品・サービス),満足度(商品・サービス)の理由,満足度,満足度の理由,不便さ,不便さの内容,NPS,推奨項目,施設に求めるもの,今後の来訪意向,福井県に求めるもの
136489,一乗谷朝倉氏遺跡 エリア,男,1962,61,60代,広島県,広島市安芸区,200万円以上 300万円未満,mobile/android,2023-06-19 20:59:32,6月,一乗谷朝倉氏遺跡 エリア,06.一乗谷朝倉氏遺跡 エリア,福井市,福井市・永平寺町,,4泊以上,2泊,福井エリア（福井市・永平寺町）,京都府,自分ひとり,"温泉や露天風呂
地元の美味しいものを食べる
名所、旧跡の観光
ドライブ・ツーリング
",0,1,1,0,1,0,0,0,0,0,0,0,0,0,1,0,0,前回の再訪問,"自家用車
",1,0,0,0,0,0,0,"自家用車
",0,0,0,0,,,"10,000円以上 20,000円未満","10,000円以上 20,000円未満","5,000円以上 10,000円未満",2～5回目,"その他
",0,0,0,0,0,0,0,0,0,0,0,0,0,0,岡太神社・大瀧神社,中池見湿地,選択なし/該当施設なし,使わない,満足,"ルポの森
食事がとても美味しい(ご飯はとてもかたく美味しくなかった
フロントの女性スタッフさんがとても素敵
部屋にウォーターサーバーが有る
今どきフリーWi-Fiが無いのが減点",満足,"遺跡は発掘が現在進行形な点が大変魅力的
ルポの森は安価でゆっくり過ごせた",感じなかった,"福井は公共交通の乗り継ぎが不便すぎ
朝金沢をサンダーバードで出発して芦原温泉駅から東尋坊～永平寺にバス移動すると15時代の新幹線に乗れなくなってたのには驚いた。
去年の３月。結局東尋坊しかいけないとは。その前の月迄はバスの乗り継ぎダイヤが有ったのに・・・
その後、４回来ましたがマイカーです。",8,一条谷朝倉氏遺跡には衝撃的な感動でした,"今後も発掘を継続して下さい。観光地化によりお金儲けには進めないで頂いたい。
福井の素朴な良さを残して下さい。
決して金沢のニノマエは避けてほしい",機会があれば行きたい,"無理な観光地化は魅力が無くなります。
かつやま恐竜の森は安くてすばらしかった。
レインボーラインの無料化は良かった。
入場料や駐車場代等を安易に値上げされない方が福井の観光には必要と感じます。
実際、金沢は大好きな街でしたが今や魅力無くなりました。新幹線が開通すると一時的に関東からの観光客は増え増すがどうなんでしょうか？"
136489,一乗谷朝倉氏遺跡 エリア,男,1962,61,60代,広島県,広島市安芸区,200万円以上 300万円未満,mobile/android,2023-06-20 13:01:09,6月,平泉寺白山神社 エリア,29.平泉寺白山神社 エリア,勝山市,勝山市・大野市,勝山市観光まちづくり(株),4泊以上,2泊,福井エリア（福井市・永平寺町）,京都府,自分ひとり,"ドライブ・ツーリング
",0,0,0,0,0,0,0,0,0,0,0,0,0,0,1,0,0,前回の再訪問,"自家用車
",1,0,0,0,0,0,0,"自家用車
",0,0,0,0,,,"10,000円以上 20,000円未満","10,000円以上 20,000円未満","5,000円以上 10,000円未満",2～5回目,"その他
",0,0,0,0,0,0,0,0,0,0,0,0,0,0,勝山城博物館,,劔神社,"1,000円以上 3,000円未満",満足,,満足,,感じた,他に誰も居なかったのでビデオ上映を遠慮してしまった,7,,,機会があれば行きたい,他のアンケートにてお伝え済みです
