会員ID,登録エリア,性別,生まれ年,回答時の年齢,年代,都道府県,会員市町村,世帯年収,UA,回答日時,回答月,回答エリア,回答エリア2,市町村,6分類,DMO,宿泊数（全体）,宿泊数（県内）,宿泊エリア（県内）,宿泊エリア（県外）,同行者,訪問目的ALL,宿でのんびり過ごす,温泉や露天風呂,地元の美味しいものを食べる,花見や紅葉などの自然鑑賞,名所、旧跡の観光,テーマパーク（遊園地、動物園、博物館など）,買い物、アウトレット,お祭りやイベントへの参加・見物,スポーツ観戦や芸能鑑賞（コンサート等）,アウトドア（海水浴、釣り、登山など）,まちあるき、都市散策,各種体験（手作り、果物狩りなど）,スキー・スノボ、マリンスポーツ,その他スポーツ（ゴルフ、テニスなど）,ドライブ・ツーリング,友人・親戚を尋ねる,出張など仕事関係,その他,福井県までの交通手段ALL,自家用車,レンタカー,新幹線,在来線,飛行機,旅行会社ツアーバス,県外から訪れていない（福井県在住）,福井県内での交通手段ALL,タクシー,路線バス,徒歩,レンタサイクル,福井県内での交通手段の満足度,福井県内での交通手段の満足度の理由,宿泊費,交通費,県内消費額,エリア訪問回数,情報収集ALL,観光展・物産展,新聞・雑誌・ガイドブック,TV・ラジオ番組やCM,観光パンフレット・ポスター,観光連盟やDMOのHP,インターネット・アプリ,Twitter,Instagram,Facebook,ブログ,友人・知人,観光協会等の案内所,タクシードライバーや地元の人,宿泊施設,アンケート回答前に訪問した主な場所,アンケート回答前に訪問した主な場所FA,アンケート回答後に訪問する予定の主な場所,エリア総消費額,満足度(商品・サービス),満足度(商品・サービス)の理由,満足度,満足度の理由,不便さ,不便さの内容,NPS,推奨項目,施設に求めるもの,今後の来訪意向,福井県に求めるもの
136474,web,女,1979,44,40代,岡山県,倉敷市,700万円以上 800万円未満,mobile/iphone,2023-06-20 12:16:31,6月,JR敦賀駅前 エリア,63.JR敦賀駅前 エリア,敦賀市,嶺南東部,,日帰り,福井県内には宿泊しない,福井県内には宿泊しない,福井県外には宿泊しない,自分ひとり,"まちあるき、都市散策
",0,0,0,0,0,0,0,0,0,0,1,0,0,0,0,0,0,0,"新幹線
在来線
",0,0,1,1,0,0,0,"在来線
",0,0,0,0,とても満足,特急の切符を確認にまわる車掌さんが親切だった。,使わない,"5,000円以上 10,000円未満","10,000円以上 20,000円未満",初めて,"観光パンフレット・ポスター
インターネット・アプリ
観光協会等の案内所
",0,0,0,1,0,1,0,0,0,0,0,1,0,0,敦賀駅,,選択なし/該当施設なし,"10,000円以上 20,000円未満",どちらでもない,月曜日で閉まっているお店が多かったのと、こんぶのお店でお酒や昆布を買ったのですが、オープンしたばかりで慣れていない様子。格式高いお店の様なので、社内研修等で商品や接客などもう少し勉強されてから店頭に出た方が良いのでは、と思いました。,満足,"初めて訪れた場所で、初めてのものにふれることができたことで満足した。
駅前も新幹線が通るということで活気がもっとでてくると思うが、案内所をもっと分かりやすくするとか観光客へのもてなし等、やはり施設を良くするのはもちろん、人への育成に力を入れていかないといけないと思う。",感じなかった,,8,ガヤガヤした観光地とは違い、ゆっくり落ち着く場所だった。お酒も美味しいので、美味しい食べ物と一緒にゆっくりできると思うので、私も次回は温泉にも泊まりたいし人にもオススメしたい。,"商店街が古い風貌。月曜日だったからか、駅から出て、パッと目を引くお店が新しいお店しか無かったのが残念。時間帯もお昼時ではなかったので、食事処もあまりなかったのが残念だった。
新しい本屋にカフェ等はそこに住んでる人たちの癒やしで良いと思う。観光客用にも何かパッと目を引くものを考えて欲しいです。",また行きたい（1年以内）,長年親しまれてきているお土産の名物も良いが、新しい令和にピピっとくるお土産もあれば若向けのお土産に良いかなーと思う。
