会員ID,登録施設,性別,生まれ年,回答時の年齢,年代,都道府県,会員市町村,世帯年収,UA,回答日時,回答月,回答エリア,回答エリア2,市町村,6分類,DMO,宿泊数（全体）,宿泊数（県内）,宿泊エリア（県内）,宿泊エリア（県外）,同行者,訪問目的ALL,宿でのんびり過ごす,温泉や露天風呂,地元の美味しいものを食べる,花見や紅葉などの自然鑑賞,名所、旧跡の観光,テーマパーク（遊園地、動物園、博物館など）,買い物、アウトレット,お祭りやイベントへの参加・見物,スポーツ観戦や芸能鑑賞（コンサート等）,アウトドア（海水浴、釣り、登山など）,まちあるき、都市散策,各種体験（手作り、果物狩りなど）,スキー・スノボ、マリンスポーツ,その他スポーツ（ゴルフ、テニスなど）,ドライブ・ツーリング,友人・親戚を尋ねる,出張など仕事関係,その他,情報収集ALL,観光展・物産展,新聞・雑誌・ガイドブック,TV・ラジオ番組やCM,観光パンフレット・ポスター,観光連盟やDMOのHP,インターネット・アプリ,Twitter,Instagram,Facebook,ブログ,友人・知人,観光協会等の案内所,タクシードライバーや地元の人,宿泊施設,福井県までの交通手段ALL,自家用車,レンタカー,新幹線,在来線,飛行機,旅行会社ツアーバス,県外から訪れていない（福井県在住）,福井県内での交通手段ALL,タクシー,路線バス,徒歩,レンタサイクル,福井県内での交通手段の満足度,福井県内での交通手段の満足度の理由,宿泊費,交通費,県内消費額,エリア訪問回数,アンケート回答前に訪問した主な場所,アンケート回答前に訪問した主な場所FA,アンケート回答後に訪問する予定の主な場所,アンケート回答後に訪問する予定の主な場所FA,エリア総消費額,満足度,満足度の理由,不便さ,不便さの内容,NPS,推奨項目,施設に求めるもの,今後の来訪意向,福井県に求めるもの,登録エリア,満足度(商品・サービス),満足度(商品・サービス)の理由
104948,ちひろの生まれた家記念館 エリア,女,1963,59,50代,福井県,敦賀市,分からない/無回答,mobile/iphone,2022-05-27 10:18:00,5月,ちひろの生まれた家記念館 エリア,31.ちひろの生まれた家記念館 エリア,越前市,丹南,,日帰り,福井県内には宿泊しない,福井県内には宿泊しない,福井県外には宿泊しない,夫婦2人,"まちあるき、都市散策
",0,0,0,0,0,0,0,0,0,0,1,0,0,0,0,0,0,0,"その他
",0,0,0,0,0,0,0,0,0,0,0,0,0,0,"自家用車
",1,0,0,0,0,0,0,"自家用車
",0,0,0,0,,,使わない,使わない,"5,000円以上 10,000円未満",初めて,選択なし/該当施設なし,,選択なし/該当施設なし,,"1,000円以上 3,000円未満",とても満足,ちひろの生まれた家の展示がとても興味のあるもので又、訪れたいと思いました。受付の方がとても親切で、心が和みました。近くの観光や食べたかったボルガライスの美味しいお店を教えて頂き、そこへ行くことが出来て良かったです。帰りに西山公園に寄りましたが、残念ながらフランソワーズルトンの赤ちゃんは見れず、この時間に行けば見れるなどの情報があれば良いのにと思いました。,感じなかった,,8,生まれた家は当時のままの井戸などや壁などが残っており、年配の方からお子様までお薦めです。,気に入った絵のグッズがないのが残念でした。,また行きたい（1年以内）,案内が不充分,,,
104948,ちひろの生まれた家記念館 エリア,女,1963,60,60代,福井県,敦賀市,分からない/無回答,mobile/iphone,2023-03-05 15:06:10,3月,道の駅「越前」 エリア,38.道の駅「越前」 エリア,越前町,丹南,,日帰り,福井県内には宿泊しない,福井県内には宿泊しない,福井県外には宿泊しない,夫婦2人,"地元の美味しいものを食べる
買い物、アウトレット
お祭りやイベントへの参加・見物
",0,0,1,0,0,0,1,1,0,0,0,0,0,0,0,0,0,0,"新聞・雑誌・ガイドブック
観光パンフレット・ポスター
",0,1,0,1,0,0,0,0,0,0,0,0,0,0,"自家用車
",1,0,0,0,0,0,0,"自家用車
",0,0,0,0,,,使わない,使わない,"10,000円以上 20,000円未満",2～5回目,選択なし/該当施設なし,,越前陶芸村,,"10,000円以上 20,000円未満",どちらでもない,カニ祭りに行ったが店舗が少なく、客が殺到していて買いづらかった。,感じた,駐車場の案内が不適切,0,,清潔感が欲しい,どちらともいえない,もっとダイビングとかの情報が欲しい。,,,
104948,,女,1963,61,60代,福井県,敦賀市,分からない/無回答,mobile/iphone,2024-03-15 16:57:39,3月,小浜市 阿納 エリア,67.小浜市 阿納 エリア,小浜市,嶺南西部,(株)まちづくり小浜,1泊,1泊,嶺南エリア（敦賀市・美浜町・若狭町・小浜市・おおい町・高浜町）,福井県外には宿泊しない,夫婦2人,"地元の美味しいものを食べる
",0,0,1,0,0,0,0,0,0,0,0,0,0,0,0,0,0,0,"インターネット・アプリ
",0,0,0,0,0,1,0,0,0,0,0,0,0,0,"県外から訪れていない（福井県在住）
",1,0,0,0,0,0,1,"自家用車
",0,0,0,0,,,"40,000円以上 50,000円未満","1,000円以上 3,000円未満","10,000円以上 20,000円未満",2～5回目,選択なし/該当施設なし,,選択なし/該当施設なし,,使わない,不満,"部屋が暗い。
窓を開けると隣の壁で圧迫感あり。
風呂が狭く、脱衣所も狭い。
の割に高い。",感じた,近くに観光できるような所、物が無い。,2,食事はとても美味しく、食事のみに行こうと思うが、泊まりたいとは思わない。,SUPとか出来ると良いかも。,福井県在住,福井県と言えば蟹というイメージがあるが極みがでてから庶民には手の届かない食材になってしまったと感じる。北陸応援割で宿を予約したかったがそれも無理、一体どうやったら予約出来たのか？と思う。3月16日から割引分を上乗せしてる宿も多い。誰でも取れる方法で再開して、本当に応援できる制度にしてほしい。,武生駅 エリア,どちらでもない,"子供が小さい時に一度蟹を食べに行った覚えがあり、今回はフグを食べに行った。
宿の料理はとても美味しかったが、改装してあっても建物は古く部屋はとても暗く一泊が限界だなと思った。又、阿納エリアがとても寂れていて驚いた。"
104948,,女,1963,61,60代,福井県,敦賀市,分からない/無回答,mobile/iphone,2024-03-17 14:53:40,3月,敦賀市立博物館 エリア,65.敦賀市立博物館 エリア,敦賀市,嶺南東部,,1泊,1泊,嶺南エリア（敦賀市・美浜町・若狭町・小浜市・おおい町・高浜町）,福井県外には宿泊しない,夫婦2人,"地元の美味しいものを食べる
",0,0,1,0,0,0,0,0,0,0,0,0,0,0,0,0,0,0,"インターネット・アプリ
",0,0,0,0,0,1,0,0,0,0,0,0,0,0,"県外から訪れていない（福井県在住）
",0,0,0,1,0,0,1,"在来線
",0,0,0,0,どちらでもない,小浜線で粟野駅から乗りましたが、帰り一両目しかドアが開かなくて不便でした。,"40,000円以上 50,000円未満","1,000円以上 3,000円未満","10,000円以上 20,000円未満",2～5回目,選択なし/該当施設なし,,選択なし/該当施設なし,,"1,000円以上 3,000円未満",不満,"キトテノワで途中休憩。テイクアウトだったが
店内飲食可能なのは良かったが、テーブルの上に直接ケーキ用のカトラリーを置かれて使うのを躊躇した。ペーパー一枚でも敷いて欲しかった。",感じなかった,,1,わらべ資料館を勧めたい。,,福井県在住,飲食は全体的に高い。,武生駅 エリア,どちらでもない,施設は無料で入館出来たが周りの飲食店はあまり良くなかった。
