会員ID,登録施設,性別,生まれ年,回答時の年齢,年代,都道府県,会員市町村,世帯年収,UA,回答日時,回答月,回答エリア,回答エリア2,市町村,6分類,DMO,宿泊数（全体）,宿泊数（県内）,宿泊エリア（県内）,宿泊エリア（県外）,同行者,訪問目的ALL,宿でのんびり過ごす,温泉や露天風呂,地元の美味しいものを食べる,花見や紅葉などの自然鑑賞,名所、旧跡の観光,テーマパーク（遊園地、動物園、博物館など）,買い物、アウトレット,お祭りやイベントへの参加・見物,スポーツ観戦や芸能鑑賞（コンサート等）,アウトドア（海水浴、釣り、登山など）,まちあるき、都市散策,各種体験（手作り、果物狩りなど）,スキー・スノボ、マリンスポーツ,その他スポーツ（ゴルフ、テニスなど）,ドライブ・ツーリング,友人・親戚を尋ねる,出張など仕事関係,その他,情報収集ALL,観光展・物産展,新聞・雑誌・ガイドブック,TV・ラジオ番組やCM,観光パンフレット・ポスター,観光連盟やDMOのHP,インターネット・アプリ,Twitter,Instagram,Facebook,ブログ,友人・知人,観光協会等の案内所,タクシードライバーや地元の人,宿泊施設,福井県までの交通手段ALL,自家用車,レンタカー,新幹線,在来線,飛行機,旅行会社ツアーバス,県外から訪れていない（福井県在住）,福井県内での交通手段ALL,タクシー,路線バス,徒歩,レンタサイクル,福井県内での交通手段の満足度,福井県内での交通手段の満足度の理由,宿泊費,交通費,県内消費額,エリア訪問回数,アンケート回答前に訪問した主な場所,アンケート回答前に訪問した主な場所FA,アンケート回答後に訪問する予定の主な場所,アンケート回答後に訪問する予定の主な場所FA,エリア総消費額,満足度,満足度の理由,不便さ,不便さの内容,NPS,推奨項目,施設に求めるもの,今後の来訪意向,福井県に求めるもの
105135,うみんぴあ大飯 エリア,女,1967,55,50代,兵庫県,川辺郡,700万円以上 800万円未満,mobile/android,2022-05-28 16:57:41,5月,三方五湖 エリア,63.三方五湖 エリア,若狭町,嶺南東部,三方五湖DMO(株),1泊,1泊,嶺南エリア（敦賀市・美浜町・若狭町・小浜市・おおい町・高浜町）,福井県外には宿泊しない,夫婦2人,"ドライブ・ツーリング
",0,0,0,0,0,0,0,0,0,0,0,0,0,0,1,0,0,0,"インターネット・アプリ
",0,0,0,0,0,1,0,0,0,0,0,0,0,0,"自家用車
",1,0,0,0,0,0,0,"自家用車
",0,0,0,0,とても満足,,"10,000円以上 20,000円未満","3,000円以上 5,000円未満","20,000円以上 30,000円未満",2～5回目,若狭三方縄文博物館,,レインボーライン,,"5,000円以上 10,000円未満",満足,景色がきれいで、ゆったりできた！道の駅も充実してるしよかった,感じた,"バイクが多く駐車場が占領されていて、停めるのに待った。
バイクやサイクリング、車の停めるところを分けてあればなぁと思いました。",8,"天気が良ければ最高！です。
雨天時は残念ながら、あんまり観光できないかなぁと",,機会があれば行きたい,土産物豊富でおいしいもの多く嬉しいのですが、福井県全部を回らなくても、有名処のお酒をある程度、どこの道の駅でも買えたらうれしいです！
105135,うみんぴあ大飯 エリア,女,1967,55,50代,兵庫県,川辺郡,700万円以上 800万円未満,mobile/android,2022-05-28 16:48:38,5月,うみんぴあ大飯 エリア,64.うみんぴあ大飯 エリア,おおい町,嶺南西部,,1泊,1泊,嶺南エリア（敦賀市・美浜町・若狭町・小浜市・おおい町・高浜町）,福井県外には宿泊しない,夫婦2人,"温泉や露天風呂
地元の美味しいものを食べる
名所、旧跡の観光
ドライブ・ツーリング
",0,1,1,0,1,0,0,0,0,0,0,0,0,0,1,0,0,0,"観光パンフレット・ポスター
インターネット・アプリ
",0,0,0,1,0,1,0,0,0,0,0,0,0,0,"自家用車
",1,0,0,0,0,0,0,"自家用車
",0,0,0,0,,,"10,000円以上 20,000円未満","3,000円以上 5,000円未満","20,000円以上 30,000円未満",初めて,選択なし/該当施設なし,,レインボーライン,,"5,000円以上 10,000円未満",とても満足,新鮮な刺身を買って、食堂でご飯セット買って自分でてんこ盛り海鮮丼にして食べられたので、大満足です！,感じなかった,,10,魚おいしいし、お酒もおいしいし、お米もおいしく、お土産物も豊富なので,,機会があれば行きたい,
105135,うみんぴあ大飯 エリア,女,1967,55,50代,兵庫県,川辺郡,700万円以上 800万円未満,mobile/android,2022-10-01 13:04:36,10月,道の駅みくに ふれあいパーク三里浜 エリア,10.道の駅みくに ふれあいパーク三里浜 エリア,坂井市,あわら市・坂井市,(一社)DMOさかい観光局,2泊,1泊,三国・あわらエリア（あわら市・坂井市）,石川県七尾市,夫婦2人,"温泉や露天風呂
名所、旧跡の観光
",0,1,0,0,1,0,0,0,0,0,0,0,0,0,0,0,0,0,"その他
",0,0,0,0,0,0,0,0,0,0,0,0,0,0,"自家用車
",1,0,0,0,0,0,0,"自家用車
",0,0,0,0,,,"50,000円以上 100,000円未満","5,000円以上 10,000円未満","20,000円以上 30,000円未満",初めて,道の駅「九頭竜・和泉ふれあい会館」,,呼鳥門,,"1,000円以上 3,000円未満",とても満足,おみやげが、種類多く充実してた。,感じなかった,,10,おいしい食べ物多いし、景色も最高！,,機会があれば行きたい,
