会員ID,登録施設,性別,生まれ年,回答時の年齢,年代,都道府県,会員市町村,世帯年収,UA,回答日時,回答月,回答エリア,回答エリア2,市町村,6分類,DMO,宿泊数（全体）,宿泊数（県内）,宿泊エリア（県内）,宿泊エリア（県外）,同行者,訪問目的ALL,宿でのんびり過ごす,温泉や露天風呂,地元の美味しいものを食べる,花見や紅葉などの自然鑑賞,名所、旧跡の観光,テーマパーク（遊園地、動物園、博物館など）,買い物、アウトレット,お祭りやイベントへの参加・見物,スポーツ観戦や芸能鑑賞（コンサート等）,アウトドア（海水浴、釣り、登山など）,まちあるき、都市散策,各種体験（手作り、果物狩りなど）,スキー・スノボ、マリンスポーツ,その他スポーツ（ゴルフ、テニスなど）,ドライブ・ツーリング,友人・親戚を尋ねる,出張など仕事関係,その他,情報収集ALL,観光展・物産展,新聞・雑誌・ガイドブック,TV・ラジオ番組やCM,観光パンフレット・ポスター,観光連盟やDMOのHP,インターネット・アプリ,Twitter,Instagram,Facebook,ブログ,友人・知人,観光協会等の案内所,タクシードライバーや地元の人,宿泊施設,福井県までの交通手段ALL,自家用車,レンタカー,新幹線,在来線,飛行機,旅行会社ツアーバス,県外から訪れていない（福井県在住）,福井県内での交通手段ALL,タクシー,路線バス,徒歩,レンタサイクル,福井県内での交通手段の満足度,福井県内での交通手段の満足度の理由,宿泊費,交通費,県内消費額,エリア訪問回数,アンケート回答前に訪問した主な場所,アンケート回答前に訪問した主な場所FA,アンケート回答後に訪問する予定の主な場所,アンケート回答後に訪問する予定の主な場所FA,エリア総消費額,満足度,満足度の理由,不便さ,不便さの内容,NPS,推奨項目,施設に求めるもの,今後の来訪意向,福井県に求めるもの
105655,web,女,1960,62,60代,愛知県,尾張旭市,300万円以上 400万円未満,mobile/android,2022-06-03 21:05:39,6月,ちひろの生まれた家記念館 エリア,31.ちひろの生まれた家記念館 エリア,越前市,丹南,,2泊,福井県内には宿泊しない,福井県内には宿泊しない,石川県加賀市,夫婦2人,"温泉や露天風呂
地元の美味しいものを食べる
花見や紅葉などの自然鑑賞
名所、旧跡の観光
まちあるき、都市散策
",0,1,1,1,1,0,0,0,0,0,1,0,0,0,0,0,0,0,"新聞・雑誌・ガイドブック
TV・ラジオ番組やCM
観光パンフレット・ポスター
観光連盟やDMOのHP
宿泊施設
",0,1,1,1,1,0,0,0,0,0,0,0,0,1,"自家用車
",1,0,0,0,0,0,0,"自家用車
",0,0,0,0,,,使わない,"10,000円以上 20,000円未満","30,000円以上 40,000円未満",初めて,大本山永平寺,丸岡城、西山公園、,道の駅「西山公園」,九頭竜ダム,"1,000円未満",満足,福井の人はみんな親切で優しかった。,感じた,道が狭かった。,8,永平寺、とても清々としていて、ゆっくりと時間が流れているように感じた。,飲食店は目立ったものがなく、名物みたいなものも無い様だった。,また行きたい（1年以内）,年3回程遊びに行くが、つぎは福井のどこへいこうかなと考えるのも楽しい。県内の道路がよく整備され、○○街道とか○○通りとかかわいい名前と植樹がよい印象。大野から九頭竜への道が新しい道路の建設で大型トラックがたくさん走っており、少し怖かった。福井県内の色々なところへいったけど、ちひろの家だけがこのキャンペーンのパンフをくれた。沢山行ったのにQrコードを読み取って来れなかったので残念です。越前大仏がなんだか粗末にされていて心が痛んだ。福井はとにかく電波が切れて、5Gでもインターネットが繋がらなくて困った。
