会員ID,登録エリア,性別,生まれ年,回答時の年齢,年代,都道府県,会員市町村,世帯年収,UA,回答日時,回答月,回答エリア,回答エリア2,市町村,6分類,DMO,宿泊数（全体）,宿泊数（県内）,宿泊エリア（県内）,宿泊エリア（県外）,同行者,訪問目的ALL,宿でのんびり過ごす,温泉や露天風呂,地元の美味しいものを食べる,花見や紅葉などの自然鑑賞,名所、旧跡の観光,テーマパーク（遊園地、動物園、博物館など）,買い物、アウトレット,お祭りやイベントへの参加・見物,スポーツ観戦や芸能鑑賞（コンサート等）,アウトドア（海水浴、釣り、登山など）,まちあるき、都市散策,各種体験（手作り、果物狩りなど）,スキー・スノボ、マリンスポーツ,その他スポーツ（ゴルフ、テニスなど）,ドライブ・ツーリング,友人・親戚を尋ねる,出張など仕事関係,その他,福井県までの交通手段ALL,自家用車,レンタカー,新幹線,在来線,飛行機,旅行会社ツアーバス,県外から訪れていない（福井県在住）,福井県内での交通手段ALL,タクシー,路線バス,徒歩,レンタサイクル,福井県内での交通手段の満足度,福井県内での交通手段の満足度の理由,宿泊費,交通費,県内消費額,エリア訪問回数,情報収集ALL,観光展・物産展,新聞・雑誌・ガイドブック,TV・ラジオ番組やCM,観光パンフレット・ポスター,観光連盟やDMOのHP,インターネット・アプリ,Twitter,Instagram,Facebook,ブログ,友人・知人,観光協会等の案内所,タクシードライバーや地元の人,宿泊施設,アンケート回答前に訪問した主な場所,アンケート回答前に訪問した主な場所FA,アンケート回答後に訪問する予定の主な場所,エリア総消費額,満足度(商品・サービス),満足度(商品・サービス)の理由,満足度,満足度の理由,不便さ,不便さの内容,NPS,推奨項目,施設に求めるもの,今後の来訪意向,福井県に求めるもの
151738,web,女,1947,77,70代,兵庫県,尼崎市,分からない/無回答,mobile/android,2024-03-12 15:16:34,3月,紫式部公園 エリア,41.紫式部公園 エリア,越前市,丹南,,日帰り,福井県内には宿泊しない,福井県内には宿泊しない,福井県外には宿泊しない,友人,"地元の美味しいものを食べる
名所、旧跡の観光
まちあるき、都市散策
",0,0,1,0,1,0,0,0,0,0,1,0,0,0,0,0,0,0,"在来線
",0,0,0,0,0,0,0,"タクシー
",1,0,0,0,とても満足,500円タクシーを教えて貰い快適に移動できました。,使わない,"5,000円以上 10,000円未満","3,000円以上 5,000円未満",初めて,"新聞・雑誌・ガイドブック
インターネット・アプリ
",0,1,0,0,0,1,0,0,0,0,0,0,0,0,選択なし/該当施設なし,越前国府跡,敦賀駅,使わない,とても満足,公園の整備と紫ゆかりの館の展示がわかりやすく良かった。,とても満足,平安時代を想わせる公園等,感じなかった,,10,福井県が好きで良くきていましたが、今回初めて紫式部公園に来て、思っていた以上に良かったですので。,近くに観光バスで来て食事ができる規模の食事処があれば、会の行事も｡,また行きたい（1年以内）,海鮮料理等
151738,web,女,1947,77,70代,兵庫県,尼崎市,分からない/無回答,mobile/android,2024-03-13 17:17:52,3月,日本海さかな街 エリア,61.日本海さかな街 エリア,敦賀市,嶺南東部,,日帰り,福井県内には宿泊しない,福井県内には宿泊しない,福井県外には宿泊しない,友人,"まちあるき、都市散策
",0,0,0,0,0,0,0,0,0,0,1,0,0,0,0,0,0,0,"在来線
",0,0,0,0,0,1,0,"旅行会社ツアーバス
",0,0,0,0,満足,,使わない,"5,000円以上 10,000円未満","3,000円以上 5,000円未満",初めて,"インターネット・アプリ
",0,0,0,0,0,1,0,0,0,0,0,0,0,0,御食国若狭おばま食文化館,,敦賀駅,"5,000円以上 10,000円未満",満足,,満足,,感じなかった,,10,,,また行きたい（1年以内）,美味しいものをもっと宣伝したらと思います
151738,web,女,1947,77,70代,兵庫県,尼崎市,分からない/無回答,mobile/android,2024-03-13 17:04:55,3月,JR敦賀駅前 エリア,63.JR敦賀駅前 エリア,敦賀市,嶺南東部,,日帰り,福井県内には宿泊しない,福井県内には宿泊しない,福井県外には宿泊しない,友人,"まちあるき、都市散策
",0,0,0,0,0,0,0,0,0,0,1,0,0,0,0,0,0,0,"在来線
",0,0,0,0,0,1,0,"旅行会社ツアーバス
",0,0,0,0,とても満足,"サンダーバードで敦賀往復でした。
若狭内は観光バスで移動｡",使わない,"5,000円以上 10,000円未満","3,000円以上 5,000円未満",11回目以上,"インターネット・アプリ
",0,0,0,0,0,1,0,0,0,0,0,0,0,0,明通寺,,日本海さかな街,"5,000円以上 10,000円未満",満足,,満足,,感じなかった,,10,若狭大好き,,また行きたい（1年以内）,お魚料理
