会員ID,登録エリア,性別,生まれ年,回答時の年齢,年代,都道府県,会員市町村,世帯年収,UA,回答日時,回答月,回答エリア,回答エリア2,市町村,6分類,DMO,宿泊数（全体）,宿泊数（県内）,宿泊エリア（県内）,宿泊エリア（県外）,同行者,訪問目的ALL,宿でのんびり過ごす,温泉や露天風呂,地元の美味しいものを食べる,花見や紅葉などの自然鑑賞,名所、旧跡の観光,テーマパーク（遊園地、動物園、博物館など）,買い物、アウトレット,お祭りやイベントへの参加・見物,スポーツ観戦や芸能鑑賞（コンサート等）,アウトドア（海水浴、釣り、登山など）,まちあるき、都市散策,各種体験（手作り、果物狩りなど）,スキー・スノボ、マリンスポーツ,その他スポーツ（ゴルフ、テニスなど）,ドライブ・ツーリング,友人・親戚を尋ねる,出張など仕事関係,その他,福井県までの交通手段ALL,自家用車,レンタカー,新幹線,在来線,飛行機,旅行会社ツアーバス,県外から訪れていない（福井県在住）,福井県内での交通手段ALL,タクシー,路線バス,徒歩,レンタサイクル,福井県内での交通手段の満足度,福井県内での交通手段の満足度の理由,宿泊費,交通費,県内消費額,エリア訪問回数,情報収集ALL,観光展・物産展,新聞・雑誌・ガイドブック,TV・ラジオ番組やCM,観光パンフレット・ポスター,観光連盟やDMOのHP,インターネット・アプリ,Twitter,Instagram,Facebook,ブログ,友人・知人,観光協会等の案内所,タクシードライバーや地元の人,宿泊施設,アンケート回答前に訪問した主な場所,アンケート回答前に訪問した主な場所FA,アンケート回答後に訪問する予定の主な場所,エリア総消費額,満足度(商品・サービス),満足度(商品・サービス)の理由,満足度,満足度の理由,不便さ,不便さの内容,NPS,推奨項目,施設に求めるもの,今後の来訪意向,福井県に求めるもの
132816,越前漁港 エリア,女,1969,54,50代,福井県,敦賀市,100万円未満,mobile/iphone,2023-05-05 18:22:04,5月,越前漁港 エリア,54.越前漁港エリア  ,越前町,丹南,,日帰り,福井県内には宿泊しない,福井県内には宿泊しない,京都府,自分ひとり,"温泉や露天風呂
地元の美味しいものを食べる
花見や紅葉などの自然鑑賞
",0,1,1,1,0,0,0,0,0,0,0,0,0,0,0,0,0,0,"県外から訪れていない（福井県在住）
",1,0,0,0,0,0,1,"自家用車
",0,0,0,0,,,"40,000円以上 50,000円未満","3,000円以上 5,000円未満","30,000円以上 40,000円未満",初めて,"TV・ラジオ番組やCM
",0,0,1,0,0,0,0,0,0,0,0,0,0,0,一乗谷朝倉氏遺跡,,北の庄城址・柴田公園,"20,000円以上 30,000円未満",とても満足,"景色が最高です。日本人である事を誇りに思える日本海。こんな近くに素敵な場所があるなんてとても充実した旅でした。
越前海岸の魚介類は本当に美味しいです。
毎月、来ようと思っています。",満足,施設の皆さんがとても親切でフレンドリーなので安心して利用出来ました。わざわざ遠くに行かなくても、私は越前海岸の観光が大好きです。,感じた,道路の幅が少し狭いと感じましたが、漁港ならではですね。地元の方々は不便に感じないのでしょうか？,10,"景色の美しさ。蕎麦屋、魚介類の美味しいこと。皆さん
サービスで色々な物を出して下さいました。","長閑な部分を失ってほしくないです。
その長閑さに癒されるので。",また行きたい（1年以内）,"福井といえば魚介類が大人気です。
長閑で自然豊かなところも。自然の美しさが一番求められていると思います。"
