会員ID,登録施設,性別,生まれ年,回答時の年齢,年代,都道府県,会員市町村,世帯年収,UA,回答日時,回答月,回答エリア,回答エリア2,市町村,6分類,DMO,宿泊数（全体）,宿泊数（県内）,宿泊エリア（県内）,宿泊エリア（県外）,同行者,訪問目的ALL,宿でのんびり過ごす,温泉や露天風呂,地元の美味しいものを食べる,花見や紅葉などの自然鑑賞,名所、旧跡の観光,テーマパーク（遊園地、動物園、博物館など）,買い物、アウトレット,お祭りやイベントへの参加・見物,スポーツ観戦や芸能鑑賞（コンサート等）,アウトドア（海水浴、釣り、登山など）,まちあるき、都市散策,各種体験（手作り、果物狩りなど）,スキー・スノボ、マリンスポーツ,その他スポーツ（ゴルフ、テニスなど）,ドライブ・ツーリング,友人・親戚を尋ねる,出張など仕事関係,その他,情報収集ALL,観光展・物産展,新聞・雑誌・ガイドブック,TV・ラジオ番組やCM,観光パンフレット・ポスター,観光連盟やDMOのHP,インターネット・アプリ,Twitter,Instagram,Facebook,ブログ,友人・知人,観光協会等の案内所,タクシードライバーや地元の人,宿泊施設,福井県までの交通手段ALL,自家用車,レンタカー,新幹線,在来線,飛行機,旅行会社ツアーバス,県外から訪れていない（福井県在住）,福井県内での交通手段ALL,タクシー,路線バス,徒歩,レンタサイクル,福井県内での交通手段の満足度,福井県内での交通手段の満足度の理由,宿泊費,交通費,県内消費額,エリア訪問回数,アンケート回答前に訪問した主な場所,アンケート回答前に訪問した主な場所FA,アンケート回答後に訪問する予定の主な場所,アンケート回答後に訪問する予定の主な場所FA,エリア総消費額,満足度,満足度の理由,不便さ,不便さの内容,NPS,推奨項目,施設に求めるもの,今後の来訪意向,福井県に求めるもの
124070,web,男,1975,47,40代,大阪府,大阪市福島区,800万円以上 900万円未満,mobile/iphone,2022-12-03 14:17:57,12月,スーベニアショップ ラプトル エリア,19.スーベニアショップ ラプトル エリア,大野市,勝山市・大野市,勝山市観光まちづくり(株),4泊以上,4泊以上,福井エリア（福井市・永平寺町）,福井県外には宿泊しない,自分ひとり,"出張など仕事関係
",0,0,0,0,0,0,0,0,0,0,0,0,0,0,0,0,1,0,"インターネット・アプリ
",0,0,0,0,0,1,0,0,0,0,0,0,0,0,"在来線
",0,1,0,0,0,0,0,"レンタカー
",0,0,0,0,選択肢なし,,"20,000円以上 30,000円未満","30,000円以上 40,000円未満","10,000円以上 20,000円未満",初めて,選択なし/該当施設なし,,選択なし/該当施設なし,,"1,000円未満",とても満足,迫力があった,感じなかった,,8,リニューアル後に来た方が良いかも知れない,,機会があれば行きたい,
124070,web,男,1975,47,40代,大阪府,大阪市福島区,800万円以上 900万円未満,mobile/iphone,2022-12-03 13:07:10,12月,道の駅「九頭竜」 エリア,17.道の駅「九頭竜」 エリア,大野市,勝山市・大野市,,4泊以上,4泊以上,福井エリア（福井市・永平寺町）,福井県外には宿泊しない,自分ひとり,"出張など仕事関係
",0,0,0,0,0,0,0,0,0,0,0,0,0,0,0,0,1,0,"インターネット・アプリ
",0,0,0,0,0,1,0,0,0,0,0,0,0,0,"在来線
",0,1,0,0,0,0,0,"レンタカー
",0,0,0,0,どちらでもない,"道は良いが少し遠いです
工事中のバイパス完成したら少し早くなります
電車も本数が少なくて使いにくいです","20,000円以上 30,000円未満","30,000円以上 40,000円未満","10,000円以上 20,000円未満",初めて,選択なし/該当施設なし,,選択なし/該当施設なし,,"1,000円未満",どちらでもない,仕方ないとは思いますがお店が少ないです,感じなかった,,6,ダムがきれいでした,,機会があれば行きたい,
124070,web,男,1975,47,40代,大阪府,大阪市福島区,800万円以上 900万円未満,mobile/iphone,2022-12-03 11:37:24,12月,一乗谷朝倉氏遺跡 エリア,01.一乗谷朝倉氏遺跡 エリア,福井市,福井市・永平寺町,,4泊以上,4泊以上,福井エリア（福井市・永平寺町）,福井県外には宿泊しない,自分ひとり,"出張など仕事関係
",0,0,0,0,0,0,0,0,0,0,0,0,0,0,0,0,1,0,"インターネット・アプリ
",0,0,0,0,0,1,0,0,0,0,0,0,0,0,"在来線
",0,1,0,0,0,0,0,"レンタカー
",0,0,0,0,満足,,"20,000円以上 30,000円未満","30,000円以上 40,000円未満","10,000円以上 20,000円未満",初めて,選択なし/該当施設なし,,選択なし/該当施設なし,,使わない,満足,勉強になりました,感じなかった,,7,,,機会があれば行きたい,
124070,web,男,1975,47,40代,大阪府,大阪市福島区,800万円以上 900万円未満,mobile/iphone,2022-12-03 10:40:34,12月,劔神社 エリア,40.劔神社 エリア,越前町,丹南,,4泊以上,4泊以上,福井エリア（福井市・永平寺町）,福井県外には宿泊しない,自分ひとり,"出張など仕事関係
",0,0,0,0,0,0,0,0,0,0,0,0,0,0,0,0,1,0,"インターネット・アプリ
",0,0,0,0,0,1,0,0,0,0,0,0,0,0,"在来線
",0,1,0,0,0,0,0,"レンタカー
",0,0,0,0,満足,,"20,000円以上 30,000円未満","30,000円以上 40,000円未満","10,000円以上 20,000円未満",初めて,選択なし/該当施設なし,,選択なし/該当施設なし,,使わない,満足,立派な神社でした,感じなかった,,7,,,機会があれば行きたい,
124070,web,男,1975,47,40代,大阪府,大阪市福島区,800万円以上 900万円未満,mobile/iphone,2022-12-03 09:19:30,12月,東尋坊 エリア,06.東尋坊 エリア,坂井市,あわら市・坂井市,(一社)DMOさかい観光局,4泊以上,4泊以上,福井エリア（福井市・永平寺町）,福井県外には宿泊しない,自分ひとり,"出張など仕事関係
",0,0,0,0,0,0,0,0,0,0,0,0,0,0,0,0,1,0,"インターネット・アプリ
",0,0,0,0,0,1,0,0,0,0,0,0,0,0,"在来線
",0,1,0,0,0,0,0,"レンタカー
",0,0,0,0,満足,渋滞が少なかった,"20,000円以上 30,000円未満","30,000円以上 40,000円未満","10,000円以上 20,000円未満",2～5回目,福井駅,,選択なし/該当施設なし,,"1,000円未満",満足,景色が良かった,感じなかった,,7,,,機会があれば行きたい,
124070,web,男,1975,47,40代,大阪府,大阪市福島区,800万円以上 900万円未満,mobile/iphone,2022-12-03 07:28:55,12月,福井駅前 エリア,04.福井駅前 エリア,福井市,福井市・永平寺町,,4泊以上,4泊以上,福井エリア（福井市・永平寺町）,福井県外には宿泊しない,自分ひとり,"地元の美味しいものを食べる
名所、旧跡の観光
テーマパーク（遊園地、動物園、博物館など）
出張など仕事関係
",0,0,1,0,1,1,0,0,0,0,0,0,0,0,0,0,1,0,"インターネット・アプリ
",0,0,0,0,0,1,0,0,0,0,0,0,0,0,"在来線
",0,0,0,1,0,0,0,"在来線
",0,0,0,0,どちらでもない,,"20,000円以上 30,000円未満","30,000円以上 40,000円未満","10,000円以上 20,000円未満",2～5回目,氣比神宮,,福井県立恐竜博物館,,"5,000円以上 10,000円未満",満足,直近で毎日雨だったので、駅前の屋根がありがたかった。,感じなかった,,7,福井の名物がほぼ食べられる,"繁華街が少し閑散としているのが寂しい
土産は普通に揃っている
日本酒コーナーを充実させてほしい",機会があれば行きたい,"とにかく雨が降っていたので思うように行動できなかったのが残念でした。
また来ます。"
