会員ID,登録施設,性別,生まれ年,回答時の年齢,年代,都道府県,会員市町村,世帯年収,UA,回答日時,回答月,回答エリア,回答エリア2,市町村,6分類,DMO,宿泊数（全体）,宿泊数（県内）,宿泊エリア（県内）,宿泊エリア（県外）,同行者,訪問目的ALL,宿でのんびり過ごす,温泉や露天風呂,地元の美味しいものを食べる,花見や紅葉などの自然鑑賞,名所、旧跡の観光,テーマパーク（遊園地、動物園、博物館など）,買い物、アウトレット,お祭りやイベントへの参加・見物,スポーツ観戦や芸能鑑賞（コンサート等）,アウトドア（海水浴、釣り、登山など）,まちあるき、都市散策,各種体験（手作り、果物狩りなど）,スキー・スノボ、マリンスポーツ,その他スポーツ（ゴルフ、テニスなど）,ドライブ・ツーリング,友人・親戚を尋ねる,出張など仕事関係,その他,情報収集ALL,観光展・物産展,新聞・雑誌・ガイドブック,TV・ラジオ番組やCM,観光パンフレット・ポスター,観光連盟やDMOのHP,インターネット・アプリ,Twitter,Instagram,Facebook,ブログ,友人・知人,観光協会等の案内所,タクシードライバーや地元の人,宿泊施設,福井県までの交通手段ALL,自家用車,レンタカー,新幹線,在来線,飛行機,旅行会社ツアーバス,県外から訪れていない（福井県在住）,福井県内での交通手段ALL,タクシー,路線バス,徒歩,レンタサイクル,福井県内での交通手段の満足度,福井県内での交通手段の満足度の理由,宿泊費,交通費,県内消費額,エリア訪問回数,アンケート回答前に訪問した主な場所,アンケート回答前に訪問した主な場所FA,アンケート回答後に訪問する予定の主な場所,アンケート回答後に訪問する予定の主な場所FA,エリア総消費額,満足度,満足度の理由,不便さ,不便さの内容,NPS,推奨項目,施設に求めるもの,今後の来訪意向,福井県に求めるもの,登録エリア,満足度(商品・サービス),満足度(商品・サービス)の理由
124827,web,女,1969,53,50代,大阪府,枚方市,200万円以上 300万円未満,mobile/iphone,2022-11-18 02:00:39,11月,金ヶ崎 エリア,49.金ヶ崎 エリア,敦賀市,嶺南東部,,1泊,1泊,福井エリア（福井市・永平寺町）,福井県外には宿泊しない,夫婦2人,"お祭りやイベントへの参加・見物
まちあるき、都市散策
",0,0,0,0,0,0,0,1,0,0,1,0,0,0,0,0,0,0,"観光展・物産展
観光パンフレット・ポスター
観光協会等の案内所
",1,0,0,1,0,0,0,0,0,0,0,1,0,0,"自家用車
",1,0,0,0,0,0,0,"自家用車
",0,0,0,0,,,"5,000円以上 10,000円未満","3,000円以上 5,000円未満","5,000円以上 10,000円未満",初めて,氣比神宮,,選択なし/該当施設なし,,"1,000円以上 3,000円未満",満足,目的地に寄り、美味しい物を食べて、買い物をしたので。,感じなかった,,8,神宮周辺には、商店街もあり、また、松本零士さんの作品の像もありました。是非、歩いて見てもらいたいです。,商店街でごはんを食べた時、注文の際、声が届かず、常連さんが、お店に声かけしてくれました。物が、美味しいのは当たり前ですが、こういう事が、旅の思い出になります。,機会があれば行きたい,"今回の場所は、ゆっくり、見学でき（観る）所はあるし、道中、食べれるお菓子、ホテルで食べるケーキが買えるお店があります。
商店街が、もう少し、お店が入ると良いですね。",,,
124827,,女,1969,54,50代,大阪府,枚方市,200万円以上 300万円未満,mobile/iphone,2023-08-11 23:02:58,8月,福井駅前 エリア（宿泊施設）,02.福井駅前 エリア（宿泊施設）,福井市,福井市・永平寺町,,2泊,1泊,福井エリア（福井市・永平寺町）,一宮市,夫婦2人,"お祭りやイベントへの参加・見物
",0,0,0,0,0,0,0,1,0,0,0,0,0,0,0,0,0,0,"宿泊施設
",0,0,0,0,0,0,0,0,0,0,0,0,0,1,"自家用車
",1,0,0,0,0,0,0,"自家用車
",0,0,0,0,,,"3,000円以上 5,000円未満","5,000円以上 10,000円未満","10,000円以上 20,000円未満",2～5回目,選択なし/該当施設なし,,選択なし/該当施設なし,,"3,000円以上 5,000円未満",どちらでもない,駅前開発中の為,感じた,駅前開発中の為,4,恐竜の広場の恐竜が動くのを見るのが楽しい,"開発中なので、前にあった菓子店が、皆、戻ってきてくれるのか心配です。
色々な店で、少しから、購入できて、食べる事ができたので、羽二重の食べ比べができ、楽しかった。",機会があれば行きたい,美味しい、お菓子を購入できるとうれしい。,web,どちらでもない,駅前が開発中なので、目当ての買い物が出来なかった。
124827,,女,1969,54,50代,大阪府,枚方市,200万円以上 300万円未満,mobile/iphone,2023-08-14 15:23:18,8月,福井駅前 エリア,01.福井駅前 エリア,福井市,福井市・永平寺町,,2泊,1泊,福井エリア（福井市・永平寺町）,一宮市,夫婦2人,"お祭りやイベントへの参加・見物
",0,0,0,0,0,0,0,1,0,0,0,0,0,0,0,0,0,0,"宿泊施設
",0,0,0,0,0,0,0,0,0,0,0,0,0,1,"自家用車
",1,0,0,0,0,0,0,"自家用車
",0,0,0,0,,,"3,000円以上 5,000円未満","5,000円以上 10,000円未満","10,000円以上 20,000円未満",2～5回目,選択なし/該当施設なし,福井駅前,選択なし/該当施設なし,,"3,000円以上 5,000円未満",どちらでもない,上記と同じ,感じた,駅前開発中のため,4,駅前開発中のため,以前みたいに、各店舗があり、各店から、お菓子をかえるのが良いです。,機会があれば行きたい,,web,どちらでもない,駅前開発中なので、以前の店舗の出店がないため
124827,,女,1969,54,50代,大阪府,枚方市,200万円以上 300万円未満,mobile/iphone,2023-11-20 00:27:09,11月,福井駅前 エリア,01.福井駅前 エリア,福井市,福井市・永平寺町,,1泊,1泊,嶺南エリア（敦賀市・美浜町・若狭町・小浜市・おおい町・高浜町）,福井県外には宿泊しない,その他家族,"宿でのんびり過ごす
温泉や露天風呂
地元の美味しいものを食べる
",1,1,1,0,0,0,0,0,0,0,0,0,0,0,0,0,0,来たことがある,"その他
",0,0,0,0,0,0,0,0,0,0,0,0,0,0,"自家用車
",1,0,0,0,0,0,0,"自家用車
",0,0,0,0,,,"40,000円以上 50,000円未満","5,000円以上 10,000円未満","1,000円以上 3,000円未満",2～5回目,日本海さかな街,,敦賀赤レンガ倉庫,,"1,000円未満",満足,,感じなかった,,5,,,機会があれば行きたい,羽二重もち、冬は、水ようかんを買いたいです。,web,満足,車内でたべる菓子を買うのによりました
124827,,女,1969,54,50代,大阪府,枚方市,200万円以上 300万円未満,mobile/iphone,2023-12-08 04:06:14,12月,JR美浜駅 エリア,79.JR美浜駅 エリア,美浜町,嶺南東部,三方五湖DMO(株),1泊,福井県内には宿泊しない,嶺南エリア（敦賀市・美浜町・若狭町・小浜市・おおい町・高浜町）,福井県外には宿泊しない,夫婦2人,"宿でのんびり過ごす
地元の美味しいものを食べる
買い物、アウトレット
まちあるき、都市散策
",1,0,1,0,0,0,1,0,0,0,1,0,0,0,0,0,0,0,"新聞・雑誌・ガイドブック
インターネット・アプリ
",0,1,0,0,0,1,0,0,0,0,0,0,0,0,"自家用車
",1,0,0,0,0,0,0,"自家用車
",0,0,0,0,満足,天気よく、スムーズに行けた為,"20,000円以上 30,000円未満","5,000円以上 10,000円未満","5,000円以上 10,000円未満",2～5回目,三方五湖,,日本海さかな街,,"1,000円以上 3,000円未満",満足,買いたいお店が営業していたのでよかった,感じなかった,,5,スーパーに寄ってもらいたいです。お魚も新鮮です。,,機会があれば行きたい,,web,満足,
124827,,女,1969,55,50代,大阪府,枚方市,200万円以上 300万円未満,mobile/iphone,2024-03-08 21:17:23,3月,福井駅前 エリア（宿泊施設）,02.福井駅前 エリア（宿泊施設）,福井市,福井市・永平寺町,,2泊,2泊,福井エリア（福井市・永平寺町）,福井県外には宿泊しない,夫婦2人,"地元の美味しいものを食べる
まちあるき、都市散策
",0,0,1,0,0,0,0,0,0,0,1,0,0,0,0,0,0,0,"新聞・雑誌・ガイドブック
観光パンフレット・ポスター
観光協会等の案内所
",0,1,0,1,0,0,0,0,0,0,0,1,0,0,"在来線
",0,0,0,1,0,0,0,"在来線
",0,0,0,0,満足,急ぐ目的はなかったので、ゆっくりきました。,"10,000円以上 20,000円未満","10,000円以上 20,000円未満","5,000円以上 10,000円未満",2～5回目,選択なし/該当施設なし,福井神社　福井城址,選択なし/該当施設なし,,"10,000円以上 20,000円未満",満足,宿泊ホテル部屋から恐竜の動くのが見えるのでいつも楽しみに宿泊してます。,感じなかった,,5,"駅前の恐竜か、精巧に作られていて、いつも見入ってしまう。今は、頻繁に動いてる気がします。また、増えるみたいで、楽しみ。
是非、動きを見てほしい。
福井神社での御朱印のお話や、城址も地震で崩れた石垣があり、地震のすこさがわかるものでした。城址に行くお濠の入り口も良いです。",改札外が、もうすぐできるようで、前みたいに気軽に、少量でも買い物てきるようになっていればと思います。,機会があれば行きたい,商店街、飲食店があるけど、もっと紹介してもらえば良いなと思いました。,web,満足,
