会員ID,登録施設,性別,生まれ年,回答時の年齢,年代,都道府県,会員市町村,世帯年収,UA,回答日時,回答月,回答エリア,回答エリア2,市町村,6分類,DMO,宿泊数（全体）,宿泊数（県内）,宿泊エリア（県内）,宿泊エリア（県外）,同行者,訪問目的ALL,宿でのんびり過ごす,温泉や露天風呂,地元の美味しいものを食べる,花見や紅葉などの自然鑑賞,名所、旧跡の観光,テーマパーク（遊園地、動物園、博物館など）,買い物、アウトレット,お祭りやイベントへの参加・見物,スポーツ観戦や芸能鑑賞（コンサート等）,アウトドア（海水浴、釣り、登山など）,まちあるき、都市散策,各種体験（手作り、果物狩りなど）,スキー・スノボ、マリンスポーツ,その他スポーツ（ゴルフ、テニスなど）,ドライブ・ツーリング,友人・親戚を尋ねる,出張など仕事関係,その他,情報収集ALL,観光展・物産展,新聞・雑誌・ガイドブック,TV・ラジオ番組やCM,観光パンフレット・ポスター,観光連盟やDMOのHP,インターネット・アプリ,Twitter,Instagram,Facebook,ブログ,友人・知人,観光協会等の案内所,タクシードライバーや地元の人,宿泊施設,福井県までの交通手段ALL,自家用車,レンタカー,新幹線,在来線,飛行機,旅行会社ツアーバス,県外から訪れていない（福井県在住）,福井県内での交通手段ALL,タクシー,路線バス,徒歩,レンタサイクル,福井県内での交通手段の満足度,福井県内での交通手段の満足度の理由,宿泊費,交通費,県内消費額,エリア訪問回数,アンケート回答前に訪問した主な場所,アンケート回答前に訪問した主な場所FA,アンケート回答後に訪問する予定の主な場所,アンケート回答後に訪問する予定の主な場所FA,エリア総消費額,満足度,満足度の理由,不便さ,不便さの内容,NPS,推奨項目,施設に求めるもの,今後の来訪意向,福井県に求めるもの,登録エリア,満足度(商品・サービス),満足度(商品・サービス)の理由
101225,うるしの里 エリア,女,1955,67,60代,福井県,坂井市,400万円以上 500万円未満,mobile/android,2022-04-29 15:21:12,4月,うるしの里 エリア,34.うるしの里 エリア,鯖江市,丹南,,日帰り,福井県内には宿泊しない,福井県内には宿泊しない,福井県外には宿泊しない,自分ひとり,"買い物、アウトレット
",0,0,0,0,0,0,1,0,0,0,0,0,0,0,0,0,0,0,"新聞・雑誌・ガイドブック
観光パンフレット・ポスター
観光連盟やDMOのHP
",0,1,0,1,1,0,0,0,0,0,0,0,0,0,"県外から訪れていない（福井県在住）
",1,0,0,0,0,0,1,"自家用車
",0,0,0,0,,,"20,000円以上 30,000円未満",使わない,"20,000円以上 30,000円未満",2～5回目,越前和紙の里,,選択なし/該当施設なし,,"20,000円以上 30,000円未満",とても満足,どこも丁寧に対応してくださった,感じなかった,,8,うるしの里会館、漆塗りについてよくわかる。展示品も素晴らしいし、手頃なアウトレット商品もありよかった。,感じの良い、アートの有る、一人旅でも楽しめる喫茶店があると良い。体験は2日前予約だが現地で知ると出来ないので残念です。当日でもできるプログラムがあるといいです。,また行きたい（1年以内）,,,,
101225,うるしの里 エリア,女,1955,67,60代,福井県,坂井市,400万円以上 500万円未満,mobile/android,2022-07-03 14:54:44,7月,あわら温泉 エリア,11.あわら温泉 エリア,あわら市,あわら市・坂井市,,日帰り,福井県内には宿泊しない,福井県内には宿泊しない,福井県外には宿泊しない,友人,"温泉や露天風呂
まちあるき、都市散策
",0,1,0,0,0,0,0,0,0,0,1,0,0,0,0,0,0,0,"新聞・雑誌・ガイドブック
観光パンフレット・ポスター
",0,1,0,1,0,0,0,0,0,0,0,0,0,0,"自家用車
県外から訪れていない（福井県在住）
",1,0,0,0,0,0,1,"自家用車
",0,0,0,0,,,"10,000円以上 20,000円未満","1,000円以上 3,000円未満","5,000円以上 10,000円未満",11回目以上,選択なし/該当施設なし,,丸岡城,,"10,000円以上 20,000円未満",とても満足,温泉がよい,感じなかった,,8,温泉がよい,郷土色豊かな食事・ランチがしたい,福井県在住,福井県にしかない料理、食べ方や食材などランチにしてほしい。他県の人に紹介します。海藻のアカモク試食して知りましたが、珍しくて美味しい、ヘルシーなものがいいかも。,,,
101225,,女,1955,68,60代,福井県,坂井市,400万円以上 500万円未満,mobile/android,2023-06-22 22:41:31,6月,一乗谷朝倉氏遺跡 エリア,06.一乗谷朝倉氏遺跡 エリア,福井市,福井市・永平寺町,,日帰り,福井県内には宿泊しない,福井県内には宿泊しない,福井県外には宿泊しない,友人,"名所、旧跡の観光
テーマパーク（遊園地、動物園、博物館など）
",0,0,0,0,1,1,0,0,0,0,0,0,0,0,0,0,0,0,"新聞・雑誌・ガイドブック
TV・ラジオ番組やCM
観光パンフレット・ポスター
インターネット・アプリ
",0,1,1,1,0,1,0,0,0,0,0,0,0,0,"県外から訪れていない（福井県在住）
",1,0,0,0,0,0,1,"自家用車
",0,0,0,0,,,"10,000円以上 20,000円未満","10,000円以上 20,000円未満","5,000円以上 10,000円未満",2～5回目,選択なし/該当施設なし,,選択なし/該当施設なし,,"5,000円以上 10,000円未満",とても満足,ボランティアガイドさんの説明がよかった。,感じなかった,,10,一乗谷朝倉氏遺跡博物館がよかった。①ボランティアガイドさんの説明でよくわかった②遺跡だけではイメージできなかったことが、出土品や復元された建物・庭園などでとてもよくわかった。,予約して朝倉御膳をいただきましたが、彩り良くよかった。汁物が付いているとより良かったかなと思います。,福井県在住,帰りに一乗谷あさくら水の駅に寄ったが(ビオトープや水車は小さな子も喜ぶ)、近くでいくつか立ち寄れる福井らしい所も紹介されると各年代が楽しめていいと思う。大人としては、蘭奢堂に寄り、発酵文化に触れました。,うるしの里 エリア,とても満足,
101225,,女,1955,69,60代,福井県,坂井市,400万円以上 500万円未満,mobile/android,2024-03-30 13:10:40,3月,はたや記念館 ゆめおーれ勝山 エリア,30.はたや記念館 ゆめおーれ勝山 エリア,勝山市,勝山市・大野市,勝山市観光まちづくり(株),日帰り,福井県内には宿泊しない,福井県内には宿泊しない,福井県外には宿泊しない,自分ひとり,"名所、旧跡の観光
",0,0,0,0,1,0,0,0,0,0,0,0,0,0,0,0,0,0,"新聞・雑誌・ガイドブック
",0,1,0,0,0,0,0,0,0,0,0,0,0,0,"自家用車
",1,0,0,0,0,0,0,"自家用車
",0,0,0,0,,歴史がわかりよかった,"10,000円以上 20,000円未満","5,000円以上 10,000円未満","5,000円以上 10,000円未満",2～5回目,選択なし/該当施設なし,,選択なし/該当施設なし,,"1,000円以上 3,000円未満",満足,,感じなかった,,9,,,また行きたい（1年以内）,,うるしの里 エリア,満足,
