会員ID,登録施設,性別,生まれ年,回答時の年齢,年代,都道府県,会員市町村,世帯年収,UA,回答日時,回答月,回答エリア,回答エリア2,市町村,6分類,DMO,宿泊数（全体）,宿泊数（県内）,宿泊エリア（県内）,宿泊エリア（県外）,同行者,訪問目的ALL,宿でのんびり過ごす,温泉や露天風呂,地元の美味しいものを食べる,花見や紅葉などの自然鑑賞,名所、旧跡の観光,テーマパーク（遊園地、動物園、博物館など）,買い物、アウトレット,お祭りやイベントへの参加・見物,スポーツ観戦や芸能鑑賞（コンサート等）,アウトドア（海水浴、釣り、登山など）,まちあるき、都市散策,各種体験（手作り、果物狩りなど）,スキー・スノボ、マリンスポーツ,その他スポーツ（ゴルフ、テニスなど）,ドライブ・ツーリング,友人・親戚を尋ねる,出張など仕事関係,その他,情報収集ALL,観光展・物産展,新聞・雑誌・ガイドブック,TV・ラジオ番組やCM,観光パンフレット・ポスター,観光連盟やDMOのHP,インターネット・アプリ,Twitter,Instagram,Facebook,ブログ,友人・知人,観光協会等の案内所,タクシードライバーや地元の人,宿泊施設,福井県までの交通手段ALL,自家用車,レンタカー,新幹線,在来線,飛行機,旅行会社ツアーバス,県外から訪れていない（福井県在住）,福井県内での交通手段ALL,タクシー,路線バス,徒歩,レンタサイクル,福井県内での交通手段の満足度,福井県内での交通手段の満足度の理由,宿泊費,交通費,県内消費額,エリア訪問回数,アンケート回答前に訪問した主な場所,アンケート回答前に訪問した主な場所FA,アンケート回答後に訪問する予定の主な場所,アンケート回答後に訪問する予定の主な場所FA,エリア総消費額,満足度,満足度の理由,不便さ,不便さの内容,NPS,推奨項目,施設に求めるもの,今後の来訪意向,福井県に求めるもの
101319,日本海さかな街 エリア,女,1979,43,40代,大阪府,吹田市,600万円以上 700万円未満,mobile/iphone,2022-04-30 14:24:57,4月,金ヶ崎 エリア,49.金ヶ崎 エリア,敦賀市,嶺南東部,,2泊,福井県内には宿泊しない,福井県内には宿泊しない,滋賀県,小学生以下連れの家族,"まちあるき、都市散策
",0,0,0,0,0,0,0,0,0,0,1,0,0,0,0,0,0,0,"新聞・雑誌・ガイドブック
",0,1,0,0,0,0,0,0,0,0,0,0,0,0,"自家用車
",1,0,0,0,0,0,0,"自家用車
",0,0,0,0,,,使わない,"1,000円未満","5,000円以上 10,000円未満",初めて,敦賀赤レンガ倉庫,敦賀鉄道資料館,国分寺 (小浜市),小浜海岸,"1,000円未満",とても満足,"敦賀鉄道資料館楽しかったです、スタッフさんもとても親切でした。敦賀港も綺麗でした
赤レンガ倉庫のソフトクリームやコーヒーも美味しかったです",感じなかった,,8,ゆったりと過ごせるので、のんびりした旅にオススメです,まとめて福井のお土産が買えるショップが赤レンガ倉庫にあるとお土産も買えるな、と思いました。,また行きたい（1年以内）,美味しいお菓子や海鮮系の加工品が多いと思うが、知名度が低いと思うので、パッケージ刷新したり食べ方のレシピを提案したり、栄養価をPRしたりと工夫して知名度上げられると良いのではと思いました。
101319,日本海さかな街 エリア,女,1979,43,40代,大阪府,吹田市,600万円以上 700万円未満,mobile/iphone,2022-04-30 12:29:32,4月,日本海さかな街 エリア,46.日本海さかな街 エリア,敦賀市,嶺南東部,,2泊,福井県内には宿泊しない,福井県内には宿泊しない,滋賀県,小学生以下連れの家族,"宿でのんびり過ごす
地元の美味しいものを食べる
名所、旧跡の観光
まちあるき、都市散策
",1,0,1,0,1,0,0,0,0,0,1,0,0,0,0,0,0,0,"新聞・雑誌・ガイドブック
",0,1,0,0,0,0,0,0,0,0,0,0,0,0,"自家用車
",1,0,0,0,0,0,0,"自家用車
",0,0,0,0,,,使わない,"1,000円未満","5,000円以上 10,000円未満",初めて,敦賀赤レンガ倉庫,昆布館（休業中でした）,敦賀鉄道資料館（旧敦賀港駅舎 ）,敦賀市のカフェ　プルミエカフェ,"1,000円以上 3,000円未満",とても満足,海鮮丼が美味しかったです。,感じた,"お店配達地図看板等が目につく位置に無いので、目的のお店まで行くのに少し迷いました。
入り口や館内に見やすい看板（お店のセールスポイントなど記載）があると、お買い物にも役立つと思います。",8,海鮮が新鮮　道路や施設が広い　駅前に銀河鉄道999の像がある,"瓶詰め袋詰めのパッケージが今時のデザインの物があると、買いやすいのではと思います。
食べ方のレシピもあると良いですね。
素材も味もいいのでもったいないです",また行きたい（1年以内）,身体に良く美味しいお土産類
