会員ID,登録施設,性別,生まれ年,回答時の年齢,年代,都道府県,会員市町村,世帯年収,UA,回答日時,回答月,回答エリア,回答エリア2,市町村,6分類,DMO,宿泊数（全体）,宿泊数（県内）,宿泊エリア（県内）,宿泊エリア（県外）,同行者,訪問目的ALL,宿でのんびり過ごす,温泉や露天風呂,地元の美味しいものを食べる,花見や紅葉などの自然鑑賞,名所、旧跡の観光,テーマパーク（遊園地、動物園、博物館など）,買い物、アウトレット,お祭りやイベントへの参加・見物,スポーツ観戦や芸能鑑賞（コンサート等）,アウトドア（海水浴、釣り、登山など）,まちあるき、都市散策,各種体験（手作り、果物狩りなど）,スキー・スノボ、マリンスポーツ,その他スポーツ（ゴルフ、テニスなど）,ドライブ・ツーリング,友人・親戚を尋ねる,出張など仕事関係,その他,情報収集ALL,観光展・物産展,新聞・雑誌・ガイドブック,TV・ラジオ番組やCM,観光パンフレット・ポスター,観光連盟やDMOのHP,インターネット・アプリ,Twitter,Instagram,Facebook,ブログ,友人・知人,観光協会等の案内所,タクシードライバーや地元の人,宿泊施設,福井県までの交通手段ALL,自家用車,レンタカー,新幹線,在来線,飛行機,旅行会社ツアーバス,県外から訪れていない（福井県在住）,福井県内での交通手段ALL,タクシー,路線バス,徒歩,レンタサイクル,福井県内での交通手段の満足度,福井県内での交通手段の満足度の理由,宿泊費,交通費,県内消費額,エリア訪問回数,アンケート回答前に訪問した主な場所,アンケート回答前に訪問した主な場所FA,アンケート回答後に訪問する予定の主な場所,アンケート回答後に訪問する予定の主な場所FA,エリア総消費額,満足度,満足度の理由,不便さ,不便さの内容,NPS,推奨項目,施設に求めるもの,今後の来訪意向,福井県に求めるもの
110978,三方五湖 エリア,女,1973,49,40代,大阪府,大阪市旭区,分からない/無回答,mobile/android,2022-08-11 19:44:04,8月,三方五湖 エリア,63.三方五湖 エリア,若狭町,嶺南東部,三方五湖DMO(株),3泊,1泊,嶺南エリア（敦賀市・美浜町・若狭町・小浜市・おおい町・高浜町）,石川県能美市、滋賀県彦根市,中学生以上連れの家族,"アウトドア（海水浴、釣り、登山など）
",0,0,0,0,0,0,0,0,0,1,0,0,0,0,0,0,0,0,"インターネット・アプリ
",0,0,0,0,0,1,0,0,0,0,0,0,0,0,"レンタカー
",0,1,0,0,0,0,0,"レンタカー
",0,0,0,0,,,"50,000円以上 100,000円未満","100,000円以上","3,000円以上 5,000円未満",初めて,選択なし/該当施設なし,湖上館パムコ,選択なし/該当施設なし,手取フィッシュランド、竜王アウトレット,"1,000円以上 3,000円未満",とても満足,"初めて、カヤックの体験をしました。

魚も釣れましたし、岩から飛び込みなんてしたこともなかったので貴重な体験が出来、大満足です！",感じなかった,,10,毎年福井へ(北陸)に来てますが、今回、初めてこちらの体験をし、へとへとでしたが、有意義な1日を体験出来、是非、ご家族で来られたらと思いました。,"ヘトヘトで、何も出来ないので、このままで大丈夫です。

ただ、段取り的に情報不足でした。
もっと詳しく書いてくれればなと思いました。",また行きたい（1年以内）,"福井はほぼ関西と思ってます。
毎年、のんびりしに来てます。
初めて、海水浴に来た時に魚が見えることに感動し、毎年来るようになりました。
このまま、変わらず、海がきれいだと嬉しいです。"
110978,三方五湖 エリア,女,1973,49,40代,大阪府,大阪市旭区,分からない/無回答,mobile/android,2022-08-12 13:05:08,8月,福井駅前 エリア,04.福井駅前 エリア,福井市,福井市・永平寺町,,3泊,1泊,嶺南エリア（敦賀市・美浜町・若狭町・小浜市・おおい町・高浜町）,石川県能美市、滋賀県彦根市,中学生以上連れの家族,"アウトドア（海水浴、釣り、登山など）
",0,0,0,0,0,0,0,0,0,1,0,0,0,0,0,0,0,0,"インターネット・アプリ
",0,0,0,0,0,1,0,0,0,0,0,0,0,0,"レンタカー
",0,1,0,0,0,0,0,"レンタカー
",0,0,0,0,とても満足,いつもレンタカーなんで。,"50,000円以上 100,000円未満","100,000円以上","3,000円以上 5,000円未満",6～10回目,選択なし/該当施設なし,湖上館パムコ,選択なし/該当施設なし,手取フィッシュランド、竜王アウトレット,"1,000円以上 3,000円未満",とても満足,"この時期に毎年来てます。
その度に抽選があり、楽しみにしてます。",感じなかった,,10,"ちいかわのキーホルダーと靴下がおいてあるよ！って言いたいです。
娘に買いました！",氷柱ありませんでしたっけ？,また行きたい（1年以内）,このまま変わらないで下さい。
110978,三方五湖 エリア,女,1973,49,40代,大阪府,大阪市旭区,分からない/無回答,mobile/android,2022-08-13 21:29:37,8月,道の駅「南えちぜん山海里」 エリア,43.道の駅「南えちぜん山海里」 エリア,南越前町,丹南,,3泊,1泊,嶺南エリア（敦賀市・美浜町・若狭町・小浜市・おおい町・高浜町）,石川県能美市、滋賀県彦根市,中学生以上連れの家族,"アウトドア（海水浴、釣り、登山など）
",0,0,0,0,0,0,0,0,0,1,0,0,0,0,0,0,0,0,"インターネット・アプリ
",0,0,0,0,0,1,0,0,0,0,0,0,0,0,"レンタカー
",0,1,0,0,0,0,0,"レンタカー
",0,0,0,0,とても満足,レンタカーで十分です。,"50,000円以上 100,000円未満","100,000円以上","3,000円以上 5,000円未満",初めて,福井駅,,選択なし/該当施設なし,竜王アウトレット,"1,000円以上 3,000円未満",満足,すごくきれいで楽しかったです。,感じなかった,,8,サービスエリアに道の駅が！,仮眠室,また行きたい（1年以内）,いつまでも、きれいな海があれば十分です。
