会員ID,登録施設,性別,生まれ年,回答時の年齢,年代,都道府県,会員市町村,世帯年収,UA,回答日時,回答月,回答エリア,回答エリア2,市町村,6分類,DMO,宿泊数（全体）,宿泊数（県内）,宿泊エリア（県内）,宿泊エリア（県外）,同行者,訪問目的ALL,宿でのんびり過ごす,温泉や露天風呂,地元の美味しいものを食べる,花見や紅葉などの自然鑑賞,名所、旧跡の観光,テーマパーク（遊園地、動物園、博物館など）,買い物、アウトレット,お祭りやイベントへの参加・見物,スポーツ観戦や芸能鑑賞（コンサート等）,アウトドア（海水浴、釣り、登山など）,まちあるき、都市散策,各種体験（手作り、果物狩りなど）,スキー・スノボ、マリンスポーツ,その他スポーツ（ゴルフ、テニスなど）,ドライブ・ツーリング,友人・親戚を尋ねる,出張など仕事関係,その他,情報収集ALL,観光展・物産展,新聞・雑誌・ガイドブック,TV・ラジオ番組やCM,観光パンフレット・ポスター,観光連盟やDMOのHP,インターネット・アプリ,Twitter,Instagram,Facebook,ブログ,友人・知人,観光協会等の案内所,タクシードライバーや地元の人,宿泊施設,福井県までの交通手段ALL,自家用車,レンタカー,新幹線,在来線,飛行機,旅行会社ツアーバス,県外から訪れていない（福井県在住）,福井県内での交通手段ALL,タクシー,路線バス,徒歩,レンタサイクル,福井県内での交通手段の満足度,福井県内での交通手段の満足度の理由,宿泊費,交通費,県内消費額,エリア訪問回数,アンケート回答前に訪問した主な場所,アンケート回答前に訪問した主な場所FA,アンケート回答後に訪問する予定の主な場所,アンケート回答後に訪問する予定の主な場所FA,エリア総消費額,満足度,満足度の理由,不便さ,不便さの内容,NPS,推奨項目,施設に求めるもの,今後の来訪意向,福井県に求めるもの
113233,あわら温泉 エリア,女,1997,25,20代,東京都,大田区,300万円以上 400万円未満,mobile/iphone,2022-09-08 14:46:13,9月,あわら温泉 エリア,11.あわら温泉 エリア,あわら市,あわら市・坂井市,,4泊以上,2泊,三国・あわらエリア（あわら市・坂井市）,石川県加賀市,自分ひとり,"宿でのんびり過ごす
温泉や露天風呂
地元の美味しいものを食べる
名所、旧跡の観光
まちあるき、都市散策
出張など仕事関係
",1,1,1,0,1,0,0,0,0,0,1,0,0,0,0,0,1,0,"観光パンフレット・ポスター
観光連盟やDMOのHP
インターネット・アプリ
Instagram
",0,0,0,1,1,1,0,1,0,0,0,0,0,0,"新幹線
在来線
",0,0,1,1,0,0,0,"在来線
路線バス
",0,1,0,0,どちらでもない,芦原温泉駅が新幹線開通？のため、バス停までの距離が遠かったです。（工事のせい？）少し不便でした、、,使わない,"10,000円以上 20,000円未満","3,000円以上 5,000円未満",初めて,選択なし/該当施設なし,,選択なし/該当施設なし,,"1,000円以上 3,000円未満",満足,顧客情報や満足度を測るにはやっぱりアンケート大切ですよね！勉強になります！（店舗出張できました）,感じた,"不便というわけではありませんが、、徒歩圏内で行ける散策名所？がもっと増えれば良いと思います、、
どこもそうだと思いますが、、",6,"出張のため近場しか回れませんが今度は水族館や恐竜博物館まで行ってみたいですね！
1000円とかで周遊できるバスがあればいいのですが、、","セントピアにきておりますが入浴をしなくてもギャラリーを見たり温泉気分を味わえる嬉しいところですね！
これから湯けむり横丁にいきますが居酒屋以外も栄えてる良いいな、、やきとりや団子など昼の街ぶらも楽しめるようになるともっと満足度は上がると思います！",また行きたい（1年以内）,"恐竜博物館は福井ならではでとっても興味があります！！つぎこそはー！
あと、どこかに恐竜のキーホルダーガチャがあればいいな、、
おいしいものたくさん食べて帰ります！"
113233,あわら温泉 エリア,女,1997,25,20代,東京都,大田区,300万円以上 400万円未満,mobile/iphone,2022-09-09 13:56:57,9月,永平寺門前 エリア,25.永平寺門前 エリア,永平寺町,福井市・永平寺町,,4泊以上,2泊,三国・あわらエリア（あわら市・坂井市）,石川県加賀市,自分ひとり,"出張など仕事関係
",0,0,0,0,0,0,0,0,0,0,0,0,0,0,0,0,1,0,"Instagram
",0,0,0,0,0,0,0,1,0,0,0,0,0,0,"在来線
",0,0,0,0,0,0,0,"路線バス
",0,1,0,0,満足,フリーきっぷで、芦原温泉駅から京福バスできました！期間限定の半額1150円でとっても嬉しいです！,使わない,"10,000円以上 20,000円未満","3,000円以上 5,000円未満",初めて,選択なし/該当施設なし,,選択なし/該当施設なし,金沢に帰ります、、,"1,000円未満",満足,"芦原温泉近くは意外と観光スポットがなかったのでようやく観光気分です、、茶などもあって嬉しい！プリン食べようかなー
（一休さんで荷物を預かっていただけるのは嬉しいです）",感じなかった,,7,これから永平寺むかうのでまだわかりませんが、、厳かな雰囲気もあり静寂さを楽しみに来ました！,福井駅、芦原温泉周辺からのアクセスが少し遠いですよね、通常フリーきっぷ2300円は少し高いかな、,また行きたい（1年以内）,恐竜ガチャガチャさがしていまーす！博物館遠くて行けないので駅周辺にたくさんグッズほしいのですが、、
