会員ID,登録施設,性別,生まれ年,回答時の年齢,年代,都道府県,会員市町村,世帯年収,UA,回答日時,回答月,回答エリア,回答エリア2,市町村,6分類,DMO,宿泊数（全体）,宿泊数（県内）,宿泊エリア（県内）,宿泊エリア（県外）,同行者,訪問目的ALL,宿でのんびり過ごす,温泉や露天風呂,地元の美味しいものを食べる,花見や紅葉などの自然鑑賞,名所、旧跡の観光,テーマパーク（遊園地、動物園、博物館など）,買い物、アウトレット,お祭りやイベントへの参加・見物,スポーツ観戦や芸能鑑賞（コンサート等）,アウトドア（海水浴、釣り、登山など）,まちあるき、都市散策,各種体験（手作り、果物狩りなど）,スキー・スノボ、マリンスポーツ,その他スポーツ（ゴルフ、テニスなど）,ドライブ・ツーリング,友人・親戚を尋ねる,出張など仕事関係,その他,情報収集ALL,観光展・物産展,新聞・雑誌・ガイドブック,TV・ラジオ番組やCM,観光パンフレット・ポスター,観光連盟やDMOのHP,インターネット・アプリ,Twitter,Instagram,Facebook,ブログ,友人・知人,観光協会等の案内所,タクシードライバーや地元の人,宿泊施設,福井県までの交通手段ALL,自家用車,レンタカー,新幹線,在来線,飛行機,旅行会社ツアーバス,県外から訪れていない（福井県在住）,福井県内での交通手段ALL,タクシー,路線バス,徒歩,レンタサイクル,福井県内での交通手段の満足度,福井県内での交通手段の満足度の理由,宿泊費,交通費,県内消費額,エリア訪問回数,アンケート回答前に訪問した主な場所,アンケート回答前に訪問した主な場所FA,アンケート回答後に訪問する予定の主な場所,アンケート回答後に訪問する予定の主な場所FA,エリア総消費額,満足度,満足度の理由,不便さ,不便さの内容,NPS,推奨項目,施設に求めるもの,今後の来訪意向,福井県に求めるもの
128214,北潟湖 エリア,男,1990,33,30代,大阪府,大阪市東住吉区,"900万円以上 1,000万円未満",mobile/android,2023-01-07 15:39:38,1月,北潟湖 エリア,14.北潟湖 エリア,あわら市,あわら市・坂井市,,1泊,1泊,三国・あわらエリア（あわら市・坂井市）,福井県外には宿泊しない,小学生以下連れの家族,"温泉や露天風呂
地元の美味しいものを食べる
テーマパーク（遊園地、動物園、博物館など）
",0,1,1,0,0,1,0,0,0,0,0,0,0,0,0,0,0,0,"インターネット・アプリ
",0,0,0,0,0,1,0,0,0,0,0,0,0,0,"在来線
",0,0,0,0,0,0,0,"タクシー
",1,0,0,0,とても満足,,"10,000円以上 20,000円未満","10,000円以上 20,000円未満","5,000円以上 10,000円未満",初めて,越前松島水族館,,選択なし/該当施設なし,,"3,000円以上 5,000円未満",とても満足,,感じなかった,,7,,,機会があれば行きたい,
128214,北潟湖 エリア,男,1990,33,30代,大阪府,大阪市東住吉区,"900万円以上 1,000万円未満",mobile/android,2023-01-09 09:06:42,1月,芝政ワールド エリア,07.芝政ワールド エリア,坂井市,あわら市・坂井市,(一社)DMOさかい観光局,1泊,1泊,三国・あわらエリア（あわら市・坂井市）,福井県外には宿泊しない,小学生以下連れの家族,"テーマパーク（遊園地、動物園、博物館など）
",0,0,0,0,0,1,0,0,0,0,0,0,0,0,0,0,0,0,"インターネット・アプリ
",0,0,0,0,0,1,0,0,0,0,0,0,0,0,"在来線
",0,0,0,0,0,0,0,"タクシー
",1,0,0,0,不満,高額なため,"10,000円以上 20,000円未満","10,000円以上 20,000円未満","5,000円以上 10,000円未満",初めて,選択なし/該当施設なし,,選択なし/該当施設なし,,"1,000円以上 3,000円未満",満足,"食事は持ち込みができず、レストラン一箇所しか利用できなかった。
利用者が多く、待ち時間がとても長いので大変だった。",感じた,レストランの待ち行列が長い,8,,,機会があれば行きたい,
