会員ID,登録施設,性別,生まれ年,回答時の年齢,年代,都道府県,会員市町村,世帯年収,UA,回答日時,回答月,回答エリア,回答エリア2,市町村,6分類,DMO,宿泊数（全体）,宿泊数（県内）,宿泊エリア（県内）,宿泊エリア（県外）,同行者,訪問目的ALL,宿でのんびり過ごす,温泉や露天風呂,地元の美味しいものを食べる,花見や紅葉などの自然鑑賞,名所、旧跡の観光,テーマパーク（遊園地、動物園、博物館など）,買い物、アウトレット,お祭りやイベントへの参加・見物,スポーツ観戦や芸能鑑賞（コンサート等）,アウトドア（海水浴、釣り、登山など）,まちあるき、都市散策,各種体験（手作り、果物狩りなど）,スキー・スノボ、マリンスポーツ,その他スポーツ（ゴルフ、テニスなど）,ドライブ・ツーリング,友人・親戚を尋ねる,出張など仕事関係,その他,情報収集ALL,観光展・物産展,新聞・雑誌・ガイドブック,TV・ラジオ番組やCM,観光パンフレット・ポスター,観光連盟やDMOのHP,インターネット・アプリ,Twitter,Instagram,Facebook,ブログ,友人・知人,観光協会等の案内所,タクシードライバーや地元の人,宿泊施設,福井県までの交通手段ALL,自家用車,レンタカー,新幹線,在来線,飛行機,旅行会社ツアーバス,県外から訪れていない（福井県在住）,福井県内での交通手段ALL,タクシー,路線バス,徒歩,レンタサイクル,福井県内での交通手段の満足度,福井県内での交通手段の満足度の理由,宿泊費,交通費,県内消費額,エリア訪問回数,アンケート回答前に訪問した主な場所,アンケート回答前に訪問した主な場所FA,アンケート回答後に訪問する予定の主な場所,アンケート回答後に訪問する予定の主な場所FA,エリア総消費額,満足度,満足度の理由,不便さ,不便さの内容,NPS,推奨項目,施設に求めるもの,今後の来訪意向,福井県に求めるもの,登録エリア,満足度(商品・サービス),満足度(商品・サービス)の理由
126088,福井駅前 エリア,女,1990,32,30代,東京都,中野区,700万円以上 800万円未満,mobile/android,2022-11-29 20:33:45,11月,福井駅前 エリア,04.福井駅前 エリア,福井市,福井市・永平寺町,,3泊,3泊,福井エリア（福井市・永平寺町）,福井県外には宿泊しない,自分ひとり,"出張など仕事関係
その他
",0,0,0,0,0,0,0,0,0,0,0,0,0,0,0,0,1,空港からの福井駅特急直通バス,"観光パンフレット・ポスター
観光協会等の案内所
その他
",0,0,0,1,0,0,0,0,0,0,0,1,0,0,"飛行機
その他
",0,0,0,0,1,0,0,"その他
",0,0,0,0,とても満足,"バスからの車窓風景が素晴らしかった。　窓を数センチ開けることができ、換気の面で安心して乗っていられた。
空港から乗り換え無しで福井駅まで行けるのは便利です。","5,000円以上 10,000円未満","20,000円以上 30,000円未満","40,000円以上 50,000円未満",2～5回目,小松空港（石川県）,小松空港から特急バスで福井駅前東口に到着,福井県立恐竜博物館,ホワイトザウルス、平泉寺白山神社,"20,000円以上 30,000円未満",とても満足,福井駅前にある観光案内所の方々が、大変色々な情報をくださるので、とても助かった。観光だけでなく、地元目線でおすすめのお土産やスーパーを教えてもらい、何だか福井県に地元民として混ざることができた気になれました。,感じた,"喜ね舎に行くバスが少ないです&hellip;。あと少々分かりにくかったです。循環路線なためか、51系統なのか52系統なのか迷いました。そして喜ね舎を観光活用しないのはかなりもったいないと感じました。もっと宣伝した方がよいです。例えば旅行最終日に、福井駅から小松空港へ戻る直前に、喜ね舎に寄って、おいしい野菜やお米を発送する、時間に余裕があれば、そこでランチもしてから帰途につく、も需要がありそうかと。帰途移動だけの日に、何か観光要素をプラスできたら満足感が更に高まりそうです。

あと「不便」ではないのですが、一回目に福井に行った際のことですが、こんな事を書いてしまうとおこがましいのですが、参考になればありがたいです。
えちぜん鉄道福井駅の朝の混雑、どうにかなりませんでしょうか。。実は恐竜博物館とえちぜん鉄道のセット券を購入して、勝山方面を観光する予定でしたが、当該チケットは、使用日当日にしか販売していないとのこと。朝はなんとなく混みそうと心配だから前日に入手できないかと尋ねてみましたがやはりだめでした。翌日、朝30分前に駅に到着しましたが、まず混雑でエントランスに入るまでに10分以上。高校生に混ざり、列に並び、前の高校生が何かしらの困りごとがあるようで、順番が回ってくる前に、乗りたかった列車の発車時刻になりました。恐竜バスや白山神社バスを最大限利用して観光したかったのですが、朝の電車を逃したため、勝山エリアでは全行程タクシーになり、セット券のありがたみが減ったように感じました。前日販売を解禁したり、到着駅で精算可能にしたり、何かしらの対策があるとありがたいです。観光は、地元の日常を邪魔しないようにと心掛けていますが、20分も身動きがとれなかったのは少し残念でした。",10,"特に薦めたいのは、駅前観光案内所とハピリン2階福福館です。観光案内所で自転車を借りられるのは便利でした。富山のアヴイレより便利です。観光案内所の方々も親切なので、観光に便利な地図をくださったり、こちらの質問に真摯に答えてくださいます。
福福館に行けば、福井名物が食べられる・購入できる・発送できるので、ワンストップ的で大変助かりました。富山駅にも石川駅にもこのような施設は無かったと思います。
あとは越前おろしそばとお米です。おいしかったです。どちらも「そばとお米ってここまで美味しいものだったのね」と感じました。",駅前に恐竜の壁画や実物大模型があったのは感動しました。観光人がインスタに投稿したくなるような看板でも追加してみてはいかがでしょうか。「#福井　#恐竜駅」とか。,また行きたい（1年以内）,"福井駅からの小松空港に向かうバスの最終便が早すぎませんか、笑。
あと、その特急バスが、喜ね舎にも停まってくれたらありがたいと思いました。",,,
126088,,女,1990,33,30代,東京都,中野区,700万円以上 800万円未満,mobile/iphone,2023-09-06 20:54:05,9月,スーベニアショップ ラプトル エリア,25.スーベニアショップ ラプトル エリア,勝山市,勝山市・大野市,勝山市観光まちづくり(株),1泊,1泊,嶺南エリア（敦賀市・美浜町・若狭町・小浜市・おおい町・高浜町）,福井県外には宿泊しない,恋人,"地元の美味しいものを食べる
花見や紅葉などの自然鑑賞
",0,0,1,1,0,0,0,0,0,0,0,0,0,0,0,0,0,0,"新聞・雑誌・ガイドブック
",0,1,0,0,0,0,0,0,0,0,0,0,0,0,"飛行機
",0,1,0,0,1,0,0,"レンタカー
",0,0,0,0,,,"10,000円以上 20,000円未満","20,000円以上 30,000円未満","20,000円以上 30,000円未満",2～5回目,福井県立恐竜博物館,,平泉寺白山神社,,"1,000円未満",どちらでもない,"わりと混んでいた。
食事を運ぶ時に、周りをよく見ていないお客さん達とぶつかりそうで（いくら自分で気をつけても）、ヒヤヒヤしました。",感じた,食事や軽食利用客と、お土産購入客の動線が混ざってしまい、少し不便でした。,10,この規模の、恐竜博物館はなかなか無いです、勧めたいです。,"もう少し館内の空気が澄んでいるとありがたい。
お土産の品揃えは充実しています。",また行きたい（1年以内）,"福井県の名物（越前そば、ソースカツ丼、おこうざい等）を、もっと手軽に食べたいです。
今回はレンタカーでしたが、電車で行っても、道の駅を楽しめたらありがたいです。
【将来的に期待したいこと】今回残念だったのが、恐竜博物館で、あれだけ長期間休館していたのに、それなのにお手洗いが全然リニューアルされていなかったこと。トイレ標識だけ新しくて、中身も数もはそのまま。。。「え？なぜ？」と思いました。お手洗いを改修しなかった特別な理由は何だろうと考えました。将来的に改善を期待したい点です。",福井駅前 エリア,どちらでもない,お食事は、恐竜博物館内の方が充実していた。
126088,,女,1990,33,30代,東京都,中野区,700万円以上 800万円未満,mobile/android,2023-09-08 23:17:20,9月,道の駅「三方五湖」  エリア,83.道の駅「三方五湖」 エリア,若狭町,嶺南東部,三方五湖DMO(株),1泊,1泊,嶺南エリア（敦賀市・美浜町・若狭町・小浜市・おおい町・高浜町）,福井県外には宿泊しない,恋人,"花見や紅葉などの自然鑑賞
",0,0,0,1,0,0,0,0,0,0,0,0,0,0,0,0,0,0,"新聞・雑誌・ガイドブック
",0,1,0,0,0,0,0,0,0,0,0,0,0,0,"飛行機
",0,1,0,0,1,0,0,"レンタカー
",0,0,0,0,満足,"駐車場が無料でした。
年縞博物館周辺は湖面に近い道路で、とてもドライブに向いています。","10,000円以上 20,000円未満","20,000円以上 30,000円未満","20,000円以上 30,000円未満",初めて,選択なし/該当施設なし,,福井県年縞博物館,,"3,000円以上 5,000円未満",とても満足,"年縞博物館、最高でした。もっと長く滞在したかったです。入館に際し頂いた副読本も充実していて無料で配布されていることに驚きました。大学教授だけでなく大学院生からの寄稿もあり、年縞のことを多角的に捉えるとてもよい読みものです。あれぜひ翻訳しませんか。私はドイツ語と英語の翻訳業務経験があるので、あのような質の高い副読本を、Made in Japan として用意したいと考えました。いつでも非日本語話者も受け入れられます！みたいな。国際会議も開催できませんかね。地質学の国際会議がベストでしょうが、国際眼科医学会とかわりと親日です。グルテン学会とか喜びそうな条件が揃っていると思います。グルテンフリーなお米の一大産地、発酵食へしこの産地（アンチョビに似ていると言えばすぐに分かってもらえます）等等。あまり知られていませんが、日本はコロナ前は国際会議開催国としてかなり実績がありました。国際会議ならばぜひ福井で開催しましょう、となれば嬉しいです。東京から京都大阪に流れている外国人観光客を北陸三県に取り込めないものでしょうか。ぜひ外国の方々にも知られてほしいです。地味にすごいぞ、福井。

山頂公園の足湯で、ストッキングやタイツ向けの足カバーがあったことには感動しました。冬はタイツ愛用するので、足湯を知らずに来場した場合にも足湯に入れる！と感動しました。",感じた,"レインボー山頂公園において、大雨直後だったせいか、芝生がかなり滑りました。あと、景色に気を取られて、ツルッと転びそうになっている方を見かけました（お年寄り、男性）。あの絶景ですからね、足元への注意も散漫になりますよね、笑。

テラス席には、制限時間を設けていませんか。繁忙期は、１グループでの時間制限を設けても悪くないと思います。

レインボーの傘、とてもきれいですね。自然の色み（緑、青、白）においては、レインボーは本当によく映えると感じました。実は、昨今レインボーが同性愛支持の象徴なので、個人的には、「ふくい」とか「みかたごこ」とか書かれている傘の方がありがたかったです。友人に見せる際（特に留学時代の外国人友人達）に、もしレインボーを身につけていると、政治思想が絡んできてしまうので、もっとニュートラルな何かがあればありがたいです。

電車、なかなか利用しにくいです。敦賀までは何とかたどり着けても、その先（美浜方面）への本数が少ないです。小松空港からの観光人間をもっと増やしたい、もっと多くの人に三方五湖エリアを訪れてほしいと願います。",10,"年縞博物館を推したい。なぜか本当に知られていない。。私は大学で地理学を専攻したいと考えたこともある地理好きですが、それを抜きにしても、あの年縞はもっと知られていると考えたのに、一緒に行った相手は年縞を「昆布にしか見えない」と半信半疑でした。年縞は本当に本当に価値が高いのに&hellip;。

梅、特産品なのですね。もっと宣伝してもよいのでは。。和歌山しか思い浮かびませんでした。宿で頂いた種なし梅、とてもおいしかったです。真っ黒な点が添加物ゼロを物語っていますよね。",レインボーライン有料道路が、自転車通行可能になったらありがたいなぁと思います。近隣の駅で電動自転車貸出しがあれば、そしてレインボーラインが通行可能になれば自転車でもアクセスできると思います。あの絶景はぜひ 多くの方々に見ていただければ。でも安全第一ですよね。あのヘアピンカーブ道路を、車と自転車が共生できるとは考えにくいです&hellip;。,また行きたい（1年以内）,"新幹線開通おめでとうございます。
東京駅から乗り換え無しで福井県まで来られると思うと嬉しいです。

金曜夜に新幹線に乗って福井に来て日曜午後まで福井を堪能して帰京し、月曜からまた仕事という旅がしやすくなります。リモートワークが許可されれば月曜すら福井で過ごせる、と妄想は膨らみます。

今回、初めてレンタカーで福井県内を巡りましたが、電車とバスを使うよりもずっと便利でした。目からウロコ、でした。電車を利用する時よりも、一日あたり観光場所を一箇所増やせると感じました。これはもうレンタカーでの観光だ、と感動レベルでしたが、バスや電車やタクシーでの移動が今よりも充実したらありがたいとも思います。気軽に観光となると、他人様に運転を引き受けてもらうのが一番ですので。

福井にハマっていて、昨年から10ヶ月の間に5回来てしまいました。来年の目標は毎月福井、です。目指せ12回。",福井駅前 エリア,どちらでもない,"商品とサービスについてですが、年縞博物館において、入口に展示されていたお土産（ピンクしましま柄手拭い）を購入したかったです。ですが、「手拭いは、カフェの担当物販でして、そのカフェが休業しているので、ご購入いただけません」とのことでした。理由が理由なので仕方ないと理解できますが、残念と思いました。受付の方々にも恐縮している雰囲気が漂い、こちらのお土産でご迷惑をお掛けしてしまい申し訳ない感じでした。販売できないモノや売り切れているモノは見えないように隠してしまうのが無難かもしれません。

どうでもよいかもしれませんが、カフェの表示、閉鎖中は正しくはClosedです。dが足りませんでした。Closeだと親しみがある、とか、近い、という意味になってしまいます。営業中、であればOpenでもOpenedでもどちらも大丈夫なのですが、閉鎖中はClosedだけなのです。紛らわしいですよね。
私が伺った際にはカフェはお休みでしたが、年縞サンドを食べてみたかったです。Youtubeで見てとても楽しみにしておりました。"
