会員ID,登録施設,性別,生まれ年,回答時の年齢,年代,都道府県,会員市町村,世帯年収,UA,回答日時,回答月,回答エリア,回答エリア2,市町村,6分類,DMO,宿泊数（全体）,宿泊数（県内）,宿泊エリア（県内）,宿泊エリア（県外）,同行者,訪問目的ALL,宿でのんびり過ごす,温泉や露天風呂,地元の美味しいものを食べる,花見や紅葉などの自然鑑賞,名所、旧跡の観光,テーマパーク（遊園地、動物園、博物館など）,買い物、アウトレット,お祭りやイベントへの参加・見物,スポーツ観戦や芸能鑑賞（コンサート等）,アウトドア（海水浴、釣り、登山など）,まちあるき、都市散策,各種体験（手作り、果物狩りなど）,スキー・スノボ、マリンスポーツ,その他スポーツ（ゴルフ、テニスなど）,ドライブ・ツーリング,友人・親戚を尋ねる,出張など仕事関係,その他,情報収集ALL,観光展・物産展,新聞・雑誌・ガイドブック,TV・ラジオ番組やCM,観光パンフレット・ポスター,観光連盟やDMOのHP,インターネット・アプリ,Twitter,Instagram,Facebook,ブログ,友人・知人,観光協会等の案内所,タクシードライバーや地元の人,宿泊施設,福井県までの交通手段ALL,自家用車,レンタカー,新幹線,在来線,飛行機,旅行会社ツアーバス,県外から訪れていない（福井県在住）,福井県内での交通手段ALL,タクシー,路線バス,徒歩,レンタサイクル,福井県内での交通手段の満足度,福井県内での交通手段の満足度の理由,宿泊費,交通費,県内消費額,エリア訪問回数,アンケート回答前に訪問した主な場所,アンケート回答前に訪問した主な場所FA,アンケート回答後に訪問する予定の主な場所,アンケート回答後に訪問する予定の主な場所FA,エリア総消費額,満足度,満足度の理由,不便さ,不便さの内容,NPS,推奨項目,施設に求めるもの,今後の来訪意向,福井県に求めるもの
126517,金津創作の森 エリア,無回答,1969,53,50代,福井県,坂井市,500万円以上 600万円未満,mobile/android,2022-12-04 19:42:47,12月,金津創作の森 エリア,12.金津創作の森 エリア,あわら市,あわら市・坂井市,,1泊,1泊,三国・あわらエリア（あわら市・坂井市）,石川県金沢市,自分ひとり,"地元の美味しいものを食べる
",0,0,1,0,0,0,0,0,0,0,0,0,0,0,0,0,0,0,"インターネット・アプリ
Instagram
",0,0,0,0,0,1,0,1,0,0,0,0,0,0,"自家用車
",1,0,0,0,0,0,0,"自家用車
",0,0,0,0,,,"10,000円以上 20,000円未満","1,000円未満","10,000円以上 20,000円未満",11回目以上,選択なし/該当施設なし,,ゆりの里公園ユリーム春江,,"1,000円以上 3,000円未満",満足,自然にあふれていて、静かで、ひとりでも割ゆっくり散策(ドライブ)するのによかったです。,感じた,"車がなければ不便だと思います。
徒歩や公共交通機関ではかなり時間がかかります。エリアマップなどの配布があると便利かも。",8,金津創作の森は、自然にかこまれた四季を感じながら アートを観賞できる環境で、いろんなアーティストさんたちの工房などもあり、美術芸術に興味のある方には魅力的だと思います。,"近くもしくは敷地内に、お土産屋さんや飲食店が集結しているといいなぁと思います。
作家さんの作品の販売もしてほしい。
入場料に応じてクーポンなどの発行もあると嬉しいです。",福井県在住,"福井は観光地から観光地までの距離がありすぎて、徒歩での観光はムリがあります。
周遊バス、タクシーなど安価で乗れるとよい。色んなプランを設けて、乗り放題や、貸切、人数割引などもほしい。
お土産屋さんもほぼ無いので、高速道路サービスエリア、道の駅、JR の各駅売店などでしか購入できず不便です。お土産店と飲食店を集結させたエリアがほしい。
乗り物、飲食店、お土産店、宿泊施設、全てで使える共通クーポンの発行もほしい。
何度も訪れたくなるように、色んなイベントの実施などもしてほしいです。"
