会員ID,登録施設,性別,生まれ年,回答時の年齢,年代,都道府県,会員市町村,世帯年収,UA,回答日時,回答月,回答エリア,回答エリア2,市町村,6分類,DMO,宿泊数（全体）,宿泊数（県内）,宿泊エリア（県内）,宿泊エリア（県外）,同行者,訪問目的ALL,宿でのんびり過ごす,温泉や露天風呂,地元の美味しいものを食べる,花見や紅葉などの自然鑑賞,名所、旧跡の観光,テーマパーク（遊園地、動物園、博物館など）,買い物、アウトレット,お祭りやイベントへの参加・見物,スポーツ観戦や芸能鑑賞（コンサート等）,アウトドア（海水浴、釣り、登山など）,まちあるき、都市散策,各種体験（手作り、果物狩りなど）,スキー・スノボ、マリンスポーツ,その他スポーツ（ゴルフ、テニスなど）,ドライブ・ツーリング,友人・親戚を尋ねる,出張など仕事関係,その他,情報収集ALL,観光展・物産展,新聞・雑誌・ガイドブック,TV・ラジオ番組やCM,観光パンフレット・ポスター,観光連盟やDMOのHP,インターネット・アプリ,Twitter,Instagram,Facebook,ブログ,友人・知人,観光協会等の案内所,タクシードライバーや地元の人,宿泊施設,福井県までの交通手段ALL,自家用車,レンタカー,新幹線,在来線,飛行機,旅行会社ツアーバス,県外から訪れていない（福井県在住）,福井県内での交通手段ALL,タクシー,路線バス,徒歩,レンタサイクル,福井県内での交通手段の満足度,福井県内での交通手段の満足度の理由,宿泊費,交通費,県内消費額,エリア訪問回数,アンケート回答前に訪問した主な場所,アンケート回答前に訪問した主な場所FA,アンケート回答後に訪問する予定の主な場所,アンケート回答後に訪問する予定の主な場所FA,エリア総消費額,満足度,満足度の理由,不便さ,不便さの内容,NPS,推奨項目,施設に求めるもの,今後の来訪意向,福井県に求めるもの
126847,越前大仏 エリア,女,1994,28,20代,三重県,いなべ市,400万円以上 500万円未満,mobile/iphone,2022-12-09 22:19:25,12月,越前大仏 エリア,22.越前大仏 エリア,勝山市,勝山市・大野市,勝山市観光まちづくり(株),1泊,1泊,越前エリア（越前市・越前町・鯖江市・池田町・南越前町）,福井県外には宿泊しない,親,"宿でのんびり過ごす
温泉や露天風呂
地元の美味しいものを食べる
",1,1,1,0,0,0,0,0,0,0,0,0,0,0,0,0,0,0,"観光パンフレット・ポスター
インターネット・アプリ
",0,0,0,1,0,1,0,0,0,0,0,0,0,0,"自家用車
",1,0,0,0,0,0,0,"自家用車
",0,0,0,0,とても満足,祖母が足が悪い為、歩くことが少ないように車で行きました。,"10,000円以上 20,000円未満","3,000円以上 5,000円未満","20,000円以上 30,000円未満",初めて,越前和紙の里,,福井駅,,"1,000円以上 3,000円未満",とても満足,車椅子貸出があるとは知らず、祖母が足が疲れたと言うので休憩していたところ、チケット売り場のおば様が、車椅子お貸ししますよと声をかけてくださいました。祖母は大仏様を見られて、こんな立派な、と喜んでいました。本当に助かりました。,感じなかった,,10,伝統工芸品を買う時に、旅行支援で貰える金券を使うと額面が倍額の扱いになるというキャンペーン。,金曜日に訪問、お店はほとんど閉まっていました。普段は空いているのかな？賑やかさがあるといいなと思いました。,機会があれば行きたい,伝統工芸品、色々購入しました。蟹も食べました。美味しいもの、可愛いものが沢山で、正直福井県がこんなに魅力ある場所だとは知りませんでした。また来たいと感じました！
