会員ID,登録施設,性別,生まれ年,回答時の年齢,年代,都道府県,会員市町村,世帯年収,UA,回答日時,回答月,回答エリア,回答エリア2,市町村,6分類,DMO,宿泊数（全体）,宿泊数（県内）,宿泊エリア（県内）,宿泊エリア（県外）,同行者,訪問目的ALL,宿でのんびり過ごす,温泉や露天風呂,地元の美味しいものを食べる,花見や紅葉などの自然鑑賞,名所、旧跡の観光,テーマパーク（遊園地、動物園、博物館など）,買い物、アウトレット,お祭りやイベントへの参加・見物,スポーツ観戦や芸能鑑賞（コンサート等）,アウトドア（海水浴、釣り、登山など）,まちあるき、都市散策,各種体験（手作り、果物狩りなど）,スキー・スノボ、マリンスポーツ,その他スポーツ（ゴルフ、テニスなど）,ドライブ・ツーリング,友人・親戚を尋ねる,出張など仕事関係,その他,情報収集ALL,観光展・物産展,新聞・雑誌・ガイドブック,TV・ラジオ番組やCM,観光パンフレット・ポスター,観光連盟やDMOのHP,インターネット・アプリ,Twitter,Instagram,Facebook,ブログ,友人・知人,観光協会等の案内所,タクシードライバーや地元の人,宿泊施設,福井県までの交通手段ALL,自家用車,レンタカー,新幹線,在来線,飛行機,旅行会社ツアーバス,県外から訪れていない（福井県在住）,福井県内での交通手段ALL,タクシー,路線バス,徒歩,レンタサイクル,福井県内での交通手段の満足度,福井県内での交通手段の満足度の理由,宿泊費,交通費,県内消費額,エリア訪問回数,アンケート回答前に訪問した主な場所,アンケート回答前に訪問した主な場所FA,アンケート回答後に訪問する予定の主な場所,アンケート回答後に訪問する予定の主な場所FA,エリア総消費額,満足度,満足度の理由,不便さ,不便さの内容,NPS,推奨項目,施設に求めるもの,今後の来訪意向,福井県に求めるもの
125368,小浜町家ステイ エリア,男,1994,28,20代,東京都,豊島区,400万円以上 500万円未満,mobile/iphone,2022-11-23 02:06:50,11月,小浜町家ステイ エリア,52.小浜町家ステイ エリア,小浜市,嶺南西部,(株)まちづくり小浜,1泊,2泊,嶺南エリア（敦賀市・美浜町・若狭町・小浜市・おおい町・高浜町）,福井県外には宿泊しない,恋人,"宿でのんびり過ごす
温泉や露天風呂
地元の美味しいものを食べる
まちあるき、都市散策
ドライブ・ツーリング
",1,1,1,0,0,0,0,0,0,0,1,0,0,0,1,0,0,0,"その他
",0,0,0,0,0,0,0,0,0,0,0,0,0,0,"レンタカー
新幹線
",0,1,1,0,0,0,0,"レンタカー
",0,0,0,0,とても満足,,"30,000円以上 40,000円未満","20,000円以上 30,000円未満","20,000円以上 30,000円未満",初めて,御食国若狭おばま食文化館,,道の駅「若狭おばま」,,"5,000円以上 10,000円未満",とても満足,,感じた,海産物を買うにもお風呂に入るにも、小浜の港の方まで車を走らせないといけないな、と感じた。,10,現地でしか味わえない魚介類があることがわかったから。お寿司屋さんでもスーパーマーケットでも、見たことのないお魚に触れて実際に食べられたのは貴重な経験です。,"・飲食
お昼は5000円～1万円の高級なお寿司屋さんで食べる。
夜はスーパーマーケットで地魚を買ってきて、調理可能な宿でビール飲みながら食べる。

・土産
ステイの最終日にフィッシャーマンズワーフで蟹を買って帰りたい。
お箸が推されているが、正直買わないな。。と感じた。

・アクティビティ
古いものが整備された街並みを散策しながら、街にあるコーヒースタンドでコーヒーを飲む。
コナンで見た人魚伝説の舞台だなと興味があるので、浜を見に行く。
蘇洞門ツアーに行く。(今回は悪天候で無理でしたが)",機会があれば行きたい,"・飲食
海が近いエリアに来ると海産物が美味しいだろうと思い福井にきました。

・土産
自分用にも職場用にもお土産を買う意味がわからなくて、買いませんでした。

・アクティビティ
小浜線を見たり乗ること、サンダーバードに乗って福井に来ることそのものがまず興味があって今回訪れた。"
