会員ID,登録施設,性別,生まれ年,回答時の年齢,年代,都道府県,会員市町村,世帯年収,UA,回答日時,回答月,回答エリア,回答エリア2,市町村,6分類,DMO,宿泊数（全体）,宿泊数（県内）,宿泊エリア（県内）,宿泊エリア（県外）,同行者,訪問目的ALL,宿でのんびり過ごす,温泉や露天風呂,地元の美味しいものを食べる,花見や紅葉などの自然鑑賞,名所、旧跡の観光,テーマパーク（遊園地、動物園、博物館など）,買い物、アウトレット,お祭りやイベントへの参加・見物,スポーツ観戦や芸能鑑賞（コンサート等）,アウトドア（海水浴、釣り、登山など）,まちあるき、都市散策,各種体験（手作り、果物狩りなど）,スキー・スノボ、マリンスポーツ,その他スポーツ（ゴルフ、テニスなど）,ドライブ・ツーリング,友人・親戚を尋ねる,出張など仕事関係,その他,情報収集ALL,観光展・物産展,新聞・雑誌・ガイドブック,TV・ラジオ番組やCM,観光パンフレット・ポスター,観光連盟やDMOのHP,インターネット・アプリ,Twitter,Instagram,Facebook,ブログ,友人・知人,観光協会等の案内所,タクシードライバーや地元の人,宿泊施設,福井県までの交通手段ALL,自家用車,レンタカー,新幹線,在来線,飛行機,旅行会社ツアーバス,県外から訪れていない（福井県在住）,福井県内での交通手段ALL,タクシー,路線バス,徒歩,レンタサイクル,福井県内での交通手段の満足度,福井県内での交通手段の満足度の理由,宿泊費,交通費,県内消費額,エリア訪問回数,アンケート回答前に訪問した主な場所,アンケート回答前に訪問した主な場所FA,アンケート回答後に訪問する予定の主な場所,アンケート回答後に訪問する予定の主な場所FA,エリア総消費額,満足度,満足度の理由,不便さ,不便さの内容,NPS,推奨項目,施設に求めるもの,今後の来訪意向,福井県に求めるもの,登録エリア,満足度(商品・サービス),満足度(商品・サービス)の理由
125605,あわら温泉 エリア,女,1954,68,60代,福井県,小浜市,分からない/無回答,mobile/android,2022-11-25 20:11:53,11月,花の駅 ゆりの里公園 エリア,09.花の駅 ゆりの里公園 エリア,坂井市,あわら市・坂井市,(一社)DMOさかい観光局,1泊,1泊,三国・あわらエリア（あわら市・坂井市）,福井県外には宿泊しない,夫婦2人,"まちあるき、都市散策
",0,0,0,0,0,0,0,0,0,0,1,0,0,0,0,0,0,0,"インターネット・アプリ
",0,0,0,0,0,1,0,0,0,0,0,0,0,0,"県外から訪れていない（福井県在住）
",1,0,0,0,0,0,1,"自家用車
徒歩
",0,0,1,0,,,"20,000円以上 30,000円未満","5,000円以上 10,000円未満","10,000円以上 20,000円未満",初めて,あわら温泉「芦湯」,,小浜市まちの駅・旭座,,使わない,満足,,感じなかった,,7,孫とのんびり過ごすには最適な場所&hellip;,,福井県在住,,,,
125605,あわら温泉 エリア,女,1954,68,60代,福井県,小浜市,分からない/無回答,mobile/android,2022-11-25 10:35:36,11月,あわら温泉 エリア,11.あわら温泉 エリア,あわら市,あわら市・坂井市,,1泊,1泊,三国・あわらエリア（あわら市・坂井市）,福井県外には宿泊しない,夫婦2人,"宿でのんびり過ごす
温泉や露天風呂
地元の美味しいものを食べる
花見や紅葉などの自然鑑賞
名所、旧跡の観光
買い物、アウトレット
まちあるき、都市散策
",1,1,1,1,1,0,1,0,0,0,1,0,0,0,0,0,0,0,"新聞・雑誌・ガイドブック
観光パンフレット・ポスター
インターネット・アプリ
",0,1,0,1,0,1,0,0,0,0,0,0,0,0,"県外から訪れていない（福井県在住）
",1,0,0,0,0,0,1,"自家用車
",0,0,0,0,,,"20,000円以上 30,000円未満","5,000円以上 10,000円未満","10,000円以上 20,000円未満",2～5回目,丸岡城,,ゆりの里公園ユリーム春江,,"3,000円以上 5,000円未満",どちらでもない,おもてなしの心が感じられなかったのが残念,感じなかった,,5,,,福井県在住,,,,
125605,あわら温泉 エリア,女,1954,68,60代,福井県,小浜市,分からない/無回答,mobile/android,2022-12-31 21:32:33,12月,小浜市まちの駅 エリア,56.小浜市まちの駅 エリア,小浜市,嶺南西部,(株)まちづくり小浜,日帰り,福井県内には宿泊しない,福井県内には宿泊しない,福井県外には宿泊しない,夫婦2人,"買い物、アウトレット
",0,0,0,0,0,0,1,0,0,0,0,0,0,0,0,0,0,0,"友人・知人
",0,0,0,0,0,0,0,0,0,0,1,0,0,0,"県外から訪れていない（福井県在住）
",1,0,0,0,0,0,1,"自家用車
",0,0,0,0,,,使わない,使わない,"1,000円以上 3,000円未満",11回目以上,道の駅「若狭おばま」,,選択なし/該当施設なし,,"1,000円以上 3,000円未満",どちらでもない,子ども達の遊び場としてイベント会場としていい場所だなと思います。,感じた,喫煙所があることです。子ども達への影響も心配ですが観光客の方々も顔をしかめている姿をよく見かけます。タバコを吸いに来る人の車で駐車場になかなか車が止められなくて障害者の方の場所まで使われて困っています。,5,子ども達の遊び場やコミュニケーションの場としてはいいのですが&hellip;恐竜博士の像やレトロバスの前で写真をとっている観光客はよく見かけるのですが&hellip;,観光客を呼ぶだけの魅力が足らないと思います。駐車場も少ないです。コミュニケーションの場として地元の憩いの場になれば嬉しいです。,福井県在住,旅行割キャンペーンのおかげで福井県の美味しいものを食べ観光地を見て周りました。とてもいい所ばかりで大満足な旅となりました。今まで以上に我が県我が町が好きになりました。,,,
125605,あわら温泉 エリア,女,1954,69,60代,福井県,小浜市,分からない/無回答,mobile/android,2023-01-21 12:12:05,1月,道の駅「若狭おばま」 エリア,51.道の駅「若狭おばま」 エリア,小浜市,嶺南西部,(株)まちづくり小浜,日帰り,福井県内には宿泊しない,福井県内には宿泊しない,福井県外には宿泊しない,自分ひとり,"地元の美味しいものを食べる
",0,0,1,0,0,0,0,0,0,0,0,0,0,0,0,0,0,0,"友人・知人
",0,0,0,0,0,0,0,0,0,0,1,0,0,0,"県外から訪れていない（福井県在住）
",1,0,0,0,0,0,1,"自家用車
",0,0,0,0,,,"1,000円未満",使わない,"1,000円未満",11回目以上,三丁町,,選択なし/該当施設なし,,"1,000円以上 3,000円未満",満足,美味しいお魚と巡り会えたから。友達の活躍を知ることができたから。,感じた,狭いところ,7,コンパクトにいいものが揃っているところ,お魚が美味しかった,福井県在住,たくさんの工夫を凝らしながらいいものがどんどんできているのが素晴らしい,,,
125605,あわら温泉 エリア,女,1954,69,60代,福井県,小浜市,分からない/無回答,mobile/android,2023-01-21 11:45:19,1月,小浜市まちの駅 エリア,56.小浜市まちの駅 エリア,小浜市,嶺南西部,(株)まちづくり小浜,日帰り,福井県内には宿泊しない,福井県内には宿泊しない,福井県外には宿泊しない,自分ひとり,"地元の美味しいものを食べる
",0,0,1,0,0,0,0,0,0,0,0,0,0,0,0,0,0,0,"友人・知人
",0,0,0,0,0,0,0,0,0,0,1,0,0,0,"県外から訪れていない（福井県在住）
",1,0,0,0,0,0,1,"自家用車
",0,0,0,0,選択肢なし,,"1,000円未満",使わない,"1,000円未満",11回目以上,三丁町,,選択なし/該当施設なし,,"1,000円未満",どちらでもない,,感じた,駐車場が少ない,3,,イベントなど計画的にされていていい場所。ただ喫煙所があるのが相応しくない。,福井県在住,,,,
125605,,女,1954,69,60代,福井県,小浜市,分からない/無回答,mobile/android,2023-07-16 12:15:29,7月,箸のふるさと館WAKASA エリア,74.箸のふるさと館WAKASA エリア,小浜市,嶺南西部,(株)まちづくり小浜,1泊,1泊,嶺南エリア（敦賀市・美浜町・若狭町・小浜市・おおい町・高浜町）,福井県外には宿泊しない,夫婦2人,"宿でのんびり過ごす
温泉や露天風呂
地元の美味しいものを食べる
",1,1,1,0,0,0,0,0,0,0,0,0,0,0,0,0,0,0,"観光パンフレット・ポスター
宿泊施設
",0,0,0,1,0,0,0,0,0,0,0,0,0,1,"自家用車
",1,0,0,0,0,0,0,"自家用車
",0,0,0,0,,,"10,000円以上 20,000円未満","1,000円以上 3,000円未満","5,000円以上 10,000円未満",6～10回目,道の駅「若狭おばま」,,若狭フィッシャーマンズワーフ,,"3,000円以上 5,000円未満",満足,,感じなかった,,7,,,福井県在住,,あわら湯のまち エリア,満足,
