会員ID,登録施設,性別,生まれ年,回答時の年齢,年代,都道府県,会員市町村,世帯年収,UA,回答日時,回答月,回答エリア,回答エリア2,市町村,6分類,DMO,宿泊数（全体）,宿泊数（県内）,宿泊エリア（県内）,宿泊エリア（県外）,同行者,訪問目的ALL,宿でのんびり過ごす,温泉や露天風呂,地元の美味しいものを食べる,花見や紅葉などの自然鑑賞,名所、旧跡の観光,テーマパーク（遊園地、動物園、博物館など）,買い物、アウトレット,お祭りやイベントへの参加・見物,スポーツ観戦や芸能鑑賞（コンサート等）,アウトドア（海水浴、釣り、登山など）,まちあるき、都市散策,各種体験（手作り、果物狩りなど）,スキー・スノボ、マリンスポーツ,その他スポーツ（ゴルフ、テニスなど）,ドライブ・ツーリング,友人・親戚を尋ねる,出張など仕事関係,その他,情報収集ALL,観光展・物産展,新聞・雑誌・ガイドブック,TV・ラジオ番組やCM,観光パンフレット・ポスター,観光連盟やDMOのHP,インターネット・アプリ,Twitter,Instagram,Facebook,ブログ,友人・知人,観光協会等の案内所,タクシードライバーや地元の人,宿泊施設,福井県までの交通手段ALL,自家用車,レンタカー,新幹線,在来線,飛行機,旅行会社ツアーバス,県外から訪れていない（福井県在住）,福井県内での交通手段ALL,タクシー,路線バス,徒歩,レンタサイクル,福井県内での交通手段の満足度,福井県内での交通手段の満足度の理由,宿泊費,交通費,県内消費額,エリア訪問回数,アンケート回答前に訪問した主な場所,アンケート回答前に訪問した主な場所FA,アンケート回答後に訪問する予定の主な場所,アンケート回答後に訪問する予定の主な場所FA,エリア総消費額,満足度,満足度の理由,不便さ,不便さの内容,NPS,推奨項目,施設に求めるもの,今後の来訪意向,福井県に求めるもの,登録エリア,満足度(商品・サービス),満足度(商品・サービス)の理由
125609,永平寺町 エリア,女,1961,61,60代,神奈川県,横浜市南区,300万円以上 400万円未満,mobile/iphone,2022-11-25 11:22:12,11月,永平寺町 エリア,27.永平寺町 エリア,永平寺町,福井市・永平寺町,,1泊,1泊,三国・あわらエリア（あわら市・坂井市）,福井県外には宿泊しない,夫婦2人,"宿でのんびり過ごす
温泉や露天風呂
地元の美味しいものを食べる
花見や紅葉などの自然鑑賞
名所、旧跡の観光
",1,1,1,1,1,0,0,0,0,0,0,0,0,0,0,0,0,0,"観光展・物産展
観光パンフレット・ポスター
観光連盟やDMOのHP
インターネット・アプリ
",1,0,0,1,1,1,0,0,0,0,0,0,0,0,"レンタカー
飛行機
",0,1,0,0,1,0,0,"レンタカー
",0,0,0,0,とても満足,"人が優しい。
案内がとてもわかりやすい","20,000円以上 30,000円未満","10,000円以上 20,000円未満","20,000円以上 30,000円未満",2～5回目,丸岡城,,大本山永平寺,,"5,000円以上 10,000円未満",とても満足,落ち着いていて大好きですね,感じなかった,,10,,"けんぞうそばさんには、必ず行きます。
ソースカツ丼も大好きですね。
次の地元の美味しいものを調べて食べるつもりです。",また行きたい（1年以内）,"このままの静かさが好きなので、現状維持ではダメですか。
お願いします",,,
125609,,女,1961,62,60代,神奈川県,横浜市南区,300万円以上 400万円未満,mobile/iphone,2023-07-01 19:01:40,7月,あわら湯のまち エリア,17.あわら湯のまち エリア,あわら市,あわら市・坂井市,,2泊,2泊,三国・あわらエリア（あわら市・坂井市）,福井県外には宿泊しない,夫婦2人,"宿でのんびり過ごす
温泉や露天風呂
地元の美味しいものを食べる
花見や紅葉などの自然鑑賞
名所、旧跡の観光
買い物、アウトレット
",1,1,1,1,1,0,1,0,0,0,0,0,0,0,0,0,0,0,"観光パンフレット・ポスター
インターネット・アプリ
",0,0,0,1,0,1,0,0,0,0,0,0,0,0,"レンタカー
",0,1,0,0,0,0,0,"レンタカー
",0,0,0,0,満足,"道はよく整備されて、行き先の表示も分かりやすくてとても助かります。
道の駅が好きなので、複数利用しましたが綺麗で買い物がしやすいです。
皆さんに感謝しています。","30,000円以上 40,000円未満","50,000円以上 100,000円未満","10,000円以上 20,000円未満",初めて,大本山永平寺,,選択なし/該当施設なし,,"20,000円以上 30,000円未満",とても満足,"つるやさんの建物は、私たちの年代には懐かしく、居心地がとても良いです。
お湯もいつまでもポカポカで、忘れられません。",感じなかった,,10,"がさエビとフルーツ。
エビは、現地でしか食べられない貴重なものですし、フルーツ栽培が盛んな事を初めて知りましたので、みんなに伝えたいです。",フルーツ好きなので、梨狩りができたら嬉しいです。,また行きたい（1年以内）,"青森県で体験したのですが、酒蔵まつりは楽しかったです。
企画していただけたら嬉しいです。",えちぜん鉄道 松岡駅 エリア,とても満足,"とにかく人が優しく温かい事です。
どんな事でも親切に教えて下さり嬉しい限りです。
がさエビのお刺身は、本当に美味しかったです。"
125609,,女,1961,62,60代,神奈川県,横浜市南区,300万円以上 400万円未満,mobile/iphone,2023-11-25 10:58:14,11月,フルーツライン エリア,18.フルーツライン エリア,あわら市,あわら市・坂井市,,3泊,2泊,三国・あわらエリア（あわら市・坂井市）,石川県白井市,夫婦2人,"宿でのんびり過ごす
温泉や露天風呂
地元の美味しいものを食べる
花見や紅葉などの自然鑑賞
名所、旧跡の観光
テーマパーク（遊園地、動物園、博物館など）
買い物、アウトレット
",1,1,1,1,1,1,1,0,0,0,0,0,0,0,0,0,0,0,"観光展・物産展
友人・知人
",1,0,0,0,0,0,0,0,0,0,1,0,0,0,"レンタカー
",0,1,0,0,0,0,0,"レンタカー
",0,0,0,0,とても満足,"宿の方と親戚のように仲良くして頂き、年に一度が二度になりました。
他の店や観光地の方もとても心優しい方ばかりで、日頃の疲れが癒されます。ありがとうございます。","50,000円以上 100,000円未満","20,000円以上 30,000円未満","10,000円以上 20,000円未満",2～5回目,丸岡城,,東尋坊,,"3,000円以上 5,000円未満",とても満足,"商品の並べ方が、分かりやすい。


　　　",感じなかった,,10,そばの美味しさと人の優しさです。,"焼き芋の販売をお願いします。
複数種類あれば、食べ比べができて楽しく買い食いできます。",また行きたい（1年以内）,ほどほどの宣伝で、そっとしておいて欲しい気持ちも有りますが、夏の良さはまだ知らない人が多い気がします。,えちぜん鉄道 松岡駅 エリア,とても満足,知らない商品の説明がとても親切で分かりやすいです。助かりました。
