会員ID,登録施設,性別,生まれ年,回答時の年齢,年代,都道府県,会員市町村,世帯年収,UA,回答日時,回答月,回答エリア,回答エリア2,市町村,6分類,DMO,宿泊数（全体）,宿泊数（県内）,宿泊エリア（県内）,宿泊エリア（県外）,同行者,訪問目的ALL,宿でのんびり過ごす,温泉や露天風呂,地元の美味しいものを食べる,花見や紅葉などの自然鑑賞,名所、旧跡の観光,テーマパーク（遊園地、動物園、博物館など）,買い物、アウトレット,お祭りやイベントへの参加・見物,スポーツ観戦や芸能鑑賞（コンサート等）,アウトドア（海水浴、釣り、登山など）,まちあるき、都市散策,各種体験（手作り、果物狩りなど）,スキー・スノボ、マリンスポーツ,その他スポーツ（ゴルフ、テニスなど）,ドライブ・ツーリング,友人・親戚を尋ねる,出張など仕事関係,その他,情報収集ALL,観光展・物産展,新聞・雑誌・ガイドブック,TV・ラジオ番組やCM,観光パンフレット・ポスター,観光連盟やDMOのHP,インターネット・アプリ,Twitter,Instagram,Facebook,ブログ,友人・知人,観光協会等の案内所,タクシードライバーや地元の人,宿泊施設,福井県までの交通手段ALL,自家用車,レンタカー,新幹線,在来線,飛行機,旅行会社ツアーバス,県外から訪れていない（福井県在住）,福井県内での交通手段ALL,タクシー,路線バス,徒歩,レンタサイクル,福井県内での交通手段の満足度,福井県内での交通手段の満足度の理由,宿泊費,交通費,県内消費額,エリア訪問回数,アンケート回答前に訪問した主な場所,アンケート回答前に訪問した主な場所FA,アンケート回答後に訪問する予定の主な場所,アンケート回答後に訪問する予定の主な場所FA,エリア総消費額,満足度,満足度の理由,不便さ,不便さの内容,NPS,推奨項目,施設に求めるもの,今後の来訪意向,福井県に求めるもの
116246,web,女,1990,32,30代,大阪府,河内長野市,400万円以上 500万円未満,mobile/iphone,2022-10-09 15:56:45,10月,あわら温泉 エリア,11.あわら温泉 エリア,あわら市,あわら市・坂井市,,1泊,1泊,三国・あわらエリア（あわら市・坂井市）,福井県外には宿泊しない,自分ひとり,"宿でのんびり過ごす
温泉や露天風呂
地元の美味しいものを食べる
名所、旧跡の観光
まちあるき、都市散策
",1,1,1,0,1,0,0,0,0,0,1,0,0,0,0,0,0,0,"新聞・雑誌・ガイドブック
観光パンフレット・ポスター
インターネット・アプリ
Instagram
観光協会等の案内所
",0,1,0,1,0,1,0,1,0,0,0,1,0,0,"在来線
",0,0,0,1,0,0,0,"在来線
",0,0,0,0,とても満足,芦原温泉に直接行けたから。女性専用席があったから,"10,000円以上 20,000円未満","5,000円以上 10,000円未満","10,000円以上 20,000円未満",初めて,丸岡城,,東尋坊,永平寺,"1,000円以上 3,000円未満",満足,,感じた,"ひとり旅用の宿が少なかったのと、温泉街の活気がもうちょっとあればもっといいかなと思いました。
ひとり旅でも贅沢な宿に泊まれ、いろんなお店に気軽に入れるようになるともっといいと思います。",7,,お土産屋さんをもう少し多くしたらいいと思います。,機会があれば行きたい,
