会員ID,登録施設,性別,生まれ年,回答時の年齢,年代,都道府県,会員市町村,世帯年収,UA,回答日時,回答月,回答エリア,回答エリア2,市町村,6分類,DMO,宿泊数（全体）,宿泊数（県内）,宿泊エリア（県内）,宿泊エリア（県外）,同行者,訪問目的ALL,宿でのんびり過ごす,温泉や露天風呂,地元の美味しいものを食べる,花見や紅葉などの自然鑑賞,名所、旧跡の観光,テーマパーク（遊園地、動物園、博物館など）,買い物、アウトレット,お祭りやイベントへの参加・見物,スポーツ観戦や芸能鑑賞（コンサート等）,アウトドア（海水浴、釣り、登山など）,まちあるき、都市散策,各種体験（手作り、果物狩りなど）,スキー・スノボ、マリンスポーツ,その他スポーツ（ゴルフ、テニスなど）,ドライブ・ツーリング,友人・親戚を尋ねる,出張など仕事関係,その他,情報収集ALL,観光展・物産展,新聞・雑誌・ガイドブック,TV・ラジオ番組やCM,観光パンフレット・ポスター,観光連盟やDMOのHP,インターネット・アプリ,Twitter,Instagram,Facebook,ブログ,友人・知人,観光協会等の案内所,タクシードライバーや地元の人,宿泊施設,福井県までの交通手段ALL,自家用車,レンタカー,新幹線,在来線,飛行機,旅行会社ツアーバス,県外から訪れていない（福井県在住）,福井県内での交通手段ALL,タクシー,路線バス,徒歩,レンタサイクル,福井県内での交通手段の満足度,福井県内での交通手段の満足度の理由,宿泊費,交通費,県内消費額,エリア訪問回数,アンケート回答前に訪問した主な場所,アンケート回答前に訪問した主な場所FA,アンケート回答後に訪問する予定の主な場所,アンケート回答後に訪問する予定の主な場所FA,エリア総消費額,満足度,満足度の理由,不便さ,不便さの内容,NPS,推奨項目,施設に求めるもの,今後の来訪意向,福井県に求めるもの,登録エリア,満足度(商品・サービス),満足度(商品・サービス)の理由
118895,越前陶芸村 エリア,女,1971,51,50代,三重県,伊勢市,200万円以上 300万円未満,mobile/iphone,2022-10-12 16:17:36,10月,越前陶芸村 エリア,41.越前陶芸村 エリア,越前町,丹南,,1泊,1泊,越前エリア（越前市・越前町・鯖江市・池田町・南越前町）,福井県外には宿泊しない,友人,"宿でのんびり過ごす
地元の美味しいものを食べる
まちあるき、都市散策
",1,0,1,0,0,0,0,0,0,0,1,0,0,0,0,0,0,0,"観光協会等の案内所
",0,0,0,0,0,0,0,0,0,0,0,1,0,0,"自家用車
",1,0,0,0,0,0,0,"自家用車
",0,0,0,0,満足,,"10,000円以上 20,000円未満","5,000円以上 10,000円未満","5,000円以上 10,000円未満",初めて,選択なし/該当施設なし,越前海岸　おあげ谷口屋,選択なし/該当施設なし,,"3,000円以上 5,000円未満",満足,,感じなかった,,10,料理旅館樹香苑,,機会があれば行きたい,,,,
118827,web,男,1987,35,30代,滋賀県,草津市,800万円以上 900万円未満,mobile/iphone,2022-10-12 15:19:56,10月,芝政ワールド エリア,07.芝政ワールド エリア,坂井市,あわら市・坂井市,(一社)DMOさかい観光局,2泊,2泊,三国・あわらエリア（あわら市・坂井市）,福井県外には宿泊しない,学校関係（修学旅行・社会科見学等）,"温泉や露天風呂
地元の美味しいものを食べる
テーマパーク（遊園地、動物園、博物館など）
買い物、アウトレット
",0,1,1,0,0,1,1,0,0,0,0,0,0,0,0,0,0,0,"観光展・物産展
新聞・雑誌・ガイドブック
観光協会等の案内所
",1,1,0,0,0,0,0,0,0,0,0,1,0,0,"旅行会社ツアーバス
",0,0,0,0,0,1,0,"旅行会社ツアーバス
",0,0,0,0,満足,移動が楽,"30,000円以上 40,000円未満","3,000円以上 5,000円未満","5,000円以上 10,000円未満",2～5回目,選択なし/該当施設なし,,選択なし/該当施設なし,,"5,000円以上 10,000円未満",どちらでもない,,感じた,できないアトラクションがあった。スタッフの数が足りなくて待ち時間があった。,6,,,,,,,
118815,越前大野城・城下町 エリア,女,1998,24,20代,岐阜県,羽島市,400万円以上 500万円未満,mobile/iphone,2022-10-12 15:07:03,10月,越前大野城・城下町 エリア,15.越前大野城・城下町 エリア,大野市,勝山市・大野市,,1泊,1泊,奥越前エリア（勝山市・大野市）,福井県外には宿泊しない,夫婦2人,"地元の美味しいものを食べる
名所、旧跡の観光
",0,0,1,0,1,0,0,0,0,0,0,0,0,0,0,0,0,0,"TV・ラジオ番組やCM
",0,0,1,0,0,0,0,0,0,0,0,0,0,0,"自家用車
",1,0,0,0,0,0,0,"自家用車
",0,0,0,0,満足,,"20,000円以上 30,000円未満","20,000円以上 30,000円未満","20,000円以上 30,000円未満",初めて,越前大仏,,福井県立恐竜博物館,,"20,000円以上 30,000円未満",満足,,感じなかった,,8,,,また行きたい（1年以内）,,,,
118895,越前陶芸村 エリア,女,1971,51,50代,三重県,伊勢市,200万円以上 300万円未満,mobile/iphone,2022-10-13 11:30:06,10月,道の駅「越前」 エリア,38.道の駅「越前」 エリア,越前町,丹南,,1泊,1泊,越前エリア（越前市・越前町・鯖江市・池田町・南越前町）,福井県外には宿泊しない,友人,"まちあるき、都市散策
",0,0,0,0,0,0,0,0,0,0,1,0,0,0,0,0,0,0,"観光協会等の案内所
",0,0,0,0,0,0,0,0,0,0,0,1,0,0,"自家用車
",1,0,0,0,0,0,0,"自家用車
",0,0,0,0,,,"10,000円以上 20,000円未満","5,000円以上 10,000円未満","5,000円以上 10,000円未満",初めて,選択なし/該当施設なし,陶芸の里　樹香林,選択なし/該当施設なし,,"3,000円以上 5,000円未満",満足,,感じなかった,,4,,,機会があれば行きたい,,,,
118844,web,女,1996,26,20代,愛知県,津島市,200万円以上 300万円未満,mobile/iphone,2022-10-23 09:57:07,10月,スキージャム勝山 エリア,21.スキージャム勝山 エリア,勝山市,勝山市・大野市,勝山市観光まちづくり(株),1泊,1泊,奥越前エリア（勝山市・大野市）,福井県外には宿泊しない,小学生以下連れの家族,"テーマパーク（遊園地、動物園、博物館など）
",0,0,0,0,0,1,0,0,0,0,0,0,0,0,0,0,0,0,"インターネット・アプリ
",0,0,0,0,0,1,0,0,0,0,0,0,0,0,"自家用車
",1,0,0,0,0,0,0,"自家用車
",0,0,0,0,,,"40,000円以上 50,000円未満",使わない,"10,000円以上 20,000円未満",初めて,選択なし/該当施設なし,,選択なし/該当施設なし,,使わない,とても満足,,感じなかった,,10,,,また行きたい（1年以内）,,,,
118869,,男,1956,68,60代,愛知県,名古屋市南区,100万円以上 200万円未満,mobile/android,2024-05-05 15:53:06,5月,紫式部公園 エリア,41.紫式部公園 エリア,越前市,丹南,,1泊,1泊,越前エリア（越前市・越前町・鯖江市・池田町・南越前町）,石川県加賀市,夫婦2人,"温泉や露天風呂
名所、旧跡の観光
",0,1,0,0,1,0,0,0,0,0,0,0,0,0,0,0,0,0,"新聞・雑誌・ガイドブック
観光パンフレット・ポスター
",0,1,0,1,0,0,0,0,0,0,0,0,0,0,"在来線
",0,0,0,0,0,0,0,"路線バス
",0,1,0,0,,,"20,000円以上 30,000円未満","20,000円以上 30,000円未満","30,000円以上 40,000円未満",初めて,氣比神宮,,一乗谷朝倉氏遺跡,,"5,000円以上 10,000円未満",満足,良く整備されてました,感じた,出口が少なく、遠回りしました,5,紫式部を、知ることになりました,公園内にできれば、説明案内書あれば良いです,また行きたい（1年以内）,在来線が、敦賀止まりのため不便になりました。敦賀からバスの充実あればと思います,web,満足,公園のガイドボランティアさんの説明が、少し長すぎました
