会員ID,登録施設,性別,生まれ年,回答時の年齢,年代,都道府県,会員市町村,世帯年収,UA,回答日時,回答月,回答エリア,回答エリア2,市町村,6分類,DMO,宿泊数（全体）,宿泊数（県内）,宿泊エリア（県内）,宿泊エリア（県外）,同行者,訪問目的ALL,宿でのんびり過ごす,温泉や露天風呂,地元の美味しいものを食べる,花見や紅葉などの自然鑑賞,名所、旧跡の観光,テーマパーク（遊園地、動物園、博物館など）,買い物、アウトレット,お祭りやイベントへの参加・見物,スポーツ観戦や芸能鑑賞（コンサート等）,アウトドア（海水浴、釣り、登山など）,まちあるき、都市散策,各種体験（手作り、果物狩りなど）,スキー・スノボ、マリンスポーツ,その他スポーツ（ゴルフ、テニスなど）,ドライブ・ツーリング,友人・親戚を尋ねる,出張など仕事関係,その他,情報収集ALL,観光展・物産展,新聞・雑誌・ガイドブック,TV・ラジオ番組やCM,観光パンフレット・ポスター,観光連盟やDMOのHP,インターネット・アプリ,Twitter,Instagram,Facebook,ブログ,友人・知人,観光協会等の案内所,タクシードライバーや地元の人,宿泊施設,福井県までの交通手段ALL,自家用車,レンタカー,新幹線,在来線,飛行機,旅行会社ツアーバス,県外から訪れていない（福井県在住）,福井県内での交通手段ALL,タクシー,路線バス,徒歩,レンタサイクル,福井県内での交通手段の満足度,福井県内での交通手段の満足度の理由,宿泊費,交通費,県内消費額,エリア訪問回数,アンケート回答前に訪問した主な場所,アンケート回答前に訪問した主な場所FA,アンケート回答後に訪問する予定の主な場所,アンケート回答後に訪問する予定の主な場所FA,エリア総消費額,満足度,満足度の理由,不便さ,不便さの内容,NPS,推奨項目,施設に求めるもの,今後の来訪意向,福井県に求めるもの
121755,うるしの里 エリア,女,1979,43,40代,石川県,河北郡,400万円以上 500万円未満,mobile/iphone,2022-10-22 13:54:18,10月,丸岡城 エリア,08.丸岡城 エリア,坂井市,あわら市・坂井市,(一社)DMOさかい観光局,日帰り,福井県内には宿泊しない,福井県内には宿泊しない,石川県金沢市,夫婦2人,"ドライブ・ツーリング
",0,0,0,0,0,0,0,0,0,0,0,0,0,0,1,0,0,0,"観光パンフレット・ポスター
",0,0,0,1,0,0,0,0,0,0,0,0,0,0,"自家用車
",1,0,0,0,0,0,0,"自家用車
",0,0,0,0,満足,お城がみれたから,"5,000円以上 10,000円未満","3,000円以上 5,000円未満","5,000円以上 10,000円未満",初めて,金津創作の森,,越前松島水族館,,"3,000円以上 5,000円未満",満足,紅葉が綺麗で夫婦で散策しながら楽しい時間をすごせたから,感じなかった,,5,素敵な庭園と程よい城散策,謎解きなど頭を使ってたのしめるもの,機会があれば行きたい,カニ三昧のランチラリーなどあれば
121755,うるしの里 エリア,女,1979,43,40代,石川県,河北郡,400万円以上 500万円未満,mobile/iphone,2022-10-22 11:27:58,10月,めがねミュージアム エリア,33.めがねミュージアム エリア,鯖江市,丹南,,日帰り,福井県内には宿泊しない,福井県内には宿泊しない,石川県金沢市,夫婦2人,"ドライブ・ツーリング
",0,0,0,0,0,0,0,0,0,0,0,0,0,0,1,0,0,0,"観光パンフレット・ポスター
",0,0,0,1,0,0,0,0,0,0,0,0,0,0,"自家用車
",1,0,0,0,0,0,0,"自家用車
",0,0,0,0,満足,かわいいメガネのクッキーが印象的でした,"5,000円以上 10,000円未満","3,000円以上 5,000円未満","5,000円以上 10,000円未満",初めて,越前和紙の里,,越前がにミュージアム,,"3,000円以上 5,000円未満",満足,,感じなかった,,5,親,メガネにまつわる簡単なワークショップ,機会があれば行きたい,
121755,うるしの里 エリア,女,1979,43,40代,石川県,河北郡,400万円以上 500万円未満,mobile/iphone,2022-10-22 11:03:13,10月,うるしの里 エリア,34.うるしの里 エリア,鯖江市,丹南,,日帰り,福井県内には宿泊しない,福井県内には宿泊しない,石川県金沢市,夫婦2人,"花見や紅葉などの自然鑑賞
買い物、アウトレット
まちあるき、都市散策
ドライブ・ツーリング
",0,0,0,1,0,0,1,0,0,0,1,0,0,0,1,0,0,0,"観光パンフレット・ポスター
",0,0,0,1,0,0,0,0,0,0,0,0,0,0,"自家用車
",1,0,0,0,0,0,0,"自家用車
",0,0,0,0,満足,漆のすばらしさを夫婦で知れて楽しかった,"5,000円以上 10,000円未満","3,000円以上 5,000円未満","5,000円以上 10,000円未満",初めて,越前和紙の里,,越前がにミュージアム,,"3,000円以上 5,000円未満",満足,,感じなかった,,3,友達,のんびりとした空間で過ごせるオープンカフェ,機会があれば行きたい,地産地消で美味しいカフェ
