会員ID,登録施設,性別,生まれ年,回答時の年齢,年代,都道府県,会員市町村,世帯年収,UA,回答日時,回答月,回答エリア,回答エリア2,市町村,6分類,DMO,宿泊数（全体）,宿泊数（県内）,宿泊エリア（県内）,宿泊エリア（県外）,同行者,訪問目的ALL,宿でのんびり過ごす,温泉や露天風呂,地元の美味しいものを食べる,花見や紅葉などの自然鑑賞,名所、旧跡の観光,テーマパーク（遊園地、動物園、博物館など）,買い物、アウトレット,お祭りやイベントへの参加・見物,スポーツ観戦や芸能鑑賞（コンサート等）,アウトドア（海水浴、釣り、登山など）,まちあるき、都市散策,各種体験（手作り、果物狩りなど）,スキー・スノボ、マリンスポーツ,その他スポーツ（ゴルフ、テニスなど）,ドライブ・ツーリング,友人・親戚を尋ねる,出張など仕事関係,その他,情報収集ALL,観光展・物産展,新聞・雑誌・ガイドブック,TV・ラジオ番組やCM,観光パンフレット・ポスター,観光連盟やDMOのHP,インターネット・アプリ,Twitter,Instagram,Facebook,ブログ,友人・知人,観光協会等の案内所,タクシードライバーや地元の人,宿泊施設,福井県までの交通手段ALL,自家用車,レンタカー,新幹線,在来線,飛行機,旅行会社ツアーバス,県外から訪れていない（福井県在住）,福井県内での交通手段ALL,タクシー,路線バス,徒歩,レンタサイクル,福井県内での交通手段の満足度,福井県内での交通手段の満足度の理由,宿泊費,交通費,県内消費額,エリア訪問回数,アンケート回答前に訪問した主な場所,アンケート回答前に訪問した主な場所FA,アンケート回答後に訪問する予定の主な場所,アンケート回答後に訪問する予定の主な場所FA,エリア総消費額,満足度,満足度の理由,不便さ,不便さの内容,NPS,推奨項目,施設に求めるもの,今後の来訪意向,福井県に求めるもの,登録エリア,満足度(商品・サービス),満足度(商品・サービス)の理由
121811,JR敦賀駅前 エリア,女,1986,36,30代,福井県,福井市,"1,000万円以上 1,200万円未満",mobile/iphone,2022-10-22 15:44:58,10月,JR敦賀駅前 エリア,48.JR敦賀駅前 エリア,敦賀市,嶺南東部,,1泊,1泊,嶺南エリア（敦賀市・美浜町・若狭町・小浜市・おおい町・高浜町）,福井県外には宿泊しない,小学生以下連れの家族,"宿でのんびり過ごす
地元の美味しいものを食べる
",1,0,1,0,0,0,0,0,0,0,0,0,0,0,0,0,0,0,"TV・ラジオ番組やCM
インターネット・アプリ
",0,0,1,0,0,1,0,0,0,0,0,0,0,0,"県外から訪れていない（福井県在住）
",1,0,0,0,0,0,1,"自家用車
",0,0,0,0,,,"10,000円以上 20,000円未満","3,000円以上 5,000円未満","5,000円以上 10,000円未満",2～5回目,選択なし/該当施設なし,,敦賀赤レンガ倉庫,,"1,000円以上 3,000円未満",とても満足,"スタバやパン屋があり、広い芝生のところで飲食することができたからです。
またお土産店も併設されており、駅すぐでお土産を買うこともできたからです。",感じなかった,,8,嶺南は魚料理がとても美味しいということです。自然豊かでのんびりと過ごすことができました。,"子供が遊べるような遊具を作ってほしいです。
また大人はゆっくり座りながら、子供を見ていられるスペースもあったら良いなと思います！",福井県在住,老若男女問わず、満喫できる飲食やお土産があることです。自然、季節にあった飲食やお土産があると更に魅力かと思います。,,,
121811,,女,1986,38,30代,福井県,福井市,"1,000万円以上 1,200万円未満",mobile/iphone,2024-03-21 16:07:41,3月,道の駅「若狭おばま」 エリア,68.道の駅「若狭おばま」 エリア,小浜市,嶺南西部,(株)まちづくり小浜,1泊,1泊,嶺南エリア（敦賀市・美浜町・若狭町・小浜市・おおい町・高浜町）,福井県外には宿泊しない,小学生以下連れの家族,"宿でのんびり過ごす
温泉や露天風呂
買い物、アウトレット
ドライブ・ツーリング
",1,1,0,0,0,0,1,0,0,0,0,0,0,0,1,0,0,0,"インターネット・アプリ
",0,0,0,0,0,1,0,0,0,0,0,0,0,0,"県外から訪れていない（福井県在住）
",1,0,0,0,0,0,1,"自家用車
",0,0,0,0,とても満足,広々とした駐車場があったから。,"20,000円以上 30,000円未満","3,000円以上 5,000円未満","5,000円以上 10,000円未満",初めて,きのこの森,ハマベリー,選択なし/該当施設なし,,"1,000円以上 3,000円未満",とても満足,駐車場、施設が綺麗でゆったりと過ごせたから。,感じなかった,,8,"食が美味しいこと。
海の幸がたくさんあります！",ゆったりと出来る店内でゆっくり買い物をすることができます。施設も綺麗で落ち着きます。,福井県在住,"子供も大人も喜べるものがあるところです。
福井の天気に左右されない場所があると良いなと思います。",JR敦賀駅前 エリア,とても満足,施設は綺麗で色々なお土産があったから。
